物品ID	物品名称	物品类型	稀有度	物品介绍
1913	历战的龙鳞【苍】	素材	9	历战苍火龙的大师级素材。在聚魔之地争夺霸权的强者所持有的，经过强化的素材。
1914	勇壮的弯曲角	素材	9	角龙大师级素材。栖息在聚魔之地的个体，使其特质更加强化的素材。
1915	历战的弯曲角	素材	9	历战角龙的大师级素材。在聚魔之地争夺霸权的强者所持有的，经过强化的素材。
1916	暴君的黑卷角	素材	9	黑角龙大师级素材。栖息在聚魔之地的个体，使其特质更加强化的素材。
1917	历战的黑卷角	素材	9	历战黑角龙的大师级素材。在聚魔之地争夺霸权的强者所持有的，经过强化的素材。
1918	暗杀者的刃翼	素材	9	迅龙大师级素材。栖息在聚魔之地的个体，使其特质更加强化的素材。
1919	历战的刃翼	素材	9	历战迅龙的大师级素材。在聚魔之地争夺霸权的强者所持，经过强化的素材。
1920	灼炎的断剑尾	素材	9	斩龙大师级素材。栖息在聚魔之地的个体，使其特质更加强化的素材。
1921	历战的断剑尾	素材	9	历战斩龙的大师级素材。在聚魔之地争夺霸权的强者所持有的，经过强化的素材。
1922	明锐的斩铁尾	素材	9	硫斩龙大师级素材。栖息在聚魔之地的个体，使其特质更加强化的素材。
1923	历战的斩铁尾	素材	9	历战硫斩龙的大师级素材。在聚魔之地争夺霸权的强者所持有的，经过强化的素材。
1924	亮泽的黑曜甲	素材	9	碎龙的大师级素材。栖息在聚魔之地的个体，使其特质更加强化的素材。
1925	历战的黑曜甲	素材	9	历战碎龙的大师级素材。在聚魔之地争夺霸权的强者所持有，被强化过的素材。
1926	强者的龙颚	素材	9	轰龙大师级素材。栖息在聚魔之地的个体，使其特质更加强化的素材。
1927	历战的龙颚	素材	9	历战轰龙的大师级素材。在聚魔之地争夺霸权的强者所持，经过强化的素材。
1928	战栗的黑龙颚	素材	9	黑轰龙大师级素材。栖息在聚魔之地的个体，使其特质更加强化的素材。
1929	历战的黑龙颚	素材	9	历战黑轰龙的大师级素材。在聚魔之地争夺霸权的强者所持有的，经过强化的素材。
1930	满溢雷电壳	素材	9	雷狼龙大师级素材。栖息在聚魔之地的个体，使其特质更加强化的素材。
1931	历战的雷电壳	素材	9	历战雷狼龙的大师级素材。在聚魔之地争夺霸权的强者所持有的，经过强化的素材。
1932	红莲的爆鳞	素材	10	红莲爆鳞龙的大师级素材。栖息在聚魔之地的个体，使其特质更加强化的素材。
1933	历战的爆鳞	素材	10	历战红莲爆鳞龙的大师级素材。在聚魔之地争夺霸权的强者所持有，被强化过的素材。
1934	染血漆黑皮	素材	10	惶怒恐暴龙大师级素材。栖息在聚魔之地的个体，使其特质更加强化的素材。
1935	历战的漆黑皮	素材	10	历战惶怒恐暴龙的大师级素材。在聚魔之地争夺霸权的强者所持有的，经过强化的素材。
1936	庄严的苍角	素材	10	麒麟大师级素材。栖息在聚魔之地的个体，使其特质更加强化的素材。
1937	历战的苍角	素材	10	历战麒麟的大师级素材。在聚魔之地争夺霸权的强者所持有的，经过强化的素材。
1938	狱炎的鬃毛	素材	10	炎王龙大师级素材。栖息在聚魔之地的个体，使其特质更加强化的素材。
1939	历战的红鬃毛	素材	10	历战炎王龙的大师级素材。在聚魔之地争夺霸权的强者所持有的，经过强化的素材。
1940	呼风唤雨的钢翼	素材	10	钢龙大师级素材。栖息在聚魔之地的个体，使其特质更加强化的素材。
1941	历战的钢翼	素材	10	历战钢龙的大师级素材。在聚魔之地争夺霸权的强者所持有的，经过强化的素材。
1942	苍炎的鬃毛	素材	10	炎妃龙大师级素材。栖息在聚魔之地的个体，使其特质更加强化的素材。
1943	历战的苍鬃毛	素材	10	历战炎妃龙的大师级素材。在聚魔之地争夺霸权的强者所持有的，经过强化的素材。
1944	极光的冠角	素材	10	冰呪龙大师级素材。栖息在聚魔之地的个体，使其特质更加强化的素材。
1945	历战的冠角	素材	10	历战冰呪龙的大师级素材。在聚魔之地争夺霸权的强者所持有的，经过强化的素材。
1946	宵暗的昏牙	素材	10	雾瘴尸套龙大师级素材。栖息在聚魔之地的个体，使其特质更加强化的素材。
1947	历战的昏牙	素材	10	历战雾瘴尸套龙的大师级素材。在聚魔之地争夺霸权的强者所持有的，经过强化的素材。
1948	幻惑的特上皮	素材	10	溟波龙大师级素材。栖息在聚魔之地的个体，使其特质更加强化的素材。
1949	历战的幻惑皮	素材	10	历战溟波龙的大师级素材。在聚魔之地争夺霸权的强者所持有的，经过强化的素材。
1950	生者必灭的大刚角	素材	10	歼世灭尽龙大师级素材。栖息在聚魔之地的个体，使其特质更加强化的素材。
1951	历战的歼灭角	素材	10	历战歼世灭尽龙的大师级素材。在聚魔之地争夺霸权的强者所持，被强化过的素材。
1952	月光的龙鳞	素材	10	金火龙大师级素材。栖息在聚魔之地的个体，使其特质更加强化的素材。
1953	历战的龙鳞【金】	素材	10	历战金火龙的大师级素材。在聚魔之地争夺霸权的强者所持有，被强化过的素材。
1954	烈日的龙鳞	素材	10	银火龙大师级素材。栖息在聚魔之地的个体，使其特质更加强化的素材。
1955	历战的龙鳞【银】	素材	10	历战银火龙的大师级素材。在聚魔之地争夺霸权的强者所持有，被强化过的素材。
1956	涌溢的灭龙壳	素材	10	狱狼龙大师级素材。栖息在聚魔之地的个体，使其特质更加强化的素材。
1957	历战的灭龙壳	素材	10	历战狱狼龙的大师级素材。在聚魔之地争夺霸权的强者所持，被强化过的素材。
1958	充满斗气的煌毛	素材	10	金狮子的大师级素材。栖息在聚魔之地的个体，使其特质更加强化的素材。
1959	历战的煌毛	素材	10	历战金狮子的大师级素材。在聚魔之地争夺霸权的强者所持有，被强化过的素材。
1960	Unavailable	物品	3	Unavailable
1961	Unavailable	物品	3	Unavailable
1962	Unavailable	物品	3	Unavailable
1963	Unavailable	物品	3	Unavailable
1964	装备超级会心镜	物品	0	切换已安装超级会心镜之重弩炮的瞄准方法。
1965	古代龙人的大票据	素材	5	新大陆的古代龙人所使用的票据。可在神秘炼金的设施中，交换便利的道具。
1966	蒸气票	素材	10	对蒸气机关管理所有所贡献者，技术班队长给予的票。交给加工屋就会...？！
1967	特大龙脉炭	素材	6	蕴含有地脉能源的特别石炭。质量之佳更胜于其巨大外形，是最高级的燃料。能让人一辈子不愁吃穿……？
1968	转福珠【3】	装饰品	10	能够提升转祸为福技能的装饰品。
1969	守势珠【2】	装饰品	9	能够提升攻击守势技能的装饰品。
1970	耐暑珠【2】	装饰品	8	能够提升热伤害无效技能的装饰品。
1971	耐火珠2【4】	装饰品	8	能够提升火耐性技能的装饰品。
1972	耐水珠2【4】	装饰品	8	能够提升水耐性技能的装饰品。
1973	耐冰珠2【4】	装饰品	8	能够提升冰耐性技能的装饰品。
1974	耐雷珠2【4】	装饰品	8	能够提升雷耐性技能的装饰品。
1975	耐龙珠2【4】	装饰品	8	能够提升龙耐性技能的装饰品。
1976	火炎珠2【4】	装饰品	10	能够提升火属性攻击强化技能的装饰品。
1977	流水珠2【4】	装饰品	10	能够提升水属性攻击强化技能的装饰品。
1978	冰结珠2【4】	装饰品	10	能够提升冰属性攻击强化技能的装饰品。
1979	雷光珠2【4】	装饰品	10	能够提升雷属性攻击强化技能的装饰品。
1980	破龙珠2【4】	装饰品	10	能够提升龙属性攻击强化技能的装饰品。
1981	毒珠2【4】	装饰品	10	能够提升毒属性攻击强化技能的装饰品。
1982	麻痹珠2【4】	装饰品	10	能够提升麻痹属性强化技能的装饰品。
1983	睡眠珠2【4】	装饰品	10	能够提升睡眠属性强化技能的装饰品。
1984	爆破珠2【4】	装饰品	10	能够提升爆破属性强化技能的装饰品。
1985	耐火珠3【4】	装饰品	10	能够提升火耐性技能的装饰品。
1986	耐水珠3【4】	装饰品	10	能够提升水耐性技能的装饰品。
1987	耐冰珠3【4】	装饰品	10	能够提升冰耐性技能的装饰品。
1988	耐雷珠3【4】	装饰品	10	能够提升雷耐性技能的装饰品。
1989	耐龙珠3【4】	装饰品	10	能够提升龙耐性技能的装饰品。
1990	耐毒珠2【4】	装饰品	8	能够提升毒耐性技能的装饰品。
1991	耐麻珠2【4】	装饰品	8	能够提升麻痹耐性技能的装饰品。
1992	耐眠珠2【4】	装饰品	8	能够提升睡眠耐性技能的装饰品。
1993	耐绝珠2【4】	装饰品	8	能够提升昏厥耐性技能的装饰品。
1994	耐爆珠2【4】	装饰品	8	能够提升爆破异常耐性技能的装饰品。
1995	耐裂珠2【4】	装饰品	8	能够提升裂伤耐性技能的装饰品。
1996	耐防珠2【4】	装饰品	8	能够提升防御力下降耐性技能的装饰品。
1997	耐瘴珠2【4】	装饰品	8	能够提升瘴气耐性技能的装饰品。
1998	无食珠2【4】	装饰品	8	能够提升饥饿耐性技能的装饰品。
1999	早复珠2【4】	装饰品	8	能够提升回复速度技能的装饰品。
2000	潜伏珠2【4】	装饰品	8	能够提升潜伏技能的装饰品。
2001	威吓珠2【4】	装饰品	8	能够提升威吓技能的装饰品。
2002	指示珠2【4】	装饰品	8	能够提升指示随从技能的装饰品。
2003	潜伏珠3【4】	装饰品	8	能够提升潜伏技能的装饰品。
2004	威吓珠3【4】	装饰品	8	能够提升威吓技能的装饰品。
2005	指示珠3【4】	装饰品	8	能够提升指示随从技能的装饰品。
2006	特射珠2【4】	装饰品	11	能够提升特殊射击强化技能的装饰品。
2007	炮手珠2【4】	装饰品	8	能够提升炮击手技能的装饰品。
2008	植学珠2【4】	装饰品	8	能够提升植生学技能的装饰品。
2009	地学珠2【4】	装饰品	8	能够提升地质学技能的装饰品。
2010	环境珠2【4】	装饰品	8	能够提升环境利用知识技能的装饰品。
2011	沼渡珠2【4】	装饰品	8	能够提升适应水场·深雪技能的装饰品。
2012	标本珠2【4】	装饰品	8	能够提升昆虫标本达人技能的装饰品。
2013	鼓笛珠2【4】	装饰品	8	能够提升吹笛名人技能的装饰品。
2014	植学珠4【4】	装饰品	10	能够提升植生学技能的装饰品。
2015	地学珠3【4】	装饰品	10	能够提升地质学技能的装饰品。
2016	环境珠3【4】	装饰品	10	能够提升环境利用知识技能的装饰品。
2017	标本珠3【4】	装饰品	10	能够提升昆虫标本达人技能的装饰品。
2018	持续珠2【4】	装饰品	8	能够提升道具使用强化技能的装饰品。
2019	防御珠2【4】	装饰品	8	能够提升防御技能的装饰品。
2020	持续珠3【4】	装饰品	10	能够提升道具使用强化技能的装饰品。
2021	防御珠3【4】	装饰品	9	能够提升防御技能的装饰品。
2022	炮术珠2【4】	装饰品	8	能够提升炮术技能的装饰品。
2023	防音珠2【4】	装饰品	11	能够提升耳塞技能的装饰品。
2024	防风珠2【4】	装饰品	11	能够提升风压耐性技能的装饰品。
2025	攻击珠2【4】	装饰品	11	能够提升攻击技能的装饰品。
2026	达人珠2【4】	装饰品	11	能够提升看破技能的装饰品。
2027	匠珠2【4】	装饰品	11	能够提升匠技能技能的装饰品。
2028	全开珠2【4】	装饰品	10	能够提升力量解放技能的装饰品。
2029	挑战珠2【4】	装饰品	10	能够提升挑战者技能的装饰品。
2030	底力珠2【4】	装饰品	10	能够提升火场怪力技能的装饰品。
2031	逆上珠2【4】	装饰品	10	能够提升怨恨技能的装饰品。
2032	体术珠2【4】	装饰品	9	能够提升体术技能的装饰品。
2033	回避珠2【4】	装饰品	10	能够提升回避性能技能的装饰品。
2034	铁壁珠2【4】	装饰品	9	能够提升防御性能技能的装饰品。
2035	友爱珠2【4】	装饰品	9	能够提升广域化技能的装饰品。
2036	夺气·体术珠【4】	装饰品	9	能够提升夺取耐力技能和体术技能的装饰品。
2037	逆境·体术珠【4】	装饰品	8	能够提升不屈技能和体术技能的装饰品。
2038	绝路·体术珠【4】	装饰品	8	能够提升死里逃生技能和体术技能的装饰品。
2039	铁壁·体术珠【4】	装饰品	9	能够提升防御性能技能和体术技能的装饰品。
2040	友爱·体术珠【4】	装饰品	9	能够提升广域化技能和体术技能的装饰品。
2041	节食·体术珠【4】	装饰品	8	能够提升满足感技能和体术技能的装饰品。
2042	投石·体术珠【4】	装饰品	8	能够提升投射器装填数技能和提升体术技能的装饰品。
2043	耐属·体术珠【4】	装饰品	9	能够提升属性异常状态的耐性技能和体术技能的装饰品。
2044	飞燕·体术珠【4】	装饰品	9	能够提升飞燕技能和体术技能的装饰品。
2045	强走·体术珠【4】	装饰品	9	能够提升跑者技能和体术技能的装饰品。
2046	早气·体术珠【4】	装饰品	9	能够提升急速回复耐力技能和体术技能的装饰品。
2047	跳跃·体术珠【4】	装饰品	9	能够提升回避距离提升技能和提升体术技能的装饰品。
2048	速纳·体术珠【4】	装饰品	9	能够提升纳刀术技能和体术技能的装饰品。
2049	快吃·体术珠【4】	装饰品	9	能够提升快吃技能和体术技能的装饰品。
2050	研磨·体术珠【4】	装饰品	9	能够提升砥石使用高速化技能和体术技能的装饰品。
2051	爆师·体术珠【4】	装饰品	9	能够提升炸弹客技能和体术技能的装饰品。
2052	茸好·体术珠【4】	装饰品	9	能够提升最爱菇类技能和体术技能的装饰品。
2053	滑走·体术珠【4】	装饰品	8	能够提升滑走强化技能和体术技能的装饰品。
2054	守势·体术珠【4】	装饰品	8	能够提升攻击守势技能和体术技能的装饰品。
2055	夺气·回避珠【4】	装饰品	9	能够提升夺取耐力技能和回避性能技能的装饰品。
2056	逆境·回避珠【4】	装饰品	8	能够提升不屈技能和回避性能技能的装饰品。
2057	绝路·回避珠【4】	装饰品	8	能够提升死里逃生技能和回避性能技能的装饰品。
2058	铁壁·回避珠【4】	装饰品	9	能够提升防御性能技能和回避性能技能的装饰品。
2059	友爱·回避珠【4】	装饰品	9	能够提升广域化技能和回避性能技能的装饰品。
2060	节食·回避珠【4】	装饰品	8	能够提升满足感技能和回避性能技能的装饰品。
2061	投石·回避珠【4】	装饰品	8	能够提升投射器装填数技能和提升回避性能技能的装饰品。
2062	耐属·回避珠【4】	装饰品	9	能够提升属性异常状态的耐性技能和回避性能技能的装饰品。
2063	飞燕·回避珠【4】	装饰品	9	能够提升飞燕技能和回避性能技能的装饰品。
2064	强走·回避珠【4】	装饰品	9	能够提升跑者技能和回避性能技能的装饰品。
2065	早气·回避珠【4】	装饰品	9	能够提升急速回复耐力技能和回避性能技能的装饰品。
2066	跳跃·回避珠【4】	装饰品	9	能够提升回避距离提升技能和提升回避性能技能的装饰品。
2067	速纳·回避珠【4】	装饰品	9	能够提升纳刀术技能和回避性能技能的装饰品。
2068	快吃·回避珠【4】	装饰品	9	能够提升快吃技能和回避性能技能的装饰品。
2069	研磨·回避珠【4】	装饰品	9	能够提升砥石使用高速化技能和回避性能技能的装饰品。
2070	爆师·回避珠【4】	装饰品	9	能够提升炸弹客技能和回避性能技能的装饰品。
2071	茸好·回避珠【4】	装饰品	9	能够提升最爱菇类技能和回避性能技能的装饰品。
2072	滑走·回避珠【4】	装饰品	8	能够提升滑走强化技能和回避性能技能的装饰品。
2073	守势·回避珠【4】	装饰品	8	能够提升攻击守势技能和回避性能技能的装饰品。
2074	夺气·攻击珠【4】	装饰品	9	能够提升夺取耐力技能和攻击技能的装饰品。
2075	逆境·攻击珠【4】	装饰品	8	能够提升不屈技能和攻击技能的装饰品。
2076	绝路·攻击珠【4】	装饰品	8	能够提升死里逃生技能和攻击技能的装饰品。
2077	铁壁·攻击珠【4】	装饰品	9	能够提升防御性能技能和攻击技能的装饰品。
2078	友爱·攻击珠【4】	装饰品	9	能够提升广域化技能和攻击技能的装饰品。
2079	节食·攻击珠【4】	装饰品	8	能够提升满足感技能和攻击技能的装饰品。
2080	投石·攻击珠【4】	装饰品	8	能够提升投射器装填数技能和提升攻击技能的装饰品。
2081	耐属·攻击珠【4】	装饰品	9	能够提升属性异常状态的耐性技能和攻击技能的装饰品。
2082	飞燕·攻击珠【4】	装饰品	9	能够提升飞燕技能和攻击技能的装饰品。
2083	强走·攻击珠【4】	装饰品	9	能够提升跑者技能和攻击技能的装饰品。
2084	早气·攻击珠【4】	装饰品	9	能够提升急速回复耐力技能和攻击技能的装饰品。
2085	跳跃·攻击珠【4】	装饰品	9	能够提升回避距离提升技能和提升攻击技能的装饰品。
2086	速纳·攻击珠【4】	装饰品	9	能够提升纳刀术技能和攻击技能的装饰品。
2087	快吃·攻击珠【4】	装饰品	9	能够提升快吃技能和攻击技能的装饰品。
2088	研磨·攻击珠【4】	装饰品	9	能够提升砥石使用高速化技能和攻击技能的装饰品。
2089	爆师·攻击珠【4】	装饰品	9	能够提升炸弹客技能和攻击技能的装饰品。
2090	茸好·攻击珠【4】	装饰品	9	能够提升最爱菇类技能和攻击技能的装饰品。
2091	滑走·攻击珠【4】	装饰品	8	能够提升滑走强化技能和攻击技能的装饰品。
2092	守势·攻击珠【4】	装饰品	8	能够提升攻击守势技能和攻击技能的装饰品。
2093	夺气·达人珠【4】	装饰品	9	能够提升夺取耐力技能和看破技能的装饰品。
2094	逆境·达人珠【4】	装饰品	8	能够提升不屈技能和看破技能的装饰品。
2095	绝路·达人珠【4】	装饰品	8	能够提升死里逃生技能和看破技能的装饰品。
2096	铁壁·达人珠【4】	装饰品	9	能够提升防御性能技能和看破技能的装饰品。
2097	友爱·达人珠【4】	装饰品	9	能够提升广域化技能和看破技能的装饰品。
2098	节食·达人珠【4】	装饰品	8	能够提升满足感技能和看破技能的装饰品。
2099	投石·达人珠【4】	装饰品	8	能够提升投射器装填数技能和提升看破技能的装饰品。
2100	耐属·达人珠【4】	装饰品	9	能够提升属性异常状态的耐性技能和看破技能的装饰品。
2101	飞燕·达人珠【4】	装饰品	9	能够提升飞燕技能和看破技能的装饰品。
2102	强走·达人珠【4】	装饰品	9	能够提升跑者技能和看破技能的装饰品。
2103	早气·达人珠【4】	装饰品	9	能够提升急速回复耐力技能和看破技能的装饰品。
2104	跳跃·达人珠【4】	装饰品	9	能够提升回避距离提升技能和提升看破技能的装饰品。
2105	速纳·达人珠【4】	装饰品	9	能够提升纳刀术技能和看破技能的装饰品。
2106	快吃·达人珠【4】	装饰品	9	能够提升快吃技能和看破技能的装饰品。
2107	研磨·达人珠【4】	装饰品	9	能够提升砥石使用高速化技能和看破技能的装饰品。
2108	爆师·达人珠【4】	装饰品	9	能够提升炸弹客技能和看破技能的装饰品。
2109	茸好·达人珠【4】	装饰品	9	能够提升最爱菇类技能和看破技能的装饰品。
2110	滑走·达人珠【4】	装饰品	8	能够提升滑走强化技能和看破技能的装饰品。
2111	守势·达人珠【4】	装饰品	8	能够提升攻击守势技能和看破技能的装饰品。
2112	夺气·解放珠【4】	装饰品	10	能够提升夺取耐力技能和属性解放／装填扩充技能的装饰品。
2113	逆境·解放珠【4】	装饰品	9	能够提升不屈技能和属性解放／装填扩充技能的装饰品。
2114	绝路·解放珠【4】	装饰品	9	能够提升死里逃生技能和属性解放／装填扩充技能的装饰品。
2115	铁壁·解放珠【4】	装饰品	10	能够提升防御性能技能和属性解放／装填扩充技能的装饰品。
2116	友爱·解放珠【4】	装饰品	10	能够提升广域化技能和属性解放／装填扩充技能的装饰品。
2117	节食·解放珠【4】	装饰品	9	能够提升满足感技能和属性解放／装填扩充技能的装饰品。
2118	投石·解放珠【4】	装饰品	9	能够提升投射器装填数技能和提升属性解放／装填扩充技能的装饰品。
2119	耐属·解放珠【4】	装饰品	10	能够提升属性异常状态的耐性技能和属性解放／装填扩充技能的装饰品。
2120	飞燕·解放珠【4】	装饰品	10	能够提升飞燕技能和属性解放／装填扩充技能的装饰品。
2121	强走·解放珠【4】	装饰品	10	能够提升跑者技能和属性解放／装填扩充技能的装饰品。
2122	早气·解放珠【4】	装饰品	10	能够提升急速回复耐力技能和属性解放／装填扩充技能的装饰品。
2123	跳跃·解放珠【4】	装饰品	10	能够提升回避距离提升技能和提升属性解放／装填扩充技能的装饰品。
2124	速纳·解放珠【4】	装饰品	10	能够提升纳刀术技能和属性解放／装填扩充技能的装饰品。
2125	快吃·解放珠【4】	装饰品	10	能够提升快吃技能和属性解放／装填扩充技能的装饰品。
2126	研磨·解放珠【4】	装饰品	10	能够提升砥石使用高速化技能和属性解放／装填扩充技能的装饰品。
2127	爆师·解放珠【4】	装饰品	10	能够提升炸弹客技能和属性解放／装填扩充技能的装饰品。
2128	茸好·解放珠【4】	装饰品	10	能够提升最爱菇类技能和属性解放／装填扩充技能的装饰品。
2129	滑走·解放珠【4】	装饰品	9	能够提升滑走强化技能和属性解放／装填扩充技能的装饰品。
2130	守势·解放珠【4】	装饰品	9	能够提升攻击守势技能和属性解放／装填扩充技能的装饰品。
2131	夺气·匠珠【4】	装饰品	10	能够提升夺取耐力技能和匠技能的装饰品。
2132	逆境·匠珠【4】	装饰品	9	能够提升不屈技能和匠技能的装饰品。
2133	绝路·匠珠【4】	装饰品	9	能够提升死里逃生技能和匠技能的装饰品。
2134	铁壁·匠珠【4】	装饰品	10	能够提升防御性能技能和匠技能的装饰品。
2135	友爱·匠珠【4】	装饰品	10	能够提升广域化技能和匠技能的装饰品。
2136	节食·匠珠【4】	装饰品	9	能够提升满足感技能和匠技能的装饰品。
2137	投石·匠珠【4】	装饰品	9	能够提升投射器装填数技能和提升匠技能的装饰品。
2138	耐属·匠珠【4】	装饰品	10	能够提升属性异常状态的耐性技能和匠技能的装饰品。
2139	飞燕·匠珠【4】	装饰品	10	能够提升飞燕技能和匠技能的装饰品。
2140	强走·匠珠【4】	装饰品	10	能够提升跑者技能和匠技能的装饰品。
2141	早气·匠珠【4】	装饰品	10	能够提升急速回复耐力技能和匠技能的装饰品。
2142	跳跃·匠珠【4】	装饰品	10	能够提升回避距离提升技能和提升匠技能的装饰品。
2143	速纳·匠珠【4】	装饰品	10	能够提升纳刀术技能和匠技能的装饰品。
2144	快吃·匠珠【4】	装饰品	10	能够提升快吃技能和匠技能的装饰品。
2145	研磨·匠珠【4】	装饰品	10	能够提升砥石使用高速化技能和匠技能的装饰品。
2146	爆师·匠珠【4】	装饰品	10	能够提升炸弹客技能和匠技能的装饰品。
2147	茸好·匠珠【4】	装饰品	10	能够提升最爱菇类技能和匠技能的装饰品。
2148	滑走·匠珠【4】	装饰品	9	能够提升滑走强化技能和匠技能的装饰品。
2149	守势·匠珠【4】	装饰品	9	能够提升攻击守势技能和匠技能的装饰品。
2150	耐震·加护珠【4】	装饰品	9	能够提升耐震技能和精灵加护技能的装饰品。
2151	缩短·加护珠【4】	装饰品	9	能够提升集中技能和精灵加护技能的装饰品。
2152	昂扬·加护珠【4】	装饰品	9	能够提升强化持续技能和精灵加护技能的装饰品。
2153	重击·加护珠【4】	装饰品	9	能够提升破坏王技能和精灵加护技能的装饰品。
2154	击晕·加护珠【4】	装饰品	9	能够提升击晕术技能和精灵加护技能的装饰品。
2155	底力·加护珠【4】	装饰品	9	能够提升火场怪力技能和精灵加护技能的装饰品。
2156	防风·加护珠【4】	装饰品	9	能够提升风压耐性技能和精灵加护技能的装饰品。
2157	拔刀·加护珠【4】	装饰品	9	能够提升拔刀术【技】技能和精灵加护技能的装饰品。
2158	全开·加护珠【4】	装饰品	9	能够提升力量解放技能和精灵加护技能的装饰品。
