物品ID	物品名称	物品类型	稀有度	物品介绍
1154	雌火龙的秘棘	素材	8	雌火龙的大师级素材。容易经由切断的尾巴获得。拥有赋予毒属性的性质。
1155	雌火龙的天鳞	素材	10	雌火龙的大师级素材。用在装备上的话，据说能制成统御天地的梦幻稀有品。
1156	樱火龙的厚鳞	素材	8	樱火龙的大师级素材。主要经由剥取获得。泛用性高、用途广泛。
1157	樱火龙的重壳	素材	8	樱火龙的大师级素材。主要经由报酬获得。材质坚硬，常用于防具上。
1158	金火龙的厚鳞	素材	10	金火龙的大师级素材。主要经由剥取获得。泛用性高、用途广泛。
1159	金火龙的重壳	素材	10	金火龙的大师级素材。主要经由报酬获得。材质坚硬，常用于防具上。
1160	金火龙的秘棘	素材	10	金火龙的大师级素材。容易经由切断的尾巴获得。与毒属性的兼容性佳。
1161	眩鸟的厚鳞	素材	8	眩鸟的大师级素材。主要经由剥取获得。泛用性高、用途广泛。
1162	眩鸟的厚皮	素材	8	眩鸟的大师级素材。主要经由报酬获得。材质柔软，常用于防具上。
1163	眩鸟的刚爪	素材	8	眩鸟的大师级素材。主要经由剥取获得。材质锐利，常用于武器上。
1164	眩鸟的辉光膜	素材	8	眩鸟的大师级素材。容易经由破坏发光器官获得。材质特殊，被广泛使用。
1165	浮空龙的厚毛皮	素材	8	浮空龙的大师级素材。主要经由报酬获得。泛用性高、用途广泛。
1166	浮空龙的厚鳞	素材	8	浮空龙的大师级素材。主要经由剥取获得。材质坚硬，常用于防具上。
1167	胶质重壳	素材	8	可从浮空龙与其亚种取得的大师级素材。容易经由破坏尾巴部位获得。
1168	浮空龙的刚翼	素材	8	浮空龙的大师级素材。容易经由破坏两翼获得。材质轻巧，常用于防具上。
1169	浮眠龙的厚毛皮	素材	8	浮眠龙的大师级素材。主要经由报酬获得。用途广泛。
1170	浮眠龙的厚鳞	素材	8	浮眠龙的大师级素材。主要经由剥取获得。材质坚硬，常用于防具上。
1171	浮眠龙的刚翼	素材	8	浮眠龙的大师级素材。容易经由破坏两翼获得。材质轻巧，常用于防具上。
1172	大痹贼龙的厚鳞	素材	8	大痹贼龙的大师级素材。主要经由剥取获得。泛用性高、用途广泛。
1173	大痹贼龙的厚皮	素材	8	大痹贼龙的大师级素材。主要经由报酬获得。材质柔软，常用于防具上。
1174	大痹贼龙的重头巾	素材	8	大痹贼龙的大师级素材。容易经由破坏头部部位获得。材质特殊，只能用于限定的装备。
1175	大痹贼龙的重牙	素材	8	大痹贼龙的大师级素材。容易经由破坏头获得。拥有赋予麻痹属性的性质。
1176	大痹贼龙的韧尾	素材	8	大痹贼龙的大师级素材。容易经由切断的尾巴获得。材质强韧，常用于防具上。
1177	骨锤龙的厚鳞	素材	8	骨锤龙的大师级素材。主要经由剥取获得。泛用性高、用途广泛。
1178	骨锤龙的重壳	素材	8	骨锤龙的大师级素材。主要经由报酬获得。材质坚硬，常用于防具上。
1179	骨锤龙的重油壳	素材	8	骨锤龙的大师级素材。容易经由切断的尾巴获得。耐冲性佳，常用于防具上。
1180	大龙骨块	素材	8	骨锤龙的大师级素材。容易经由掉落物获得。高密度的材质，用途广泛。
1181	风漂龙的厚鳞	素材	9	风漂龙的大师级素材。主要经由剥取获得。泛用性高、用途广泛。
1182	风漂龙的厚皮	素材	9	风漂龙的大师级素材。主要经由报酬获得。材质轻巧，常用于防具上。
1183	风漂龙的刚爪	素材	9	风漂龙的大师级素材。主要经由剥取获得。拥有赋予冰属性的性质。
1184	风漂龙的刚翼	素材	9	风漂龙的大师级素材。容易经由破坏两翼部位获得。材质柔软，常用于防具上。
1185	风漂龙的重尾膜	素材	9	风漂龙的大师级素材。容易经由破坏尾巴部位获得。材质柔软，常用于防具上。
1186	风漂龙的天鳞	素材	10	风漂龙的大师级素材。用在装备上的话，据说能制成统御天地的梦幻稀有品。
1187	Unavailable	物品	3	Unavailable
1188	覆盖冰霜的皮	素材	9	霜翼风漂龙的大师级素材。主要经由报酬获得。材质轻巧，常用于防具上。
1189	漆黑的冰刃爪	素材	9	霜翼风漂龙的大师级素材。主要经由剥取获得。拥有赋予冰属性的性质。
1190	严寒之翼	素材	9	霜翼风漂龙的大师级素材。容易经由破坏两翼部位获得。材质柔软，常用于防具上。
1191	Unavailable	物品	3	Unavailable
1192	Unavailable	物品	3	Unavailable
1193	惨爪龙的厚鳞	素材	9	惨爪龙的大师级素材。主要经由剥取获得。泛用性高、用途广泛。
1194	惨爪龙的强硬筋	素材	9	惨爪龙的大师级素材。主要经由报酬获得。材质坚硬，常用于防具上。
1195	惨爪龙的刚爪	素材	9	惨爪龙的大师级素材。容易经由破坏两只前脚部位获得。材质锐利，常用于武器上。
1196	惨爪龙的重牙	素材	9	惨爪龙的大师级素材。容易经由破坏头部部位获得。材质尖锐，常用于武器上。
1197	惨爪龙的韧尾	素材	9	惨爪龙的大师级素材。容易经由切断的尾巴获得。材质强韧，常用于防具上。
1198	惨爪龙的天鳞	素材	10	惨爪龙的大师级素材。用在装备上的话，据说能制成统御天地的梦幻稀有品。
1199	凶爪龙的厚鳞	素材	9	凶爪龙的大师级素材。主要经由剥取获得。泛用性高、用途广泛。
1200	凶爪龙的强硬筋	素材	9	凶爪龙的大师级素材。主要经由报酬获得。材质坚硬，常用于防具上。
1201	凶爪龙的刚爪	素材	9	凶爪龙的大师级素材。容易经由破坏两只前脚部位获得。材质锐利，常用于武器上。
1202	凶爪龙的重牙	素材	9	凶爪龙的大师级素材。容易经由破坏头部部位获得。材质尖锐，常用于武器上。
1203	凶爪龙的韧尾	素材	9	凶爪龙的大师级素材。容易经由切断的尾巴获得。材质强韧，常用于防具上。
1204	凶爪龙的天鳞	素材	10	凶爪龙的大师级素材。用在装备上的话，据说能制成统御天地的梦幻稀有品。
1205	火龙的厚鳞	素材	9	火龙的大师级素材。主要经由剥取获得。泛用性高、用途广泛。
1206	火龙的重壳	素材	9	火龙的大师级素材。主要经由报酬获得。材质坚硬，常用于防具上。
1207	火龙的刚翼	素材	9	火龙的大师级素材。容易经由破坏两翼部位获得。材质柔软，常用于防具上。
1208	火龙的韧尾	素材	9	火龙的大师级素材。容易经由切断的尾巴获得。与火属性的兼容性佳。
1209	火龙的刚翼爪	素材	9	可从雌火龙与火龙取得的大师级素材。容易经由破坏两翼部位获得。
1210	火龙的天鳞	素材	10	火龙的大师级素材。用在装备上的话，据说能制成统御天地的梦幻稀有品。
1211	苍火龙的厚鳞	素材	9	苍火龙的大师级素材。主要经由剥取获得。泛用性高、用途广泛。
1212	苍火龙的重壳	素材	9	苍火龙的大师级素材。主要经由报酬获得。材质坚硬，常用于防具上。
1213	苍火龙的韧尾	素材	9	苍火龙的大师级素材。容易经由切断的尾巴获得。与火属性的兼容性佳。
1214	苍火龙的刚翼	素材	9	苍火龙的大师级素材。容易经由破坏两翼部位获得。材质柔软，常用于防具上。
1215	银火龙的厚鳞	素材	10	银火龙的大师级素材。主要经由剥取获得。泛用性高、用途广泛。
1216	银火龙的重壳	素材	10	银火龙的大师级素材。主要经由报酬获得。材质坚硬，常用于防具上。
1217	银火龙的刚翼	素材	10	银火龙的大师级素材。容易经由破坏两翼部位获得。常用于防具上。
1218	银火龙的韧尾	素材	10	银火龙的大师级素材。容易经由切断的尾巴获得。与火属性的兼容性佳。
1219	火龙的煌液	素材	10	可从雌火龙与火龙稀少种取得的大师级素材。容易经由破坏头部部位获得。
1220	角龙的重壳	素材	9	角龙的大师级素材。主要经由剥取获得。泛用性高、用途广泛。
1221	角龙的重甲	素材	9	角龙的大师级素材。主要经由报酬获得。材质坚硬，常用于防具上。
1222	角龙的重尾甲	素材	9	角龙的大师级素材。容易经由切断的尾巴获得。材质坚硬牢固，难以处理。
1223	坚固的弯曲角	素材	9	角龙的大师级素材。容易经由破坏两角部位获得。材质坚固，常用于武器上。
1224	贯穿大地的刚角	素材	10	可从角龙与其亚种取得的稀有大师级素材。容易经由破坏两角部位获得。
1225	黑角龙的重壳	素材	9	黑角龙的大师级素材。主要经由剥取获得。泛用性高、用途广泛。
1226	黑角龙的重甲	素材	9	黑角龙的大师级素材。主要经由报酬获得。材质坚硬，常用于防具上。
1227	坚固的黑卷角	素材	9	黑角龙的大师级素材。容易经由破坏两角部位获得。常用于武器上。
1228	岩贼龙的厚鳞	素材	8	岩贼龙的大师级素材。主要经由剥取获得。泛用性高、用途广泛。
1229	岩贼龙的厚皮	素材	8	岩贼龙的大师级素材。主要经由报酬获得。材质柔软，常用于防具上。
1230	岩贼龙的大颚	素材	8	岩贼龙的大师级素材。容易经由破坏头部部位获得。材质特殊，处理素材需具备技术。
1231	岩贼龙的刚爪	素材	8	岩贼龙的大师级素材。容易经由破坏两只前脚部位获得。材质沉重，常用于武器上。
1232	岩贼龙的韧尾	素材	8	岩贼龙的大师级素材。容易经由切断的尾巴获得。材质硬实，常用于武器上。
1233	熔岩龙的厚鳞	素材	9	熔岩龙的大师级素材。主要经由剥取获得。是用途广泛、应用性佳的材质。
1234	熔岩龙的重壳	素材	9	熔岩龙的大师级素材。主要经由报酬获得。材质坚硬，常用于防具上。
1235	熔岩龙的重牙	素材	9	熔岩龙的大师级素材。容易经由破坏头部部位获得。材质锐利，常用于武器上。
1236	熔岩龙的特上鳍	素材	9	熔岩龙的大师级素材。容易经由破坏背鳍部位获得。是用途广泛、应用性佳的材质。
1237	爆锤龙的厚鳞	素材	9	爆锤龙的大师级素材。主要经由剥取获得。泛用性高、用途广泛。
1238	爆锤龙的重壳	素材	9	爆锤龙的大师级素材。主要经由报酬获得。材质坚硬，常用于防具上。
1239	爆锤龙的重颚	素材	9	爆锤龙的大师级素材。容易经由破坏的颚获得。材质特殊，只能用于限定的装备。
1240	爆锤龙的重耐热壳	素材	9	爆锤龙的大师级素材。容易经由切断的尾巴获得。耐热性高，常用于防具上。
1241	爆锤龙的天壳	素材	10	爆锤龙的大师级素材。用在装备上的话，据说能制成统御天地的梦幻稀有品。
1242	冰牙龙的重壳	素材	9	冰牙龙的大师级素材。主要经由报酬获得。材质坚硬，常用于防具上。
1243	冰牙龙的厚毛皮	素材	9	冰牙龙的大师级素材。主要经由剥取获得。泛用性高、用途广泛。
1244	冰牙龙的刚爪	素材	9	冰牙龙的大师级素材。主要经由报酬或剥取获得。材质锐利，常用于武器上。
1245	冰牙龙的重棘	素材	9	冰牙龙的大师级素材。容易经由破坏两翼部位获得。材质硬实，常用于武器上。
1246	冰牙龙的韧尾	素材	9	冰牙龙的大师级素材。容易经由切断的尾巴获得。材质强韧，常用于防具上。
1247	琥珀色的重牙	素材	9	冰牙龙的大师级素材。容易经由破坏头部部位获得。材质尖锐，常用于武器上。
1248	迅龙的厚鳞	素材	9	迅龙的大师级素材。主要经由剥取获得。材质坚硬，常用于防具上。
1249	迅龙的豪黑毛	素材	9	迅龙的大师级素材。主要经由报酬获得。材质坚硬，常用于防具上。
1250	迅龙的韧尾	素材	9	迅龙的大师级素材。容易经由切断的尾巴获得。材质强韧，常用于防具上。
1251	迅龙的重尾棘	素材	9	迅龙的大师级素材。容易经由掉落物获得。泛用性高、用途广泛。
1252	迅龙的刚刃翼	素材	9	迅龙的大师级素材。容易经由破坏两翼获得。材质锐利，常用于武器上。
1253	迅龙的重牙	素材	9	迅龙的大师级素材。容易经由破坏头部部位获得。材质硬实，常用于武器上。
1254	迅龙的天鳞	素材	10	迅龙的大师级素材。用在装备上的话，据说能制成统御天地的梦幻稀有品。
1255	轰龙的厚鳞	素材	9	轰龙的大师级素材。主要经由剥取获得。泛用性高、用途广泛。
1256	轰龙的重壳	素材	9	轰龙的大师级素材。主要经由报酬获得。材质坚硬，常用于防具上。
1257	轰龙的韧尾	素材	9	轰龙的大师级素材。容易经由切断的尾巴获得。材质强韧，常用于防具上。
1258	轰龙的刚爪	素材	9	轰龙的大师级素材。容易经由破坏前脚部位获得。材质锐利，常用于武器上。
1259	轰龙的重牙	素材	9	轰龙的大师级素材。容易经由破坏头部部位获得。材质尖锐，常用于武器上。
1260	轰龙的天鳞	素材	10	轰龙的大师级素材。用在装备上的话，据说能制成统御天地的梦幻稀有品。
1261	黑轰龙的厚鳞	素材	9	黑轰龙的大师级素材。主要经由剥取获得。泛用性高、用途广泛。
1262	黑轰龙的重壳	素材	9	黑轰龙的大师级素材。主要经由报酬获得。材质坚硬，常用于防具上。
1263	黑轰龙的刚爪	素材	9	黑轰龙的大师级素材。容易经由破坏前脚部位获得。常用于武器上。
1264	黑轰龙的重牙	素材	9	黑轰龙的大师级素材。容易经由破坏头部部位获得。常用于武器上。
1265	斩龙的厚鳞	素材	9	斩龙的大师级素材。主要经由剥取获得。材质坚硬，常用于防具上。
1266	斩龙的重壳	素材	9	斩龙的大师级素材。主要经由报酬获得。材质坚硬，常用于防具上。
1267	斩龙的重牙	素材	9	斩龙的大师级素材。容易经由破坏头部部位获得。材质锐利，常用于武器上。
1268	斩龙的狱炎状壳	素材	9	斩龙的大师级素材。容易经由破坏背部部位获得。耐热性高，常用于防具上。
1269	斩龙的断剑尾	素材	9	斩龙的大师级素材。容易经由切断的尾巴获得。材质强韧，常用于防具上。
1270	炽热的熔炉囊	素材	9	斩龙的大师级素材。容易经由掉落物获得。耐热性高，常用于防具上。
1271	斩龙的天鳞	素材	10	斩龙的大师级素材。用在装备上的话，据说能制成统御天地的梦幻稀有品。
1272	硫斩龙的厚鳞	素材	9	硫斩龙的大师级素材。主要经由剥取获得。材质坚硬，常用于防具上。
1273	硫斩龙的重壳	素材	9	硫斩龙的大师级素材。主要经由报酬获得。材质坚硬，常用于防具上。
1274	硫斩龙的重牙	素材	9	硫斩龙的大师级素材。容易经由破坏头部部位获得。常用于武器上。
1275	硫斩龙的剑山状壳	素材	9	硫斩龙的大师级素材。容易经由破坏背部部位获得。常用于防具上。
1276	硫斩龙的断剑尾	素材	9	硫斩龙的大师级素材。容易经由切断的尾巴获得。常用于防具上。
1277	削下的硫晶片	素材	9	硫斩龙的大师级素材。容易经由掉落物获得。只能用于限定的装备。
1278	Unavailable	物品	3	Unavailable
1279	碎龙的重壳	素材	9	碎龙的大师级素材。主要经由剥取获得。泛用性高、用途广泛。
1280	碎龙的重黑曜甲	素材	9	碎龙的大师级素材。主要经由报酬获得。材质坚硬，常用于防具上。
1281	碎龙的重头壳	素材	9	碎龙的大师级素材。容易经由破坏头部部位获得。材质硬实，常用于武器上。
1282	发光黏菌	素材	9	碎龙的大师级素材。容易经由掉落物获得。是用途广泛、应用性佳的材质。
1283	碎龙的刚铁拳	素材	9	碎龙的大师级素材。容易经由破坏前脚部位获得。材质硬实，常用于防具上。
1284	碎龙的韧尾	素材	9	碎龙的大师级素材。容易经由切断的尾巴获得。材质强韧，常用于防具上。
1285	碎龙的天壳	素材	10	碎龙的大师级素材。用在装备上的话，据说能制成统御天地的梦幻稀有品。
1286	碎龙的弹头壳	素材	10	猛爆碎龙的大师级素材。怒气满溢、威力无匹的弹头所化成的头部。
1287	临界点的黏菌	素材	10	猛爆碎龙的大师级素材。受到活化，让爆炸威力达到顶点状态的红色黏菌。
1288	碎龙的击灭拳	素材	10	猛爆碎龙的大师级素材。通过威力惊人的爆炸，将目标即刻炸碎的凶暴素材。
1289	不灭的炉心壳	素材	11	猛爆碎龙的大师级素材。在千钧一发时，可让黏菌产生爆发性活化的稀有部位。
1290	黑狼鸟的厚鳞	素材	9	黑狼鸟的大师级素材。主要经由剥取获得。泛用性高，用途广泛。
1291	黑狼鸟的重壳	素材	9	黑狼鸟的大师级素材。主要经由报酬获得。材质坚硬，常用于防具上。
1292	黑狼鸟的地狱耳	素材	9	黑狼鸟的大师级素材。容易经由破坏头部部位获得。材质柔软，常用于防具上。
1293	帅气的喙	素材	9	黑狼鸟的大师级素材。容易经由破坏头部部位获得。材质坚固，常用于武器上。
1294	黑狼鸟的刚翼	素材	9	黑狼鸟的大师级素材。容易经由破坏两翼部位获得。材质柔软，常用于防具上。
1295	黑狼鸟的韧尾	素材	9	黑狼鸟的大师级素材。容易经由切断的尾巴获得。材质强韧，常用于防具上。
1296	黑狼鸟的银狼毛	素材	9	黑狼鸟的大师级素材。容易经由破坏背部部位获得。是用途广泛、应用性佳的材质。
1297	雷狼龙的重壳	素材	8	雷狼龙的大师级素材。主要经由报酬获得。材质坚硬，常用于防具上。
1298	雷狼龙的雷电毛	素材	8	雷狼龙的大师级素材。主要经由报酬获得。材质坚硬，常用于防具上。
1299	雷狼龙的刚角	素材	8	雷狼龙的大师级素材。容易经由破坏头部部位获得。材质坚固，常用于武器上。
1300	雷狼龙的刚爪	素材	8	雷狼龙的大师级素材。容易经由破坏两边前脚获得。材质尖锐，常用于武器上。
1301	雷狼龙的韧尾	素材	8	雷狼龙的大师级素材。容易经由切断的尾巴获得。材质强韧，常用于防具上。
1302	雷狼龙的雷电壳	素材	8	雷狼龙的大师级素材。主要经由剥取获得。与雷属性的兼容性佳。
1303	超电雷光虫	素材	9	雷狼龙的大师级素材。主要在其跌倒时可通过采集取得。拥有赋予雷属性的性质。
1304	雷狼龙的天玉	素材	10	雷狼龙的大师级素材。用在装备上的话，据说能制成统御天地的梦幻稀有品。
1305	狱狼龙的重壳	素材	8	狱狼龙的大师级素材。主要经由报酬获得。材质坚硬，常用于防具上。
1306	狱狼龙的灭龙毛	素材	8	狱狼龙的大师级素材。主要经由报酬获得。材质坚硬，常用于防具上。
1307	狱狼龙的刚角	素材	8	狱狼龙的大师级素材。容易经由破坏头部部位获得。材质硬实，常用于武器上。
1308	狱狼龙的刚爪	素材	8	狱狼龙的大师级素材。容易经由破坏两只前脚部位获得。材质锐利，常用于武器上。
1309	狱狼龙的韧尾	素材	8	狱狼龙的大师级素材。容易经由破坏尾巴部位获得。材质强韧，常用于防具上。
1310	狱狼龙的灭龙壳	素材	8	狱狼龙的大师级素材。主要经由剥取获得。与龙属性的相容性佳。
1311	蚀龙虫	素材	9	狱狼龙的大师级素材。主要在其跌倒时可通过采集取得。拥有赋予龙属性的性质。
1312	狱狼龙的天玉	素材	10	狱狼龙的大师级素材。用在武具上的话，据说会是能掌握天地的梦幻稀有品。
1313	爆鳞龙的厚鳞	素材	10	红莲爆鳞龙的大师级素材。主要经由剥取获得。用途广泛。
1314	红莲飘荡之银壳	素材	10	红莲爆鳞龙的大师级素材。主要经由报酬获得。材质坚硬，常用于防具上。
1315	爆鳞龙的重尾	素材	10	红莲爆鳞龙的大师级素材。容易经由切断的尾巴获得。常用于防具上。
1316	浓缩的爆腺液	素材	10	红莲爆鳞龙的大师级素材。容易经由破坏头部部位获得。与爆破属性的兼容性佳。
1317	爆鳞龙的刚爪	素材	10	红莲爆鳞龙的大师级素材。主要经由剥取获得。与爆破属性的兼容性佳。
1318	烧灼天空之银翼	素材	10	红莲爆鳞龙的大师级素材。容易经由破坏两翼部位获得。常用于武器上。
1319	爆鳞龙的天鳞	素材	10	红莲爆鳞龙的大师级素材。用在装备上的话，据说能制成统御天地的梦幻稀有品。
1320	恐暴龙的厚黑鳞	素材	10	惶怒恐暴龙的大师级素材。主要经由剥取获得。用途广泛。
1321	恐暴龙的厚黑皮	素材	10	惶怒恐暴龙的大师级素材。主要经由报酬获得。材质硬实，常用于防具上。
1322	Unavailable	物品	3	Unavailable
1323	极恶之牙	素材	10	惶怒恐暴龙的大师级素材。容易经由破坏头部部位获得。常用于武器上。
1324	恐暴龙的刚钩爪	素材	10	惶怒恐暴龙的大师级素材。主要经由剥取获得。与龙属性的兼容性佳。
1325	恐暴龙的重尾	素材	10	惶怒恐暴龙的大师级素材。容易经由切断的尾巴获得。常用于防具上。
1326	浓黑之血	素材	10	惶怒恐暴龙的大师级素材。容易经由掉落物获得。材质特殊，处理素材需具备技术。
1327	恐暴龙的灭鳞	素材	10	惶怒恐暴龙的大师级素材。用在装备上的话，据说能制成统御天地的梦幻稀有品。
1328	金狮子的黑荒毛	素材	10	金狮子的大师级素材。主要经由报酬获得。材质柔软，常用于防具上。
1329	金狮子的重牙	素材	10	金狮子的大师级素材。主要经由剥取获得。材质尖锐，常用于武器上。
1330	金狮子的刚爪	素材	10	金狮子的大师级素材。容易经由破坏两只前脚部位获得。材质尖锐，常用于武器上。
1331	金狮子的尾巴	素材	10	金狮子的大师级素材。容易经由破坏尾巴部位获得。材质强韧，常用于防具上。
1332	黄金的煌毛	素材	10	金狮子的大师级素材。入手困难，若能运用于装备，将可大幅提升装备性能。
1333	金狮子的怒发天	素材	10	激昂金狮子的大师级素材。极为纤长而坚韧，非常贵重。
1334	金狮子的刚角	素材	10	金狮子的大师级素材。容易经由破坏角部位获得。材质坚固，常用于武器上。
1335	罗剎的金刚角	素材	10	激昂金狮子的大师级素材。百折不挠、闪耀激昂金狮子光芒的黄金兽角。
1336	金狮子心	素材	11	激昂金狮子的大师级素材。怒火冲天的象征。其跳动可产生强大的力量。
1337	幻兽的特上皮	素材	10	麒麟的大师级素材。主要经由剥取获得。泛用性高，用途广泛。
1338	幻兽的韧雷尾	素材	10	麒麟的大师级素材。主要经由报酬获得。与雷属性的兼容性佳。
1339	幻兽的银鬃毛	素材	10	麒麟的大师级素材。主要经由剥取获得。雷耐性高的材质，常用于防具上。
1340	幻兽的刚苍角	素材	10	麒麟的大师级素材。角容易经由破坏获得。拥有赋予雷属性的性质。
1341	不灭的厚龙鳞	素材	10	歼世灭尽龙的大师级素材。主要经由剥取获得。泛用性很高的素材。
1342	灭尽龙的重壳	素材	10	歼世灭尽龙的大师级素材。主要经由报酬获得。材质坚硬，常用于防具上。
1343	灭尽龙的重尾	素材	10	歼世灭尽龙的大师级素材。容易经由切断的尾巴获得。材质强韧。
1344	歼灭的大刚角	素材	10	歼世灭尽龙的大师级素材。容易经由破坏角部位获得。常作为武器素材使用。
1345	灭尽龙的刚爪	素材	10	歼世灭尽龙的大师级素材。主要经由剥取获得。材质非常尖锐。
1346	无穷的新生壳	素材	10	歼世灭尽龙的大师级素材。容易经由掉落物获得。具有特殊性质。
1347	冰晶的厚龙鳞	素材	10	冰呪龙的大师级素材。主要经由剥取获得。泛用性高，用途广泛。
1348	冰龙的重壳	素材	10	冰呪龙的大师级素材。主要经由报酬获得。材质坚硬，常用于防具上。
1349	冰龙的刚翼	素材	10	冰呪龙的大师级素材。容易经由破坏两翼部位获得。材质柔软，常用于防具上。
1350	冰龙的冠角	素材	10	冰呪龙的大师级素材。容易经由破坏头部部位获得。材质坚固，常用于武器上。
1351	冰龙的韧尾	素材	10	冰呪龙的大师级素材。容易经由切断的尾巴获得。材质强韧，常用于防具上。
1352	冰龙的刚爪	素材	10	冰呪龙的大师级素材。容易经由掉落物获得。材质尖锐，常用于武器上。
1353	冰龙的零玉	素材	11	冰呪龙的大师级素材。用在装备上的话，据说能制成统御天地的梦幻稀有品。
1354	炎王龙的重壳	素材	10	炎王龙的大师级素材。主要经由报酬获得。材质坚硬，常用于防具上。
1355	炎王龙的大鬃毛	素材	10	炎王龙的大师级素材。容易经由破坏头部部位获得。火耐性佳。
