物品ID	物品名称	物品类型	稀有度	物品介绍
458	优值的黑卷角	素材	5	黑角龙的上位素材。容易通过破坏两角部位获得。材质坚固，常用于武器上。
459	幻兽皮	素材	3	麒麟的素材。主要通过剥取获得。泛用性高、用途广泛。
460	幻兽的尾巴	素材	3	麒麟的素材。主要通过报酬获得。与雷属性的兼容性佳。
461	幻兽的鬃毛	素材	3	麒麟的素材。主要通过剥取获得。雷耐性高的材质，常用于防具上。
462	幻兽的雷角	素材	3	麒麟的素材。容易通过破坏角部位获得。拥有赋予雷属性的性质。
463	幻兽的上皮	素材	6	麒麟的上位素材。主要通过剥取获得。泛用性高、用途广泛。
464	幻兽的雷尾	素材	6	麒麟的上位素材。主要通过报酬获得。与雷属性的兼容性佳。
465	幻兽的苍角	素材	6	麒麟的上位素材。容易通过破坏角部位获得。拥有赋予雷属性的性质。
466	Unavailable	素材	5	Unavailable
467	熔山龙的热鳞	素材	5	熔山龙的素材。主要通过报酬获得。泛用性高、用途广泛。
468	熔山龙的岩壳	素材	5	熔山龙的素材。主要通过掉落物或采掘获得。材质坚硬，常用于防具上。
469	熔山龙的背甲	素材	5	熔山龙的素材。主要通过报酬获得。材质坚固，常用于武器上。
470	熔山龙的胸壳	素材	5	熔山龙的素材。容易通过破坏胸壳部位获得。材质沉重，常用于防具上。
471	Unavailable	素材	5	Unavailable
472	熔山龙的岩浆	素材	5	熔山龙的素材。容易通过破坏头部部位获得。材质特殊，处理素材需具备技术。
473	熔山龙的宝玉	素材	6	熔山龙的素材。据说是在体内生成的梦幻宝玉。藏有难以估计的力量。
474	岩贼龙的上鳞	素材	5	岩贼龙的上位素材。主要通过剥取获得。泛用性高、用途广泛。
475	岩贼龙的上皮	素材	5	岩贼龙的上位素材。主要通过报酬获得。材质柔软，常用于防具上。
476	岩贼龙的颚	素材	5	岩贼龙的上位素材。容易通过破坏头部部位获得。材质特殊，处理素材需具备技术。
477	岩贼龙的尖爪	素材	5	岩贼龙的上位素材。容易通过破坏两只前脚部位获得。材质沉重，常用于武器上。
478	岩贼龙的尾巴	素材	5	岩贼龙的上位素材。容易通过切断的尾巴获得。材质硬实，常用于武器上。
479	熔岩龙的上鳞	素材	5	熔岩龙的上位素材。主要通过剥取获得。泛用性高、用途广泛。
480	熔岩龙的坚壳	素材	5	熔岩龙的上位素材。主要通过报酬获得。材质坚硬，常用于防具上。
481	熔岩龙的锐牙	素材	5	熔岩龙的上位素材。容易通过破坏头部部位获得。材质锐利，常用于武器上。
482	熔岩龙的上鳍	素材	5	熔岩龙的上位素材。容易通过背鳍部位获得。是用途广泛、应用性佳的材质。
483	爆锤龙的上鳞	素材	5	爆锤龙的上位素材。主要通过剥取获得。泛用性高、用途广泛。
484	爆锤龙的坚壳	素材	5	爆锤龙的上位素材。主要通过报酬获得。材质坚硬，常用于防具上。
485	爆锤龙的颚	素材	5	爆锤龙的上位素材。容易通过破坏颚获得。材质特殊，只能用于限定的装备。
486	爆锤龙的耐热壳	素材	5	爆锤龙的上位素材。容易通过切断的尾巴获得。耐热性高，常用于防具上。
487	爆锤龙的延髓	素材	5	爆锤龙的上位素材。不容易获得的珍稀品。是强化装备的关键素材。
488	爆锤龙的红玉	素材	6	爆锤龙的上位素材。据说是在体内生成的稀有玉石。可飞跃性地提高武器性能。
489	熔岩块	素材	5	爆锤龙的上位素材。表面附着着矿石的块状物。里头混杂溶合着各种矿石。
490	爆鳞龙的上鳞	素材	5	爆鳞龙的上位素材。主要通过剥取获得。泛用性高、用途广泛。
491	爆鳞龙的坚壳	素材	5	爆鳞龙的上位素材。主要通过报酬获得。材质坚硬，常用于防具上。
492	爆鳞龙的尾巴	素材	5	爆鳞龙的上位素材。容易通过切断的尾巴获得。材质强韧，常用于防具上。
493	爆鳞龙的爆腺	素材	5	爆鳞龙的上位素材。容易通过破坏头部部位获得。拥有赋予爆破属性的性质。
494	爆鳞龙的尖爪	素材	5	爆鳞龙的上位素材。主要通过剥取获得。与爆破属性的兼容性佳。
495	爆鳞龙之翼	素材	5	爆鳞龙的上位素材。容易通过破坏两翼部位获得。硬质的材质，常用于武器上。
496	爆鳞龙的宝玉	素材	6	爆鳞龙的上位素材。据说是在体内生成的稀有玉石。可飞跃性地提高武器性能。
497	不灭的龙鳞	素材	6	灭尽龙的上位素材。主要通过剥取获得。泛用性高、用途广泛。
498	灭尽龙的坚壳	素材	6	灭尽龙的上位素材。主要通过报酬获得。材质坚硬，常用于防具上。
499	Unavailable	素材	6	Unavailable
500	灭尽龙的尾巴	素材	6	灭尽龙的上位素材。容易通过切断的尾巴获得。材质强韧，常用于防具上。
501	灭尽龙的大角	素材	6	灭尽龙的上位素材。容易通过破坏角部位获得。材质坚固，常用于武器上。
502	灭尽龙的尖爪	素材	6	灭尽龙的上位素材。主要通过剥取获得。材质锐利，常用于武器上。
503	灭尽龙的再生壳	素材	6	灭尽龙的上位素材。容易通过掉落物获得。材质特殊，常用于防具上。
504	灭尽龙的宝玉	素材	7	灭尽龙的上位素材。据说是在体内生成的梦幻宝玉。藏有难以估计的力量。
505	死尸的龙鳞	素材	6	尸套龙的上位素材。主要通过剥取获得。泛用性高、用途广泛。
506	尸套龙的坚壳	素材	6	尸套龙的上位素材。主要通过报酬获得。材质坚硬，常用于防具上。
507	尸套龙的被膜	素材	6	尸套龙的上位素材。容易通过掉落物获得。拥有赋予龙属性的性质。
508	尸套龙的尾巴	素材	6	尸套龙的上位素材。容易通过切断的尾巴获得。材质强韧，常用于防具上。
509	尸套龙的锐牙	素材	6	尸套龙的上位素材。容易通过破坏头部部位获得。材质尖锐，常用于武器上。
510	尸套龙的尖爪	素材	6	尸套龙的上位素材。容易通过破坏两只前脚部位获得。材质锐利，常用于武器上。
511	尸套龙之翼	素材	6	尸套龙的上位素材。容易通过破坏胴体部位获得。材质坚硬牢固，常用于防具上。
512	Unavailable	素材	6	Unavailable
513	尸套龙的宝玉	素材	7	尸套龙的上位素材。据说是在体内生成的梦幻宝玉。藏有难以估计的力量。
514	炎王龙的坚壳	素材	6	炎王龙的上位素材。主要通过报酬获得。材质坚硬，常用于防具上。
515	炎王龙的鬃毛	素材	6	炎王龙的上位素材。容易通过破坏头部部位获得。火耐性高，是贵重的素材。
516	炎王龙的尾巴	素材	6	炎王龙的上位素材。容易通过切断的尾巴获得。材质强韧，常用于防具上。
517	炎王龙的尖角	素材	6	炎王龙的上位素材。容易通过破坏头部部位获得。材质坚固，常用于武器上。
518	狱炎的龙鳞	素材	6	炎王龙的上位素材。主要通过剥取获得。泛用性高、用途广泛。
519	炎龙的尖爪	素材	6	炎王龙的上位素材。主要通过剥取获得。材质锐利，常用于武器上。
520	炎龙之翼	素材	6	炎王龙的上位素材。容易通过破坏两翼部位获得。材质柔软，常用于防具上。
521	炎龙的尘粉	素材	6	炎王龙的上位素材。容易通过掉落物获得。材质特殊，只能用于限定的装备。
522	炎龙的宝玉	素材	7	炎王龙的上位素材。据说是在体内生成的梦幻宝玉。藏有难以估计的力量。
523	钢龙的坚壳	素材	6	钢龙的上位素材。主要通过报酬获得。材质坚硬，常用于防具上。
524	钢的上龙鳞	素材	6	钢龙的上位素材。主要通过剥取获得。泛用性高、用途广泛。
525	钢龙之翼	素材	6	钢龙的上位素材。容易通过破坏两翼部位获得。材质轻巧，常用于防具上。
526	钢龙的尖角	素材	6	钢龙的上位素材。容易通过破坏头部部位获得。材质坚固，常用于武器上。
527	钢龙的尾巴	素材	6	钢龙的上位素材。容易通过切断的尾巴获得。材质强韧，常用于防具上。
528	钢龙的尖爪	素材	6	钢龙的上位素材。主要通过剥取获得。武具中秘藏着强大的冰属性。
529	钢龙的宝玉	素材	7	钢龙的上位素材。据说是在体内生成的梦幻宝玉。藏有难以估计的力量。
530	冥灯龙的幽鳞	素材	6	冥灯龙的上位素材。遭幽界之火灼烧过的鳞片至今也绽放着淡淡光辉。
531	冥灯龙的白壳	素材	6	冥灯龙的上位素材。为了将幽界之火留在体内而经过锻炼的外壳。
532	冥灯龙的幽幕	素材	6	冥灯龙的上位素材。解放积蓄在体内奔流的力量所需的器官。
533	冥灯龙的尾巴	素材	6	冥灯龙的上位素材。可击出拒绝所有干涉的尾击，是强韧的尾巴。
534	冥灯龙的幽角	素材	6	冥灯龙的上位素材。为了控制力量而长的器官。看起来也像还在成长当中。
535	冥灯龙的幽爪	素材	6	冥灯龙的上位素材。绽放出似乎能斩断肉体与灵魂连结的压力。
536	冥灯龙的幽翼	素材	6	冥灯龙的上位素材。闪烁光芒的翼膜，渲泄而出的力量激流，令人感受到神圣庄严的氛围。
537	Unavailable	素材	6	Unavailable
538	冥灯龙的幽玉	素材	7	冥灯龙的上位素材。据说是在体内生成的梦幻宝玉。藏有难以估计的力量。
539	？？？的鳞	素材	6	未知怪物的素材。可感受到不寻常的力量。
540	？？？的甲壳	素材	6	未知怪物的素材。可感受到不寻常的力量。
541	？？？的皮膜	素材	6	未知怪物的素材。可感受到不寻常的力量。
542	？？？的尾巴	素材	6	未知怪物的素材。可感受到不寻常的力量。
543	？？？的角	素材	6	未知怪物的素材。可感受到不寻常的力量。
544	？？？的爪	素材	6	未知怪物的素材。可感受到不寻常的力量。
545	？？？之翼	素材	6	未知怪物的素材。可感受到不寻常的力量。
546	样本09	素材	6	样本
547	？？？的宝玉	素材	7	未知怪物的素材。可感受到不寻常的力量。
548	谜之宝珠	素材	3	秘藏着微弱力量的宝珠。<STYL MOJI_YELLOW_DEFAULT>（鉴定道具）</STYL>
549	发光宝珠	素材	4	秘藏着某种力量的宝珠。<STYL MOJI_YELLOW_DEFAULT>（鉴定道具）</STYL>
550	老旧宝珠	素材	5	秘藏着强大力量的宝珠。<STYL MOJI_YELLOW_DEFAULT>（鉴定道具）</STYL>
551	风化的宝珠	素材	6	秘藏着神秘力量的宝珠。<STYL MOJI_YELLOW_DEFAULT>（鉴定道具）</STYL>
552	污秽的龙脉石	素材	5	虽污秽不堪，但仍能感受到确切的力量脉动的石块。<STYL MOJI_YELLOW_DEFAULT>（鉴定道具）</STYL>
553	闪耀的龙脉石	素材	7	可在光辉中感受到未知可能性的石块。<STYL MOJI_YELLOW_DEFAULT>（鉴定道具）</STYL>
554	龙脉石碎片	素材	5	从历战个体中采集的些许石块。可以生成比越过生死线的怪物更大的石块。
555	龙脉石	素材	6	从历战个体身上采集的些许石块。在无止尽追求强大的欲望所生成的力量结晶。
556	大龙脉石	素材	7	从历战个体身上采集的些许石块。这是其个体以支配者身份，称霸一个时代的象征。
557	猛者龙脉石·剑	素材	5	历战的猛者所拥有的素材。秘藏着可激发出大剑、太刀超越极限性能的力量。
558	猛者龙脉石·刃	素材	5	历战的猛者所拥有的素材。秘藏着可激发出片手剑、双剑超越极限性能的力量。
559	猛者龙脉石·锤	素材	5	历战的猛者所拥有的素材。秘藏着可激发出大锤、狩猎笛超越极限性能的力量。
560	猛者龙脉石·枪	素材	5	历战的猛者所拥有的素材。秘藏着可激发出长枪、铳枪超越极限性能的力量。
561	猛者龙脉石·斧	素材	5	历战的猛者所拥有的素材。秘藏着可激发出剑斧、盾斧超越极限性能的力量。
562	猛者龙脉石·柄	素材	5	历战的猛者所拥有的素材。秘藏着可激发出操虫棍、弓超越极限性能的力量。
563	猛者龙脉石·弩	素材	5	历战的猛者所拥有的素材。秘藏着可激发出轻弩炮 、重弩炮 超越极限性能的力量。
564	英雄龙脉石·剑	素材	7	光荣的英雄所拥有的素材。秘藏着可激发出大剑、太刀超越极限性能的力量。
565	英雄龙脉石·刃	素材	7	光荣的英雄所拥有的素材。秘藏着可激发出片手剑、双剑超越极限性能的力量。
566	英雄龙脉石·锤	素材	7	光荣的英雄所拥有的素材。秘藏着可激发出大锤、狩猎笛超越极限性能的力量。
567	英雄龙脉石·枪	素材	7	光荣的英雄所拥有的素材。秘藏着可激发出长枪、铳枪超越极限性能的力量。
568	英雄龙脉石·斧	素材	7	光荣的英雄所拥有的素材。秘藏着可激发出剑斧、盾斧超越极限性能的力量。
569	英雄龙脉石·柄	素材	7	光荣的英雄所拥有的素材。秘藏着可激发出操虫棍、弓超越极限性能的力量。
570	英雄龙脉石·弩	素材	7	光荣的英雄所拥有的素材。秘藏着可激发出轻弩炮、重弩炮超越极限性能的力量。
571	餐券	素材	3	可免费食用特别餐点的票券。可得到比一般餐点更高的效果。
572	古代龙人的票据	素材	3	新大陆的古代龙人所使用的票据。可在神秘炼金的设施中，交换便利的道具。
573	古代龙人的票据·大	素材	3	新大陆的古代龙人所使用的票据。可在神秘炼金的设施中，交换便利的道具。
574	钢之龙人票据	素材	3	新大陆的古代龙人所使用的票据。可在神秘炼金的设施中，交换便利的道具。
575	银之龙人票据	素材	3	新大陆的古代龙人所使用的票据。可在神秘炼金的设施中，交换便利的道具。
576	金之龙人票据	素材	3	新大陆的古代龙人所使用的票据。可在神秘炼金的设施中，交换便利的道具。
577	勇气之证	素材	4	是展现出其身的勇气时，可获得的票券。收集后将会有好事发生！？
578	勇气之证·大	素材	6	是展现出伟大的勇气时，可获得的票券。收集后将会有好事发生！？
579	调查团票	素材	6	总司令给予对调查团有贡献者的票券。交给加工屋后，会……？
580	毒妖鸟硬币	素材	3	赠予在斗技大会中征服了毒妖鸟之人的硬币。
581	搔鸟硬币	素材	3	赠予在斗技大会中征服了搔鸟之人的硬币。
582	雌火龙硬币	素材	3	赠予在斗技大会中征服了雌火龙之人的硬币。
583	眩鸟硬币	素材	3	赠予在斗技大会中征服了眩鸟之人的硬币。
584	土砂龙硬币	素材	3	赠予在斗技大会中征服了土砂龙之人的硬币。
585	岩贼龙硬币	素材	3	赠予在斗技大会中征服了岩贼龙之人的硬币。
586	火龙硬币	素材	3	赠予在斗技大会中征服了火龙之人的硬币。
587	兽龙硬币	素材	3	赠予在斗技大会中同时征服了多数兽龙种之人的硬币。
588	飞龙硬币	素材	3	赠予在斗技大会中同时征服了多数飞龙种之人的硬币。
589	斗技王硬币	素材	3	赠予彻底精通狩猎相关技能之人的名誉硬币。其光辉是无价之宝。
590	狩猎王硬币	素材	5	赠予真猎人的名誉白银硬币。其至高无上的光辉，正表示着狩猎王的荣耀。
591	击龙王硬币	素材	7	赠与最顶尖猎人的金色硬币。在众多猎人中，也只有少数人可拥有。
592	钢蛋	素材	3	闪闪发光的钢蛋。是拥有巨大价值的珍宝。<STYL MOJI_YELLOW_DEFAULT>（换金道具）</STYL>
593	银蛋	素材	3	闪闪发光的银蛋。是拥有巨大价值的珍宝。<STYL MOJI_YELLOW_DEFAULT>（换金道具）</STYL>
594	金蛋	素材	3	闪闪发光的金蛋。是可产生亿万财富的珍宝。<STYL MOJI_YELLOW_DEFAULT>（换金道具）</STYL>
595	缺损的鳞片	素材	3	是利用掠夺衣装获得的素材。虽有缺损，但可卖给收藏家。<STYL MOJI_YELLOW_DEFAULT>（换金道具）</STYL>
596	大鳞片	素材	3	是利用掠夺衣装获得的素材。有超越一般规格的大小，可推荐给收藏家。<STYL MOJI_YELLOW_DEFAULT>（换金道具）</STYL>
597	漂亮的鳞片	素材	4	利用掠夺衣装获得的素材。在收藏家中很有人气的珍品。<STYL MOJI_YELLOW_DEFAULT>（换金道具）</STYL>
598	鲜艳的鳞片	素材	5	利用掠夺衣装获得的素材。足以可向收藏家炫耀的物品。<STYL MOJI_YELLOW_DEFAULT>（换金道具）</STYL>
599	闪烁的鳞片	素材	6	利用掠夺衣装获得的素材。收藏家求之不得的极品。<STYL MOJI_YELLOW_DEFAULT>（换金道具）</STYL>
600	贝尔纳石	素材	3	是从现大陆进口的进口品。观赏用的宝石，无法作为素材使用。<STYL MOJI_YELLOW_DEFAULT>（换金道具）</STYL>
601	东多尔玛磷矿	素材	3	是从现大陆进口的进口品。观赏用的宝石，无法作为素材使用。<STYL MOJI_YELLOW_DEFAULT>（换金道具）</STYL>
602	洛克拉克矿	素材	4	是从现大陆进口的进口品。观赏用的宝石，无法作为素材使用。<STYL MOJI_YELLOW_DEFAULT>（换金道具）</STYL>
603	巴尔巴雷石英	素材	5	是从现大陆进口的进口品。观赏用的宝石，无法作为素材使用。<STYL MOJI_YELLOW_DEFAULT>（换金道具）</STYL>
604	米那加尔迪结晶	素材	6	是从现大陆进口的进口品。观赏用的宝石，无法作为素材使用。<STYL MOJI_YELLOW_DEFAULT>（换金道具）</STYL>
605	黄金的鳞片	素材	3	黄金鱼的鳞片。闪烁着如同黄金般的光芒。<STYL MOJI_YELLOW_DEFAULT>（换金道具）</STYL>
606	黄金的大鳞片	素材	4	大黄金鱼的鳞片。其黄金光辉是富有魅力的顶级品。<STYL MOJI_YELLOW_DEFAULT>（换金道具）</STYL>
607	白金的鳞片	素材	3	白金鱼的鳞片。绽放着白金光芒。<STYL MOJI_YELLOW_DEFAULT>（换金道具）</STYL>
608	白金的大鳞片	素材	4	大白金鱼的鳞片。绽放着耀眼过人光芒的顶级品。<STYL MOJI_YELLOW_DEFAULT>（换金道具）</STYL>
609	金色鳞片	素材	3	小金鱼的鳞片。作为工艺品素材的价值很高。<STYL MOJI_YELLOW_DEFAULT>（换金道具）</STYL>
610	金色大鳞片	素材	4	小金鱼王的鳞片。可用来制作最高级的工艺品。<STYL MOJI_YELLOW_DEFAULT>（换金道具）</STYL>
611	白肝	换算道具	1	如字面所述的白色肝脏。其融化般的口感非常受欢迎！<STYL MOJI_YELLOW_DEFAULT>（结算道具）</STYL>
612	龙之泪	换算道具	2	龙类只有在特殊的行动时才会流下的大颗贵重眼泪。<STYL MOJI_YELLOW_DEFAULT>（结算道具）</STYL>
613	大颗的龙之泪	换算道具	4	龙类只有在特殊的行动时才会流下的大颗贵重眼泪。<STYL MOJI_YELLOW_DEFAULT>（结算道具）</STYL>
614	龙秘宝	换算道具	2	古龙种喜好收集的宝石。闪闪发光。<STYL MOJI_YELLOW_DEFAULT>（结算道具）</STYL>
615	Unavailable	换算道具	4	Unavailable
616	太阳花	换算道具	1	古代树森林的特产。沐浴在太阳光下绽开的花。<STYL MOJI_YELLOW_DEFAULT>（结算道具）</STYL>
617	亮光花	换算道具	2	古代树森林的稀有特产。香味令人忆起叶缝间洒落的阳光之花。<STYL MOJI_YELLOW_DEFAULT>（结算道具）</STYL>
618	黄金花	换算道具	3	古代树森林的贵重特产。可喻为黄金般美丽的花。<STYL MOJI_YELLOW_DEFAULT>（结算道具）</STYL>
619	特产茸菇	换算道具	1	古代树森林的特产。以独特口感为卖点的蘑菇。<STYL MOJI_YELLOW_DEFAULT>（结算道具）</STYL>
620	严选茸菇	换算道具	2	古代树森林的稀有特产。令料理人也为之赞叹的优质蘑菇。<STYL MOJI_YELLOW_DEFAULT>（结算道具）</STYL>
621	灵光茸菇	换算道具	3	古代树森林的贵重特产。包覆着梦幻光辉的蘑菇。<STYL MOJI_YELLOW_DEFAULT>（结算道具）</STYL>
622	小颗仙人掌	换算道具	1	大蚁冢荒地的特产。体积虽小，也有着结实果肉。<STYL MOJI_YELLOW_DEFAULT>（结算道具）</STYL>
623	大颗仙人掌	换算道具	2	大蚁冢荒地的稀有特产。体积大，里头充满着果肉。<STYL MOJI_YELLOW_DEFAULT>（结算道具）</STYL>
624	国王仙人掌	换算道具	3	大蚁冢荒地的贵重特产。其品质与国王之名相衬的植物。<STYL MOJI_YELLOW_DEFAULT>（结算道具）</STYL>
625	坚实果	换算道具	1	大蚁冢荒地的特产。皮很坚硬，但果肉很柔软。<STYL MOJI_YELLOW_DEFAULT>（结算道具）</STYL>
626	岩石果	换算道具	2	大蚁冢荒地的稀有特产。外皮有如岩石般坚硬的植物。<STYL MOJI_YELLOW_DEFAULT>（结算道具）</STYL>
627	狂野水果	换算道具	3	大蚁冢荒地的贵重特产。拥有行家才懂的狂野味道。<STYL MOJI_YELLOW_DEFAULT>（结算道具）</STYL>
628	特产壶鲍	换算道具	1	陆珊瑚台地的特产。珍奇美味很有人气的藤壶鲍鱼。<STYL MOJI_YELLOW_DEFAULT>（结算道具）</STYL>
629	严选壶鲍	换算道具	2	陆珊瑚台地的稀有特产。味道、大小都是顶级品的藤壶鲍鱼。<STYL MOJI_YELLOW_DEFAULT>（结算道具）</STYL>
630	秘藏壶鲍	换算道具	3	陆珊瑚台地的贵重特产。被誉为珍味中之珍味的藤壶鲍鱼。<STYL MOJI_YELLOW_DEFAULT>（结算道具）</STYL>
631	光明珍珠	换算道具	1	陆珊瑚台地的特产。绽放明亮光辉的珍珠。<STYL MOJI_YELLOW_DEFAULT>（结算道具）</STYL>
632	深邃珍珠	换算道具	2	陆珊瑚台地的稀有特产。绽放深邃光辉的珍珠。<STYL MOJI_YELLOW_DEFAULT>（结算道具）</STYL>
633	洁白珍珠	换算道具	3	陆珊瑚台地的贵重特产。绽放纯洁无瑕光辉的珍珠。<STYL MOJI_YELLOW_DEFAULT>（结算道具）</STYL>
634	古老化石	换算道具	1	瘴气之谷的特产。残留着古老时代痕迹的化石。<STYL MOJI_YELLOW_DEFAULT>（结算道具）</STYL>
635	梦幻化石	换算道具	2	瘴气之谷的稀有特产。现代已灭绝的生物化石。<STYL MOJI_YELLOW_DEFAULT>（结算道具）</STYL>
636	神秘化石	换算道具	3	瘴气之谷的贵重特产。为解开太古之谜的关键化石。<STYL MOJI_YELLOW_DEFAULT>（结算道具）</STYL>
637	地底的果实	换算道具	1	瘴气之谷的特产。生长于无日光照射的地底水果。<STYL MOJI_YELLOW_DEFAULT>（结算道具）</STYL>
638	瘴气果实	换算道具	2	瘴气之谷的稀有特产。在严峻的环境下也能生长的水果。<STYL MOJI_YELLOW_DEFAULT>（结算道具）</STYL>
639	彼岸的果实	换算道具	3	瘴气之谷的贵重特产。香味令人觉得不属于这世界的水果。<STYL MOJI_YELLOW_DEFAULT>（结算道具）</STYL>
640	大地琥珀	换算道具	1	龙结晶之地的特产。从大地中自然渗出的美丽琥珀。<STYL MOJI_YELLOW_DEFAULT>（结算道具）</STYL>
641	龙脉琥珀	换算道具	2	龙结晶之地的稀有特产。可感受到大地能量的琥珀。<STYL MOJI_YELLOW_DEFAULT>（结算道具）</STYL>
642	太古琥珀	换算道具	3	龙结晶之地的贵重特产。蕴藏着太古记忆的琥珀。<STYL MOJI_YELLOW_DEFAULT>（结算道具）</STYL>
643	蓝色海石	换算道具	1	龙结晶之地的特产。会令人忆起大海的蓝色宝石。<STYL MOJI_YELLOW_DEFAULT>（结算道具）</STYL>
644	真实海石	换算道具	2	龙结晶之地的稀有特产。有着如看透真实般通透颜色的宝石。<STYL MOJI_YELLOW_DEFAULT>（结算道具）</STYL>
645	深渊海石	换算道具	3	龙结晶之地的贵重特产。有着像要被吸入般深邃颜色的宝石。<STYL MOJI_YELLOW_DEFAULT>（结算道具）</STYL>
646	百阳草	换算道具	3	古代树森林的特别特产。可用来治百病的植物。<STYL MOJI_YELLOW_DEFAULT>（结算道具）</STYL>
647	月夜菌	换算道具	3	古代树森林的特别特产。绽放着如月光般淡淡光辉的茸菇。<STYL MOJI_YELLOW_DEFAULT>（结算道具）</STYL>
648	龙花果	换算道具	3	大蚁冢荒地的特别特产。拥有如龙的鳞片般坚硬的果实。<STYL MOJI_YELLOW_DEFAULT>（结算道具）</STYL>
649	热带菠萝	换算道具	3	大蚁冢荒地的特别特产。不太成长的热带水果。<STYL MOJI_YELLOW_DEFAULT>（结算道具）</STYL>
650	藤蔓色壶鲍	换算道具	3	陆珊瑚台地的特别特产。香气、味道皆有独特变化的藤壶鲍鱼。<STYL MOJI_YELLOW_DEFAULT>（结算道具）</STYL>
651	白金珍珠	换算道具	3	陆珊瑚台地的特别特产。绽放着金属般光辉的珍珠。<STYL MOJI_YELLOW_DEFAULT>（结算道具）</STYL>
652	魔之化石	换算道具	3	瘴气之谷的特别特产。蕴含着不可言喻的不祥化石。<STYL MOJI_YELLOW_DEFAULT>（结算道具）</STYL>
653	天堂莓果	换算道具	3	瘴气之谷的特别特产。味道刺激到几乎令人升天的植物。<STYL MOJI_YELLOW_DEFAULT>（结算道具）</STYL>
654	黄昏石	换算道具	3	龙结晶之地的特别特产。颜色令人忆起虚幻夕阳的宝石。<STYL MOJI_YELLOW_DEFAULT>（结算道具）</STYL>
655	诺亚石	换算道具	3	龙结晶之地的特别特产。其光辉像是要将观赏者吞噬般的宝石。<STYL MOJI_YELLOW_DEFAULT>（结算道具）</STYL>
656	飞龙的蛋	换算道具	4	飞龙种的蛋。若能顺利将其带回营地，就能交货……<STYL MOJI_YELLOW_DEFAULT>（结算道具）</STYL>
657	草食龙的蛋	换算道具	3	草食龙的蛋。若能顺利将其带回营地，就能交货……<STYL MOJI_YELLOW_DEFAULT>（结算道具）</STYL>
