Item ID	Item Name	Item Type	Rare	Item Desc
603	كوارتز فال هابار	Material	5	عنصر مستورد من العالم القديم. جميل،لكن غير مناسب للصناعة.<STYL MOJI_YELLOW_DEFAULT>(عنصر للمبادلة)</STYL>
604	ماينغاردينايت	Material	6	عنصر مستورد من العالم القديم. جميل،لكن غير مناسب للصناعة.<STYL MOJI_YELLOW_DEFAULT>(عنصر للمبادلة)</STYL>
605	قشرة ذهبية	Material	3	قشور من سمكة ذهبية.تلمع كذهب نقي.<STYL MOJI_YELLOW_DEFAULT>(عنصر للمبادلة)</STYL>
606	قشرة ذهبية+	Material	4	قشور من سمكة ذهبية ضخمة.بثمن الذهب الحقيقي نفسه.<STYL MOJI_YELLOW_DEFAULT>(عنصر للمبادلة)</STYL>
607	قشرة بلاتينية	Material	3	قشور من سمكة بلاتينية.تمنح لمعانًا جميلًا.<STYL MOJI_YELLOW_DEFAULT>(عنصر للمبادلة)</STYL>
608	قشرة بلاتينية+	Material	4	قشور من سمكة بلاتينية ضخمة.بريقها يتألق ويشعر به العميان.<STYL MOJI_YELLOW_DEFAULT>(عنصر للمبادلة)</STYL>
609	قشرة مطلية بالذهب	Material	3	قشور من السمكة الذهبية.يستخدمها الحرفيون في صناعتهم.<STYL MOJI_YELLOW_DEFAULT>(عنصر للمبادلة)</STYL>
610	قشرة مطلية بالذهب+	Material	4	قشور من سمكة قشور ذهبية.تُستخدم في أفضل الصناعات.<STYL MOJI_YELLOW_DEFAULT>(عنصر للمبادلة)</STYL>
611	كبد أبيض	Account Item	1	كبد أبيض اللون، ذو شعبيةلملمسه الطريّ.<STYL MOJI_YELLOW_DEFAULT>(عنصر حساب)</STYL>
612	دمعة تنين مجنح	Account Item	2	دموع مريرة يذرفها التنين المجنحفي مناسبات خاصة.<STYL MOJI_YELLOW_DEFAULT>(عنصر حساب)</STYL>
613	دمعة تنين مجنح ضخمة	Account Item	4	دموع مريرة ضخمة يذرفهاالتنين المجنح في مناسبات خاصة.<STYL MOJI_YELLOW_DEFAULT>(عنصر حساب)</STYL>
614	كنز التنين	Account Item	2	حجر لامعتحب التنانين المعمِّرة جمعه.<STYL MOJI_YELLOW_DEFAULT>(عنصر حساب)</STYL>
615	Unavailable	Account Item	4	Unavailable
616	زهرة الشمس	Account Item	1	زهرة من الغابة العتيقة. أشبعت بدفء الشمس. <STYL MOJI_YELLOW_DEFAULT>(عنصر حساب)</STYL>
617	زهرة البريق	Account Item	2	زهرة نادرة من الغابة العتيقة. تحوي عبق نور الشمس في بتلاتها. <STYL MOJI_YELLOW_DEFAULT>(عنصر حساب)</STYL>
618	الزهرة الذهبية	Account Item	3	زهرة ثمينة من الغابة العتيقة. لها بريق يفوق الذهب. <STYL MOJI_YELLOW_DEFAULT>(عنصر حساب)</STYL>
619	قلنسوة فطر الذواقة	Account Item	1	فطر من الغابة العتيقة. معروف بطراوته. <STYL MOJI_YELLOW_DEFAULT>(عنصر حساب)</STYL>
620	قلنسوة الفطر الفاخر	Account Item	2	فطر نادر من الغابة العتيقة. مطلوب بكثرة من الطهاة. <STYL MOJI_YELLOW_DEFAULT>(عنصر حساب)</STYL>
621	قلنسوة فطر الروح	Account Item	3	فطر ثمين من الغابة العتيقة. له وهج رائع. <STYL MOJI_YELLOW_DEFAULT>(عنصر حساب)</STYL>
622	صبّار حلية	Account Item	1	صبّار من أنقاض الهياكل الشرسة.صغير ولكن سمين.<STYL MOJI_YELLOW_DEFAULT>(عنصر حساب)</STYL>
623	صبار الجوهرة	Account Item	2	صبّار نادر من أنقاض الهياكل الشرسة.كبير وسمين.<STYL MOJI_YELLOW_DEFAULT>(عنصر حساب)</STYL>
624	الصبار الملكي	Account Item	3	صبّار ثمين من أنقاض الهياكل الشرسة.ملك الوخز بلا شك.<STYL MOJI_YELLOW_DEFAULT>(عنصر حساب)</STYL>
625	فاكهة صلبة	Account Item	1	فاكهة من أنقاض الهياكل الشرسة. صلبةمن الخارج، مليئة بالعصير من الداخل.<STYL MOJI_YELLOW_DEFAULT>(عنصر حساب)</STYL>
626	فاكهة حجرية	Account Item	2	فاكهة نادرة من أنقاض الهياكل الشرسة.شهية، لكن صعبة المضغ.<STYL MOJI_YELLOW_DEFAULT>(عنصر حساب)</STYL>
627	فاكهة برية	Account Item	3	فاكهة ثمينة من أنقاض الهياكل الشرسة.ليست لضعاف القلوب.<STYL MOJI_YELLOW_DEFAULT>(عنصر حساب)</STYL>
628	أُذن البحر المميز	Account Item	1	أطعمة بحرية من المرتفعات المرجانية.أطعمة شهية نادرة.<STYL MOJI_YELLOW_DEFAULT>(عنصر حساب)</STYL>
629	أُذن البحر المفضل	Account Item	2	أطعمة بحرية نادرة من المرتفعاتالمرجانية. كبيرة الحجم، شهية المذاق.<STYL MOJI_YELLOW_DEFAULT>(عنصر حساب)</STYL>
630	أُذن البحر الثمين	Account Item	3	أطعمة بحرية ثمينة من المرتفعاتالمرجانية. شهية للغاية.<STYL MOJI_YELLOW_DEFAULT>(عنصر حساب)</STYL>
631	لؤلؤة خفيفة	Account Item	1	حلية من المرتفعات المرجانية.تلمع بشدة.<STYL MOJI_YELLOW_DEFAULT>(عنصر حساب)</STYL>
632	لؤلؤة عميقة	Account Item	2	حلية نادرة من المرتفعات المرجانية.تشع ببريق عميق.<STYL MOJI_YELLOW_DEFAULT>(عنصر حساب)</STYL>
633	لؤلؤة بريئة	Account Item	3	حلية ثمينة من المرتفعات المرجانية.تتألق بنقاء.<STYL MOJI_YELLOW_DEFAULT>(عنصر حساب)</STYL>
634	أحفورة منسية	Account Item	1	أحفورة من الوادي المتعفن.تُظهر آثار عصور قديمة.<STYL MOJI_YELLOW_DEFAULT>(عنصر حساب)</STYL>
635	أحفورة أسطورية	Account Item	2	أحفورة نادرة من الوادي المتعفن.تحمل حياة منقرضة من فترة طويلة.<STYL MOJI_YELLOW_DEFAULT>(عنصر حساب)</STYL>
636	أحفورة غامضة	Account Item	3	أحفورة ثمينة من الوادي المتعفن.مفتاح لحل لغز غامض.<STYL MOJI_YELLOW_DEFAULT>(عنصر حساب)</STYL>
637	فاكهة سفلية	Account Item	1	فاكهة من الوادي المتعفن.تنمو للنضوج من دون الشمس.<STYL MOJI_YELLOW_DEFAULT>(عنصر حساب)</STYL>
638	فاكهة متعفنة	Account Item	2	فاكهة نادرة من الوادي المتعفن.تزدهر في ظروف شاقة<STYL MOJI_YELLOW_DEFAULT>(عنصر حساب)</STYL>
639	فاكهة فردوسية	Account Item	3	فاكهة نادرة من الوادي المتعفن.رائحتها ليست من هذا العالم.<STYL MOJI_YELLOW_DEFAULT>(عنصر حساب)</STYL>
640	كهرمان غايا	Account Item	1	كهرمان من مخبأ التنين المعمِّر.شظية ذهبية منبثقة من الأرض.<STYL MOJI_YELLOW_DEFAULT>(عنصر حساب)</STYL>
641	كهرمان دراغونفاين	Account Item	2	كهرمان نادر من مخبأ التنين المعمِّر.ينبض بطاقة خام طبيعية.<STYL MOJI_YELLOW_DEFAULT>(عنصر حساب)</STYL>
642	كهرمان قديم	Account Item	3	كهرمان ثمين من مخبأ التنين المعمِّر.قطعة من عصر قديم.<STYL MOJI_YELLOW_DEFAULT>(عنصر حساب)</STYL>
643	بيريل الأزرق	Account Item	1	جوهرة من مخبأ التنين المعمِّر.تشع بلون الأمواج.<STYL MOJI_YELLOW_DEFAULT>(عنصر حساب)</STYL>
644	بيريل الخالص	Account Item	2	جوهرة نادرة من مخبأ التنينالمعمِّر. تلمع بوضوح الحقيقة.<STYL MOJI_YELLOW_DEFAULT>(عنصر حساب)</STYL>
645	بيريل البحار العميقة	Account Item	3	جوهرة ثمينة من مخبأ التنينالمعمِّر. لها طيف مؤثر قوي.<STYL MOJI_YELLOW_DEFAULT>(عنصر حساب)</STYL>
646	عشب قبلة الشمس	Account Item	3	نبتة خاصة من الغابة العتيقة. معروفة بقدرتها على شفاء كل العلل. <STYL MOJI_YELLOW_DEFAULT>(عنصر حساب)</STYL>
647	فطر القمر المضيء	Account Item	3	نبتة خاصة من الغابة العتيقة. تتوهج كالبدر في تمامه. <STYL MOJI_YELLOW_DEFAULT>(عنصر حساب)</STYL>
648	زهرة التنين	Account Item	3	زهرة خاصة من أنقاضالهياكل الشرسة. لها قشرة تنين.<STYL MOJI_YELLOW_DEFAULT>(عنصر حساب)</STYL>
649	التفاح المقدس	Account Item	3	فاكهة خاصة من أنقاضالهياكل الشرسة. يصعب زراعتها.<STYL MOJI_YELLOW_DEFAULT>(عنصر حساب)</STYL>
650	أُذن البحر البنفسجي	Account Item	3	طعام بحري خاص من المرتفعاتالمرجانية. فريد في المذاق والنكهة.<STYL MOJI_YELLOW_DEFAULT>(عنصر حساب)</STYL>
651	لؤلؤة بلاتينية	Account Item	3	حلية خاصة من المرتفعات المرجانية.تحمل لمعانًا معدنيًا.<STYL MOJI_YELLOW_DEFAULT>(عنصر حساب)</STYL>
652	أحفورة شريرة	Account Item	3	أحفورة خاصة من الوادي المتعفن.نذير شؤم.<STYL MOJI_YELLOW_DEFAULT>(عنصر حساب)</STYL>
653	توت فردوسي	Account Item	3	فاكهة خاصة من الوادي المتعفن.قضمة واحدة ترسلك إلى بوابات الفردوس.<STYL MOJI_YELLOW_DEFAULT>(عنصر حساب)</STYL>
654	حجر الشفق	Account Item	3	جوهرة خاصة من مخبأ التنينالمعمِّر. بلون شمس الغروب.<STYL MOJI_YELLOW_DEFAULT>(عنصر حساب)</STYL>
655	حجر نواه	Account Item	3	جوهرة خاصة من مخبأ التنينالمعمِّر. يجتاح تألقها كل شيء.<STYL MOJI_YELLOW_DEFAULT>(عنصر حساب)</STYL>
656	بيض التنين المجنح	Account Item	4	بيضة تنين مجنح طائر.سلّمها إلى المعسكر... إن كنت تستطيع.<STYL MOJI_YELLOW_DEFAULT>(عنصر حساب)</STYL>
657	بيضة آكل النبات	Account Item	3	بيضة آكل النبات.سلّمها إلى المعسكر... إن كنت تستطيع.<STYL MOJI_YELLOW_DEFAULT>(عنصر حساب)</STYL>
658	كتلة من اللحم	Account Item	3	كتلة لحم تركها أودوغارون.رائحتها المميزة تجذب آكلي اللحوم.<STYL MOJI_YELLOW_DEFAULT>(عنصر حساب)</STYL>
659	الأرنب الراعي	Account Item	1	حيوان عادة ما يُرى ينطلقعبر الممرات الضيقة. اتبعهوقد تكتشف طريقًا مختصرًا جديدًا.
660	الأرنب القائد	Account Item	3	حيوان نادر يظهر في الأيام المشمسة.يعتقد البعض أنه يرشد المسافرينالذين ضلوا الطريق.
661	طائر تريكس بري	Account Item	1	طائر يقطن الغابات.تشبه عظامه وريشه مخلوقاتعصور ما قبل التاريخ.
662	طائر تريكس دغلي	Account Item	3	طائر نادر يشبه السلالات المتحجرةإلا أنه يتميز بهيئة لا مثيل لها.
663	فلاترفلاي كوبالت	Account Item	1	فراشة جميلةترفرف بجناحيها الأزرقين الداكنين.
664	فلاترفلاي الشبح	Account Item	3	فراشة لونها زاهٍ ونادرة للغاية.لم تُشاهد هذه الفراشة إلا نادرًاوفي الأيام المشمسة فقط.
665	مجثم التسلق	Account Item	1	حيوان برمائي احتفظ بالكثير منخصائصه البرمائية القديمة. يمكنسماع أغنياته أثناء هطول الأمطار.
666	غيكو الغابة	Account Item	1	سحلية تعيش بين الأشجار وبالقرب منالطحلب المضيء، تتغذى على الحشراتالتي تنجذب للضوء.
667	غيكو الهياكل الشرسة	Account Item	1	سحلية تتواجد بالقرب من تلال النمل.تلال النمل الضخمة تجذب أعدادًاهائلة.
668	غيكو الظلام	Account Item	2	سحلية تتواجد في الكهوفوأماكن مظلمة أخرى. يمثل تلونهاتحذيرًا لإبعاد الكائنات المفترسة.
669	غيكو القمر	Account Item	3	سحلية نادرة يسبب أكلها للطحلبالمضيء توهج ذيلها، وتلك سمةتستخدمها لإغواء الفريسة.
670	فابرونويد	Account Item	1	عنكبوت يعيش في الغابة العتيقةويحيك شباكًا أضخم من حجم بشري.
671	سكافانتولا	Account Item	2	عنكبوت أرضي طعامه الرئيسيالسمك العفن. عادة ما يعيشفي مجموعات بالقرب من أكوام العظام.
672	النسر	Account Item	1	طائر يتغذى على الجثث ويأكل لحمها.يُشاهد أحيانًا وهو يطير فوق الوحوشالضخمة.
673	بليزبيل	Account Item	1	طائر نباتي يتغذى على الفاكهةوالحبوب. يَألف البشر والمناطققرب أستيرا.
674	أومينفلاي	Account Item	1	حشرات تشع ضوءًا من ذيلها.عادة ما تومض باللون الأبيض،لكن ستومض بالأحمر عندما تكون في خطر.
675	أوغرفلاي	Account Item	3	حشرة غريبة نادرة، تظهر أثناء الطقسالمتقلب. تَبلغ هذه الحشرات فقط وقتهطول المطر.
676	سكايلبات	Account Item	1	تنين مجنح طائر تطور ليتكيفمع الحياة داخل الكهوف ويشبهالخفاش ولكنه أصغر منه حجمًا.
677	خنفساء الروث	Account Item	1	خنفساء معروفة بأنها تكون كراتمن روث الوحش. تحوّل العملية الروثإلى ذخيرة نبلة المعصم بعد تصلّبه.
678	خنفساء متفجرة	Account Item	2	خنفساء معروفة بأنها تُطلق أحجارًا ضخمة. جمع هذه الأحجار يعطيكبسولات نبلة المعصم المتفجرة.
679	باريكساس وردية	Account Item	1	سمكة لم تتغير عن شكل سلالتهاالقديمة. تبعد زعانفها الشوكيةمن يفترسها.
680	باريكساس وردية عظيمة	Account Item	3	سمكة باريكساس وردية هائلة الحجم.لا بد أن هذا السمكة عاشت آلافالسنين لتصل إلى هذا الحجم.
681	أروانا متفجرة	Account Item	1	سمكة برائحة البارود.استخدم قشرتها والأعشاب الناريةلصناعة كميات ضخمة من البارود.
682	أروانا مفجِرة	Account Item	1	سمكة برائحة البارود. استخدم قشورهاوالأعشاب النارية لصناعة كميات ضخمةمن البارود القوي
683	أروانا متفجرة ضخمة	Account Item	3	أروانا متفجرة هائلة الحجم.حجمها هائل وسريعة التقلب.يجب التعامل معها بحذر بالغ.
684	أروانا مفجِرة عظيمة	Account Item	3	أروانا مفجِرة هائلة الحجم.حجمها هائل وسريعة التقلب.يجب التعامل معها بحذر بالغ.
685	طائر مرجاني أنيق	Account Item	2	الاسم الشائع لأنثى الطائر المرجاني.لونها الوردي الجذاب نتيجة لطعامهاالمرجاني.
686	طائر مرجاني متأنق	Account Item	3	الاسم الشائع لذكر الطائر المرجاني.نادر للغاية، حيث يظهر فقط أثناءعملية التزاوج.
687	أندانغلر	Account Item	2	سمكة تحمل نتوءًا مضيئًا على رأسها،وتستخدمه لإغواء الميدوسو الطائرة،فريستها الأساسية.
688	كراك ناعم	Account Item	3	طائر نادر أسطوري، مغطى بزغبناعم. يتنقل على ظهر مضيفهالتكافلي.
689	كراك شائك	Account Item	3	طائر نادر أسطوري، مغطى بزغبقاس وخشن. يتنقل على ظهرمضيفه التكافلي.
690	هوغبوبي	Account Item	1	سمكة تقفز على سطح الماء، وتنشرزعانفها الصدرية لتتقدم أسرع.
691	بيتريكانس	Account Item	3	عُرف سابقًا بواسطة الأحافير،كان يُعتقد أن هذا النوع قد انقرض.كانت مفاجأة حقيقية باكتشاف غير ذلك.
692	علجوم الشلل	Account Item	1	علجوم يطلق غاز شلل عند التصادم.تأثيره قوي بما يكفي لشّل حتىالوحوش الضخمة.
693	علجوم النوم	Account Item	2	علجوم يطلق غاز تنويم عند التصادم.تأثيره قوي بما يكفي لإنامة حتىالوحوش الضخمة.
694	علجوم نيتروجيني	Account Item	2	علجوم يطلق هلامًا متفجرًا عندالتصادم. انفجاره قوي بما يكفيلصعق حتى الوحوش الضخمة.
695	دودة ضخمة	Account Item	2	مخلوق من المرتفعات المرجانية.انظر إليه بمستوى عينه لتهدئته،مما يتيح لك الاقتراب منه.
696	ملكة الدود الضخم	Account Item	3	مخلوق نادر يظهر فقط في اللياليالمقمرة. من المبهر رؤيته يرقصعلى النسيم.
697	نحلة الحيوية	Account Item	1	حشرة تجمع رحيقًا مقويًا في جسدهاوتطلقه على شكل سحابه عندما تُهاجم.
698	نحلة الحيوية العملاقة	Account Item	1	حشرة تخزن رحيقًا مركزًايترك سحابة مقوية عند إطلاقه.
699	الميدوسو الطائرة	Account Item	2	مخلوق أصلي من المرتفعات المرجانيةيتنقل عبر الرياح. موجود في المناطقذات النسيم الأقوى.
700	النملة الناقلة	Account Item	1	نمل يُعرف بحمله كافة العناصر والتينادرًا ما تضم مواد وحوش ضخمة.
701	هيركودروم	Account Item	1	خنفساء ضخمة تتميز بقرون هائلة.تسكن الهيركودروم سبع مناطقفحسب في الغابة العتيقة.
702	هيركودروم ذهبية	Account Item	1	خنفساء ذهبية لامعة، كان يُعتقدأنها تجذب الحظ. نشطة ليلًا.
703	هيركودروم منشورية	Account Item	3	خنفساء لامعة بألوان قوس قزح.بسبب طبيعتها الغسقية، لا تتم رؤيتهاسوى في أوقات الفجر والغسق.
704	النطاط الإمبراطور	Account Item	1	جندب صغير للغاية. يقفزبرشاقة وسرعة مما يجعلالإمساك به صعبًا.
705	النطاط المستبد	Account Item	3	حشرة آكلة نبات أليفة في السابق،خضعت لمرحلة تغير تحولت فيهاإلى آكلة جيفة وحشية.
706	الذبابة الوامضة	Account Item	1	حشرة تُطلق وميضًا لامعًا عندماتُضرب، ويَقوى وميضها حين تكونفي سرب. يعمي وميضها الوحوش.
707	المانتاغريل الجد	Account Item	2	مخلوق يستخدم تيار الهواء ليطفو فيالهواء. ضعيف عند التصادم، نفخةواحدة ستسقطه.
708	السلطعون الحديدي	Account Item	1	كائن قشري يتواجد في المناطق الموحلة.عادةً ما يحمل عناصر صلبة، وأحيانًاما يُسقط كبسولات ثقب.
709	سلطعون جندي	Account Item	2	كائن قشري يتواجد في الوادي المتعفن.يتنقل في مجموعات ضخمة، يجرداللحم من الجيف.
710	سلطعون زمردي	Account Item	3	كائن قشري جميل عادة ما يتواجدفي الطقس العاصف. يقال إنه أكثر ندرةمن الجوهرة التي يحمل اسمها.
711	سمكة وِت	Account Item	1	سمكة بزعنفة ظهرية قوية بما يكفيليتم استخدامها في شحذ الأسلحة.
712	سمكة وِت ضخمة	Account Item	3	سمكة وِت هائلة الحجم.تعد زعنفتها الظهرية حادة للغايةلدرجة تتعدى أحجار الشحذ نفسها.
713	تونة ذواقة	Account Item	1	سمكة تأكل أي شيء، تتيح لك أحيانًاالحصول على عناصر من معدتها.
714	تونة ذواقة ضخمة	Account Item	3	تونة ذواقة هائلة الحجم.شراهتها جعلتها أضخم الأسماك.
715	الملك مارلين	Account Item	3	سمكة بفك يشبه السيف.تعيش في المياه الدافئة، ولايمكن رؤيتها أثناء الليالي الباردة.
716	الملك مارلين العظيم	Account Item	3	سمكة أبو سيف هائلة الحجم.حجمها الهائل يجعلها تبدو كنوعمختلف تمامًا.
717	السمكة الذهبية	Account Item	2	سمكة نادرة تلمع وكأنهاذهب حقيقي. يمكن لقشرتهاأن تكون بنفس سعر الذهب أيضًا!
718	سمكة بلاتينية	Account Item	2	سمكة نادرة تشع مثلالبلاتين، ولها قشورلامعة بالقيمة المرتفعة ذاتها.
719	سمكة ذهبية ضخمة	Account Item	3	سمكة ذهبية هائلة الحجم. ليست أكبرحجمًا فحسب، بل ينافس لونهاوبريقها أعظم الأعمال الفنية.
720	سمكة بلاتينية ضخمة	Account Item	3	سمكة بلاتينية هائلة الحجم. ليست أكبرحجمًا فحسب، بل ينافس لونهاوبريقها أعظم الأعمال الفنية.
721	سمكة قشور ذهبية	Account Item	1	سمكة صغيرة نادرة تشع مثل الذهب.قشورها الذهبية غالية الثمن.
722	سمكة قشور ذهبية ضخمة	Account Item	3	سمكة قشور ذهبية هائلة الحجم.ليست أكبر حجمًا فحسب، بل ينافسلونها وبريقها أعظم الأعمال الفنية.
723	سمك سوشي	Account Item	1	سمك سمين مفضل للصيادين.قشره غني بالمغذياتويمكنه استعادة الصحة.
724	سمكة سوشي ضخمة	Account Item	3	سمكو سوشي عملاقة.مستديرة من كافة الجهاتلاحتوائها على مخزون غذائي كبير.
725	سمكة بارود	Account Item	2	سمكة رائحتها مثل البارود.يمكن استخدام قشرتها الفريدةكبارود متفجر.
726	سمكة بارود ضخمة	Account Item	3	سمكة بارود هائلة الحجم.حجمها هائل وسريعة التقلب.يجب التعامل معها بحذر بالغ.
727	حلية الترياق 1	Jewel	4	إضافة تُحسن منمهارة مقاومة السم.
728	حلية مضادة للشلل 1	Jewel	4	إضافة تُحسن منمهارة مقاومة الشلل.
729	حلية الحيوية 1	Jewel	4	إضافة تُحسن منمهارة مقاومة النوم.
730	حلية الثبات 1	Jewel	5	إضافة تُحسن منمهارة مقاومة الصعق.
731	حلية مقاومة الانفجار 1	Jewel	4	إضافة تُحسن من مهارة مقاومةالانفجار.
732	حلية التقطيب 1	Jewel	4	إضافة تُحسن من مهارة مقاومة النزيف.
733	حلية القفل الدفاعي 1	Jewel	4	إضافة تُحسن من مهارة الجلد الحديدي.
734	حلية سدادة الأذن 3	Jewel	5	إضافة تُحسن من مهارة سدادة الأذن.
735	حلية مقاومة الرياح 2	Jewel	5	إضافة تُحسن من مهارة صد الرياح.
736	حلية ثبات القدم 2	Jewel	5	إضافة تُحسن من مهارة مقاومة الزلزال.
737	Unavailable	Jewel	4	Unavailable
738	Unavailable	Jewel	4	Unavailable
739	حلية الهجوم 1	Jewel	6	إضافة تُحسن من مهارة تعزيز الهجوم.
740	حلية الدفاع 1	Jewel	5	إضافة تُحسن من مهارة تعزيز الدفاع.
741	حلية النشاط 1	Jewel	5	إضافة تُحسن من مهارة تعزيز الصحة.
742	حلية التعافي 1	Jewel	5	إضافة تُحسن من مهارة سرعة التعافي.
743	حلية مقاومة النار 1	Jewel	4	إضافة تُحسن من مهارة مقاومة النار.
744	حلية مقاومة الماء 1	Jewel	4	إضافة تُحسن من مهارة مقاومة الماء.
745	حلية مقاومة الثلج 1	Jewel	4	إضافة تُحسن من مهارة مقاومة الثلج.
746	حلية مقاومة الرعد 1	Jewel	4	إضافة تُحسن من مهارة مقاومة الرعد.
747	حلية مقاومة التنين 1	Jewel	4	إضافة تُحسن من مهارة مقاومة التنين.
748	حلية المقاوِم 1	Jewel	5	إضافة تُحسن من مهارة مقاومة الوباء.
749	حلية اللهيب 1	Jewel	5	إضافة تُحسن من مهارة هجوم النار.
750	حلية التيار 1	Jewel	5	إضافة تُحسن من مهارة هجوم الماء.
751	حلية الصقيع 1	Jewel	5	إضافة تُحسن من مهارة هجوم الثلج.
752	حلية الصاعقة 1	Jewel	5	إضافة تُحسن من مهارة هجوم الرعد.
753	حلية التنين 1	Jewel	5	إضافة تُحسن من مهارة هجوم التنين.
754	حلية السم 1	Jewel	5	إضافة تُحسن من مهارة هجوم السم.
