Item ID	Item Name	Item Type	Rare	Item Desc
0	--------	Material	0	Unavailable
1	الجرعة	Item	0	تستعيد كمية صغيرة منالصحة.
2	جرعة عملاقة	Item	1	تستعيد كمية متوسطة منالصحة.
3	الجرعة القصوى	Item	2	تستعيد كامل الصحةوتزيد من حجممقياس الصحة.
4	الجرعة القديمة	Item	4	تستعيد كامل الصحةوتزيد من حجممقياس الصحة والتحمل.
5	ترياق	Item	0	علاج للسم.
6	دواء عشبي	Item	1	يزيل كل آثار السم ويستعيدكمية طفيفة من الصحة.
7	نولبيري	Item	1	توت غامض يعالج أوبئة متعددة.
8	مشروب الطاقة	Item	1	شراب مصدَّق من النقابةيعزز من قوة تحمّلك.ويساعد أيضًا على الاستيقاظ!
9	مؤونة	Item	0	طعام يستعيد جزءًا من قوة التحمّل.
10	شريحة لحم مطهية قليلًا	Item	0	تعزز بشكل بسيط منقوة تحمّلك. لا تزال غير مطهوةمن المنتصف.
11	شريحة لحم مطهية جيدًا	Item	1	تعزز بشكل متوسط من قوة تحمّلكوتبقيها في أقصى مستوياتهالفترة أطول. مطهوة بشكل صحيح!
12	لحم محترق	Item	0	تعزز بشكل بسيط منقوة تحمّلك. يمكن أن تؤكل على الفور.
13	مشروب بارد	Item	0	يعطي ارتياح مؤقتمن الحرارة الشديدة.
14	المغذيات	Item	1	تزيد بشكل طفيف للغايةمن مستوى صحتك القصوى.
15	مغذيات هائلة	Item	2	تزيد بشكل طفيفمن مستوى صحتك القصوى.
16	المحصِن	Item	2	يعزز من قدرتك الطبيعية على الشفاء.
17	لحم أستيرا المقدد	Item	1	لحم طري مجفّف صنعه طاهي أستيرا.يعزز من التعافي الطبيعي ومعالجةالنزيف.
18	عصير الاندفاع	Item	1	يلغي الشعور بالإرهاق.ويقلل من استنزاف قوة التحمللفترة.
19	عصير الاندفاع الهائل	Material	3	يجعلك تنطلق دون تعبلمدة أطول من مدة عصيرالاندفاع المعتاد.
20	بذرة القوة	Item	1	تقوّي هجومك بصورة مؤقتةعند ابتلاعها من خلال تحسينتدفق الطاقة.
21	عقار العفريت	Item	3	يعزز من قوة هجومكمن خلال تزويدك بقوةالعفريت غير المتوقعة.
22	عقار العفريت الهائل	Item	4	يعزز من قوة هجومكأكثر من عقار العفريتالعادي.
23	قرص الطّاقة	Item	3	يعطيك قوةعظيمة بشكل مؤقت.يا لصلابته!
24	بذرة الصّلابة	Item	1	ترفع من دفاعك بشكل مؤقت عند ابتلاعها من خلال تقويةالأنسجة.
25	جلد مصفّح	Item	3	تعزز من دفاعك من خلالجعل جلدك قاسِ كالصخر.
26	جلد مصفّح عملاق	Item	4	يعزز من دفاعك أكثر منالدرع المصفح العادي.
27	قرص الصّلابة	Item	3	يجعل جلدك في غايةالصلابة بشكل مؤقت.يا لصلابته!
28	مسحوق الحياة	Item	3	ينشئ سحابة شفاء حول المستخدم.
29	المسحوق العشبي	Item	3	مسحوق غامض ينشئ سحابةحول المنطقة فتستعيد الصحةوتبطل أثر السم.
30	مسحوق العفريت	Item	3	مسحوق غامض ينشئ سحابةحول المنطقة فتقوّي من الهجوم بشكلمؤقت.
31	المسحوق الصلب	Item	3	مسحوق غامضة ينشئسحابة حول المنطقة فتقوّيمن الدفاع بشكل مؤقت.
32	عسل	Item	1	عسل مغذي للغاية. امزجه مع الجرعاتلصنع جرعات عملاقة لأقصى فعالية.
33	عشبة	Item	0	مكوِّن أساسي للجرعات.
34	عشب ترياق	Item	0	مكوِّن أساسي للترياق.
35	عشب النّار	Item	1	نبتة مذهلة قابلة للاشتعال.مفيدة في صناعة المتفجرات.
36	النّبتة المائية	Item	0	تخزّن أوراق هذا النّبات كمّيةكبيرة من المياه. تعدّ مكونًّالصنع ذخيرة الماء.
37	عشب الثّلج	Item	1	نبات يشعّ بهواء ثلجي.استخدمه في مزيج لإنشاءذخيرة تجميد.
38	عشب النّوم	Item	0	نبات يحتوي على عوامل النوم.يُستخدم لعمل مهدئات.
39	اللّبلاب	Item	0	نبتة خفيفةوقوية للغاية. تستخدم لعملشِباك لفخاخ الحفر.
40	مكسّرات الدخان	Item	0	تنتج كمية وافرة من الدخان.ادمجها مع عناصر أخرى كي تُنشئ دخانًابخصائص متعددة.
41	توت تبغضُه التّنانين	Item	3	توت غامض دارت حوله الشائعات منذالعصور القديمة بأن التنانين تبغضه.مطلوب لصناعة ذخيرة التنين.
42	الفطر الأزرق	Item	1	فطر مغمور بتأثيرات محسنة للقوة.يستخدم في العناصر المقوية.
43	تفّاح الجنّ	Item	2	فطر خطير يُقال إنه يستنزف الحياةمن البشر. احترس منه.مطلوب لصنع جرعات قصوى.
44	فطر النّيترو	Item	1	فطر صعب العثور عليهيسمح لك بإطلاق حرارة حارقة.مطلوب لصناعة البارود.
45	وباء الشّيطان	Item	1	فطر نادر جدًا ينبض بحرارة شديدة.قم بإضافته إلى برميل متفجركي تُحدث انفجارًا أقوى.
46	فطر الشّلل	Item	2	فطر يسبب الشلل.مطلوب لصناعة القنابل المهدئة.
47	كمأة	Item	1	فطر سامّ. يمكن استخدامهلكي يكون سُمًّا للسّكاكين.
48	فطر التّشويق	Item	2	يتميّز هذا الفطر برائحة غريبة جدًا.ولكن هل يمكن أكله؟ هناك طريقة واحدةلتعرف! مطلوب لصناعة النواقل البعيدة.
49	الحشرة اللاذعة	Item	0	حشرة لاذعة المذاق ذات قدراتعلاجية طبيعية. وهي مكون لكثير منالأدوية.
50	الحشرات المضيئة	Item	1	حشرة تُصدر وميضًاقويًا حين تموت.مطلوبة لصناعة الكبسولات الوميضة.
51	الحشرة العظيمة	Item	3	قيل أنها تعيش لأكثر من ألف عام.إدمجها بعناصر أخرى كي تضيفخصائصها للمسحوق.
52	الحشرة الصّاعقة	Item	3	حشرة تصدر طاقة كهربائيةحين يتم صعقها. مطلوبةلصناعة فخاخ الصدمة وذخيرة الرعد.
53	حشرة الطُعم	Item	2	حشرة تُستخدم كطُعم للسّمك.تُعتبرالمفضّلة لدى الأسماك،تتنافس عليها الأفواه بشدّة.
54	قرن كيلبي	Item	3	رغم أن قرون كيلبي غير عملية عندصناعة المعدات إلا أنها تعد مكونًامهمًا لكثير من العناصر.
55	مستخلص الإندفاع	Item	3	مادّة غامضة مُستخلصةمن وحوش معينة تزيدمن التحمّل.
56	مستخلص تغذية	Item	3	يمكن الحصول عليه من وحوش عملاقةمعينة. لديه القدرة على إبطال تأثيراتبعض الأدوية.
57	كيس الصّراخ	Item	1	أحد أعضاء الوحوش يصدر انفجارًامدوّيًا يصم الآذان عند تمزقه.يُستخدم لعمل كبسولات الصراخ.
58	المحفز	Item	1	يعمل مع مواد أخرىلتعزيز تأثيرها.لا يمكن أن يُستخدم وحيدًا.
59	قنبلة مهدئة	Item	2	قنبلة يدوية تستخدم لأسرالوحوش الواقعين في الفخاخ.يمكن ضربها في الأرض.
60	كبسولة وميض	Item	1	ذخيرة نبلة المعصم التي تومض بشدةعند التصادم.أطلقها أسفل أنف الوحش كي تعميه.
61	كبسولة الصراخ	Item	1	تستخدم كذخيرة نبلة المعصم.تُصدر صوتًا قويًا عالي التردد،يمكنه زعزعة الوحوش سريعي التأثر.
62	قنبلة دخان	Item	1	تطلق سحابة كبيرة من الدخانأينما تسقط.
63	قنبلة دخان سامة	Item	1	تُطلق سحابة سامة عند استخدامها.وتشتهر بأنها قنبلة حشرية.
64	الناقل البعيد	Item	2	استدعِ وينغدرايك وانتقل لأقرب معسكر.يمكن استخدامه أيضًا أثناء المعارك.
65	لحم نيئ	Item	0	لحم تم تقطيعه من وحش.يمكن طهوه أو جمّعهأو استخدامه لنصب فخ.
66	لحم مسمم	Item	1	لحم نيئ يصيب من يأكلهبالسم. ويعتبر طُعمًا رائعًايستخدم في نصب الفخاخ.
67	لحم مخلوط	Item	1	لحم نيئ يصيب من يأكلهبالشلل. ويعتبر طُعمًا رائعًايستخدم في نصب الفخاخ.
68	لحم مخدِر	Item	1	لحم نيء يضع من يأكله في حالة نعاس.يُعتبر طُعم رائع لنصب الفخاخ.
69	البارود	Item	1	مادة خطيرة تنفجر في حالة الاصطدام بها أو تسخينها.
70	برميل صغير	Item	0	برميل فارغ صغير.
71	برميل متفجر	Item	1	قنبلة موقوتة صغيرة.
72	قنبلة قفز	Item	1	تنطلق في الهواء عند استخدامها،هذه القنبلة المعدّلة تحتاج الىمهارة لاستعمالها.
73	قنبلة مرتدة ضخمة	Item	3	نسخة محسّنة من القنبلة المرتدة،هذه القنبلة المعدّلة تحتاج الىمهارة لاستعمالها.
74	برميل ضخم	Item	1	برميل ضخم فارغ.امزجه مع البارود لتحويلهإلى قنبلة.
75	برميل متفجر ضخم	Item	2	قنبلة قوية تنفجر بواسطةتصادم مادي خارجي.
76	برميل متفجر هائل	Item	3	برميل متفجر ضخمومطوّر. فعّال ضدالوحوش الضخمة.
77	نسيج العنكبوت	Item	0	نسيج في شدة اللزوجة.يُستخدم لصنع فخاخ من الحفر.
78	شبكة	Item	1	شبكة متينة تتحمل قدرًامعينًا من الوزن دون أن تنقطع.ممتازة لشِباك الحفر.
79	أداة الفخ	Item	2	عنصر واجب الحصول عليهلدمج الفخاخ من الحفر وأنواعأخرى من الفخاخ.
80	فخ حفرة	Item	2	فخ مُعدّ للإمساك ببعض الوحوش الضخمة. ويعمل الفخ مع المخلوقاتثقيلة الوزن.
81	فخ الصدمة	Item	2	فخ يصيب الهدف بالشلل.استخدمه للإمساك بالوحوش.
82	روث ملفوف	Item	0	كتلة من روث الوحوش.يُستخدم لعمل كبسولاتمن الروث لنبلة المعصم.
83	روث	Item	0	يصدر رائحة عجيبة. يُستخدم لعمل ذخيرة لنبلة المعصم تُدعى كبسولات الروث.
84	كبسولة الروث	Item	1	ذخيرة نبلة المعصم تُطلقرائحة قوية عند التصادم.تجعل بعض الوحوش تلوذ بالفرار.
85	طُعم الأروانا	Item	1	 كتلة من الطعم مفضلة لدى سمكالأروانا.
86	طُعم سمك البارود	Item	1	كتلة من الطعم مفضلة لدى سمكالبارود.
87	طُعم السمك الذهبي	Item	1	كتلة من الطعم مفضلة لدى السمكالذهبي.
88	البومرانغ	Item	3	سلاح مستورد غريب الشكليعود لحامله بعد إلقائه. 
89	نظارات مكبرة	Item	0	تمكّنك من الرؤية والمراقبةمن على بعد.
90	سحر القوة	Item	4	تميمة تقوّي من الهجوم.بمجرد أن تحملها تمنحك قوة عفريتية.
91	مخلب القوة	Item	4	سحر يقوّي من الهجوم.تأثيره يزيد بواسطة أجزاءالتنين التي يحتوي عليها.
92	سحر الدرع	Item	4	تميمة تزيد من الدفاع.بمجرد أن تحملها يزداد جلدك صلابةكالحجر.
93	مخلب الدرع	Item	4	سحر يزيد منالدفاع. تأثيره يزيد بواسطةأجزاء التنين التي يحتوي عليها.
94	حبة الإبر	Item	0	مكسرات مغطاة بشوك يشبه الإبر.تُستخدم لصنع ذخيرة منتشرة.
95	مكسرات متفجرة	Item	0	مكسرات تُستخدم لعمل ذخيرة لزجة.
96	مكسرات ضربة التنين	Item	1	مكسرات تنفجر عند التصادم.تُستخدم لعمل ذخيرة التنين المجنح.
97	حبة الضربة القاطعة	Item	0	تُستخدم لعمل ذخيرة تقطيع.
98	حبة القفل	Item	0	مكسرات تحتوي على تجويف حلزوني.تُستخدم لعمل ذخيرة ثقب.
99	حبة قنابل	Item	1	مكسرات تنفجر عند التصادم.تُستخدم لعمل قنابل عنقودية.
100	حبة اللهب	Item	1	تُستخدم لعمل باروديزيد من القوة النارية للذخيرة.
101	حبة اللهيب	Item	1	تُستخدم لصنع بارود يزيدبصورة كبيرةمن القوة النارية للذخيرة.
102	بارود من المستوى 2	Item	1	مسحوق قابل للاشتعال.قم بمزجه مع ذخيرةمن المستوى 1 لرفع مستواها.
103	بارود من المستوى 3	Item	1	مسحوق قابل للاشتعال بشكل كبير.قم بمزجه مع ذخيرةمن المستوى 1 لرفع مستواها.
104	زعنفة سمكة وِت	Item	1	زعنفة سمكة تُستخدم لشحذ الأسلحة.تستعيد الحدة بصورة كبيرة، ولكنلمرات استخدام أقل من حجر الشحذ.
105	زعنفة سمكة وِت+	Item	3	زعنفة سمكة تُستخدم لشحذ الأسلحة.تعمل بشكل أفضل من المَسن، ويمكنإعادة استخدامها إن كنت محظوظًا.
106	قشرة سمكة السوشي	Item	1	قشرة من سمك السوشي. تناولهالتستعيد كمية صغيرة من الصحة.تُستخدم أيضًا في علاج النزيف.
107	قشرة سمك السوشي العظيم	Item	3	قشرة من سمك السوشي الضخم.تناولها لتعزز صحتك بشكل كبير وتعزز الشفاءالطبيعي وتعالج النزيف.
108	قشرة سمكة البارود	Item	2	قشرة من سمك البارود. امزجهامع برميل متفجر ضخم كي تزيدبشكل كبير من قوته النارية.
109	قشرة سمك البارود العظيم	Item	3	قشرة من سمك البارود العظيم.قم بمزجها مع برميل متفجر ضخملعمل برميل متفجر هائل.
110	قشرة الأروانا المتفجرة	Item	1	قشرة من الأروانا المتفجرة.امزجها مع عشب النار لصنع كمية كبيرةمن بارود المستوى 2.
111	قشرة الأروانا المتفجرة الضخمة	Item	3	قشرة من الأروانا المتفجرة الضخمة.امزجها مع عشب النار لصنع كمية هائلةمن بارود المستوى 2.
112	قشرة أروانا مفجِرة	Item	1	قشرة من الأروانا المفجِرة.امزجها مع عشب النار لصنع كميةكبيرة من بارود المستوى 3.
113	قشرة أروانا مفجِرة عظيمة	Item	3	قشرة من الأروانا المفجِرة العظيمة.امزجها مع عشب النار لصنع كميةهائلة من بارود المستوى 3.
114	حجر الشحذ	Item	3	حجر شحذ من الحجم القياسي.استخدمه لاستعادة حدة السلاح.
115	شبكة أسر	Item	3	شبكة يمكن إطلاقها مننبلة المعصم. استخدمها للقبضعلى المخلوقات الصغيرة.
116	صنارة صيد	Item	3	أداة تُستخدم للصيد.
117	عصا شواء	Item	3	ما تحتاج إليه لطهي اللحم. عنصرلا بد لأي صيّاد جائع منالحصول عليه.
118	عباءة غيلي	Item	3	اختبئ عن الأنظار بشكل مؤقت.سينتهي التأثير إذا قمت بشنهجوم أو تلقيت ضررًا.
119	عباءة مؤقّتة	Item	3	تبطل مفعول الضررمن الهجمات القويةعن طريق التفادي التلقائي.
120	معزز الصحة	Item	3	بمجرد ارتطامه بالأرض، يطلقسحابة شفاء تستعيد تدريجيًاصحة مَن يقف بداخلها.
121	عباءة ثابتة	Item	3	تصمد أمام هجمات محددة،وتوفر لك حماية ضد ضغط الرياحوالأزيز والاهتزاز. وتقلل من الضرر.
122	عباءة المتحدّي	Item	3	تجذب الوحوش لك، مما يسهّلمن استدراجها لموقع أفضل.
123	عباءة الحيوية	Item	3	تبطل مفعول كمية محددة من الضرر.ينتهي التأثير إذا تمت الإصابةبكمية أكبر من هذه الكمية.
124	عباءة مقاومة للنيران	Item	3	تقلل من ضرر عنصر الناروتبطل مفعول وباء النارووباء الانفجار وضرر الحرارة.
125	عباءة مقاومة للماء	Item	3	تقلل من ضرر عنصر الماءوتبطل مفعول وباء الماء والوحل.وتجعلك تجتاز المياه العميقة أسهل.
126	عباءة مقاومة للثلج	Item	3	تقلل من ضرر عنصر الثلجوتبطل مفعول وباء الثلج.
127	عباءة مقاومة للرعد	Item	3	تقلل من ضرر عنصر الرعد.وتبطل مفعول وباء الرعد والشلل.
128	عباءة مقاومة للتنين	Item	3	تقلل من ضرر عنصر التنين,وتبطل مفعول وباء التنين أثناء زيادةهجوم عنصر التنين.
129	معزز المطهِر	Item	3	بمجرد ارتطامه بالأرض، يطلقسحابة شفاء تعالج أي حالة غريبةلمَن يقف بداخلها.
130	عباءة الطيران	Item	3	تمدد من وقت القفز في الهواء،وتجعلك تركب الرياح القويةوتسهّل من امتطاء الوحوش.
131	عباءة التفادي	Item	3	تزيد من مدة المناعةضد الأفعال المراوغة. راوغ الهجماتفي اللحظة الأخيرة لتعزيز الهجوم.
132	عباءة التصادم	Item	3	تضيف قيمة صعق لمعظم الهجماتوتعزز من تأثير الهجماتالتي تسبب الصعق.
133	عباءة الصيدلي	Item	3	تزيد من احتمالية مشاركةالأسلحة ذات الهجمات الخاصةفي تعزيز قوة الهجوم.
134	عباءة الحصانة	Item	3	تجتاز كل الوضعيات الغريبةوتمنح حصانة منهالمدة محدودة.
135	معزز النسبة	Item	3	بمجرد ارتطامه بالأرض، يطلقسحابة تعزز من النسبةلك ولأعضاء فريقك المحيطين بك.
136	عباءة قاطع الطريق	Item	3	تجعل الهجمات ضد الوحوش الضخمةتُسقط عناصر نادرة وقيّمة للمبادلة.
137	ذخيرة عادية 1	Ammo or Coating	3	ذخيرة للمبتدئين.تتم المهمة، ولكنها لاتحتوي على الكثير من السحر.
138	ذخيرة عادية 2	Ammo or Coating	1	ذخيرة غير متخصصة. أقوى منالذخيرة العادية 1.السعة: 99
139	ذخيرة عادية 3	Ammo or Coating	2	ذخيرة مصنوعة من بارود عالي الجودةكل طلقة تلحق ضررًا شديدًا.السعة: 99
140	ذخيرة ثقب 1	Ammo or Coating	0	ذخيرة ثاقبة للدروع تلحقضربات متعددة لبعض الوحوش.السعة: 60
141	ذخيرة ثقب 2	Ammo or Coating	1	ذخيرة ثاقبة للدروع مطوّرة.تلحق ضربات أكثر من ذخيرة ثاقب 1.السعة: 60
142	ذخيرة ثقب 3	Ammo or Coating	2	ذخيرة ثاقبة للدروع عالية الجودة.تلحق ضربات متعددة.السعة: 60
143	ذخيرة منتشرة 1	Ammo or Coating	0	ذخيرة تغطّي مساحة واسعة.تلحق ضربات متعددة من مدى قريب.السعة: 80
144	ذخيرة منتشرة 2	Ammo or Coating	1	ذخيرة مطوّرة تغطّي مساحة واسعة.تلحق ضربات متعددة أكثر من ذخيرةمنتشرة 1. السعة: 70
145	ذخيرة منتشرة 3	Ammo or Coating	2	ذخيرة عالية الجودة تغطّيمساحة واسعة وتلحق ضربات متعددة.السعة: 60
146	ذخيرة لزجة 1	Ammo or Coating	0	ذخيرة قوية تصيب هدفًاوتنفجر. وتصعق أيضًا.السعة: 9
147	ذخيرة لزجة 2	Ammo or Coating	1	ذخيرة قوية جدًا تصيب هدفًاوتنفجر. وتصعق أيضًا.السعة: 9
148	ذخيرة لزجة 3	Ammo or Coating	2	ذخيرة في شدة القوة تصيب هدفًاوتنفجر. وتصعق أيضًا.السعة: 9
149	قنبلة عنقودية 1	Ammo or Coating	1	ذخيرة تنقسم إلى ثلاث قذائفعند التصادم. احذر النيران الصديقة!السعة: 3
150	قنبلة عنقودية 2	Ammo or Coating	2	ذخيرة تنقسم إلى أربع قذائفعند التصادم. احذر النيران الصديقة!السعة: 3
151	قنبلة عنقودية 3	Ammo or Coating	3	ذخيرة تنقسم إلى خمس قذائفعند التصادم. احذر النيران الصديقة!السعة: 3
152	الذخيرة الملتهبة	Ammo or Coating	1	ذخيرة تؤثر بشدة علىالوحوش سريعة التأثر بالنيران.السعة: 60
153	ذخيرة الماء	Ammo or Coating	1	ذخيرة تؤثر بشدة علىالوحوش سريعة التأثر بالماء.السعة: 60
154	ذخيرة الرعد	Ammo or Coating	1	ذخيرة تؤثر بشدة علىالوحوش سريعة التأثر بالرعد.السعة: 60
155	ذخيرة التجميد	Ammo or Coating	1	ذخيرة تؤثر بشدة علىالوحوش سريعة التأثر بالثلج.السعة: 60
156	ذخيرة التنين	Ammo or Coating	2	ذخيرة مليئة بقوة التنين تؤثر بشدةعلى الوحوش الضعيفة أمام التنانين.السعة: 3
157	ذخيرة سامة 1	Ammo or Coating	1	تسمم الأهداف، ولكنقد تتطلب محاولات عدة.السعة: 12
158	ذخيرة سامة 2	Ammo or Coating	2	ذخيرة معززة تصيب بالسم.تتطلب بعض الأهداف محاولات عدة.السعة: 12
159	ذخيرة الشلل 1	Ammo or Coating	1	ذخيرة تسبب الشلل.تتطلب بعض الأهداف محاولات عدة.السعة: 12
160	ذخيرة الشلل 2	Ammo or Coating	2	ذخيرة معززة تسبب الشلل.تتطلب بعض الأهداف أكثر من طلقة.السعة: 8
161	ذخيرة النوم 1	Ammo or Coating	1	ذخيرة تسبب النوم.تتطلب بعض الأهداف محاولات عدة.السعة: 12
162	ذخيرة النوم 2	Ammo or Coating	2	ذخيرة معززة تسبب النوم.تتطلب بعض الأهداف محاولات عدة.السعة: 8
163	ذخيرة الإرهاق 1	Ammo or Coating	1	ذخيرة خاصة تستنزفقوة تحمل الوحوش.السعة: 12
164	ذخيرة الإرهاق 2	Ammo or Coating	2	ذخيرة محسّنة تستنزفقوة تحمل الوحوش.السعة: 8
165	ذخيرة الاسترداد 1	Ammo or Coating	1	ذخيرة تستعيد كمية صغيرة منالصحة لحليف ما عند التصادم.السعة: 12
166	ذخيرة الاسترداد 2	Ammo or Coating	2	ذخيرة تستعيد كمية متوسطة منالصحة لحليف ما عند التصادم.السعة: 12
167	ذخيرة التنين المجنح	Ammo or Coating	2	ذخيرة تكوّنت من خلال أعوام منالبحث في نيران التنين المجنح.السعة: 5
168	ذخيرة تقطيع	Ammo or Coating	1	ذخيرة تلقي بنصال حادةعند التصادم. بإمكانها قطع الذيول.السعة: 30
169	ذخيرة تهدئة	Ammo or Coating	2	ذخيرة بندقية القوس تُستخدم لأسرالوحوش الواقعين في فخاخ.السعة: 8
170	ذخيرة العفريت	Ammo or Coating	3	ذخيرة تملئ الهدفبكميات وحشية من القوة.السعة: 5
171	ذخيرة درع	Ammo or Coating	3	ذخيرة تجعل جلدالهدف صلبًا كالحجر.السعة: 5
172	(بلا)	Ammo or Coating	0	Unavailable
173	غطاء ذو مدى قريب	Ammo or Coating	3	سهام مصممة لإلحاق ضرر أكبربالأهداف القريبة، مقابل تقليلالمدى الأقصى.
174	قارورة فارغة	Item	0	قارورة فارغة قديمة وتقليدية.لا أكثر ولا أقل.
175	غطاء القوة	Ammo or Coating	1	غطاء سهم يزيدمن قوة هجوم السهام.السعة: 50
176	غطاء السم	Ammo or Coating	2	غطاء سهم يضيف تأثيراتالسم إلى السهام.السعة: 20
177	غطاء الشلل	Ammo or Coating	2	غطاء سهم يضيف تأثيراتالشلل إلى السهام.السعة: 20
178	غطاء النوم	Ammo or Coating	2	غطاء سهم يسبب النوم.السعة: 20
