Item ID	Item Name	Item Type	Rare	Item Desc
1919	جناح ممزق مقوى	Material	9	من مواد نارغاكوغا الغاضب النادرة جدًا.عنصر وُجد نتيجة للصراع الوحشيعلى السُلطة في الأراضي التوجيهية.
1920	طرف ذيل محترق	Material	9	من مواد غلافنيوس النادرة جدًا.تُحصّن طاقة الأراضي التوجيهيةالوحوش القاطنة هناك.
1921	طرف ذيل مقوى	Material	9	من مواد غلافنيوس الغاضب النادرة جدًا.عنصر وُجد نتيجة للصراع الوحشيعلى السُلطة في الأراضي التوجيهية.
1922	نصل ذيل مشحوذ	Material	9	من مواد غلافنيوس الحمضي النادرة جدًا.تُحصّن طاقة الأراضي التوجيهية الوحوشالقاطنة هناك.
1923	نصل ذيل مقوى	Material	9	من مواد غلافنيوس الحمضي الغاضب النادرةللغاية. عنصر وُجد نتيجة للصراع الوحشيعلى السُلطة في الأراضي التوجيهية.
1924	صدفة سمراء لامعة	Material	9	من مواد براكيديوس النادرة جدًا.تُحصّن طاقة الأراضي التوجيهيةالوحوش القاطنة هناك.
1925	صدفة سمراء مقواة	Material	9	من مواد براكيديوس الغاضب النادرة جدًا.عنصر وُجد نتيجة للصراع الوحشيعلى السُلطة في الأراضي التوجيهية.
1926	فك الرجل القوي	Material	9	من مواد تغريكس النادرة جدًا.تُحصّن طاقة الأراضي التوجيهيةالوحوش القاطنة هناك.
1927	فك مقوى	Material	9	من مواد تغريكس الغاضب النادرة جدًا.عنصر وُجد نتيجة للصراع الوحشيعلى السُلطة في الأراضي التوجيهية.
1928	فك مظلم مرتعش	Material	9	من مواد تغريكس غاشم النادرة جدًا.تُحصّن طاقة الأراضي التوجيهيةالوحوش القاطنة هناك.
1929	فك أسمر مقوى	Material	9	من مواد تغريكس غاشم الغاضب النادرةللغاية. عنصر وُجد نتيجة للصراع الوحشيعلى السُلطة في الأراضي التوجيهية.
1930	صاعق مشحون مميت	Material	9	من مواد زينغر النادرة جدًا.تُحصّن طاقة الأراضي التوجيهيةالوحوش القاطنة هناك.
1931	صاعق مقوى	Material	9	من مواد زينغر الغاضب النادرة جدًا.عنصر وُجد نتيجة للصراع الوحشيعلى السُلطة في الأراضي التوجيهية.
1932	قشرة قرمزية متفجرة	Material	10	من مواد بازيلغيس المتأجج النادرة جدًا.تُحصّن طاقة الأراضي التوجيهيةالوحوش القاطنة هناك.
1933	قشرة متفجرة مقواة	Material	10	من مواد بازيلغيس متأجج الغاضب النادرةللغاية. عنصر وُجد نتيجة للصراع الوحشيعلى السُلطة في الأراضي التوجيهية.
1934	جلد أسمر ملطخ بالدماء	Material	10	من مواد ديفيلجو الهمجي النادرة جدًا.تُحصّن طاقة الأراضي التوجيهيةالوحوش القاطنة هناك.
1935	جلد مُبقّع	Material	10	من مواد ديفيلجو الهمجي الغاضب النادرةللغاية. عنصر وُجد نتيجة للصراع الوحشيعلى السُلطة في الأراضي التوجيهية.
1936	قرن لازوردي مهيب	Material	10	من مواد كيرين النادرة جدًا.تُحصّن طاقة الأراضي التوجيهيةالوحوش القاطنة هناك.
1937	قرن لازوردي مقوى	Material	10	من مواد كيرين الغاضب النادرة جدًا.عنصر وُجد نتيجة للصراع الوحشيعلى السُلطة في الأراضي التوجيهية.
1938	عُرف ناريّ	Material	10	من مواد تيوسترا النادرة جدًا.تُحصّن طاقة الأراضي التوجيهيةالوحوش القاطنة هناك.
1939	عُرف قرمزي مقوى	Material	10	من مواد تيوسترا الغاضب النادرة جدًا.عنصر وُجد نتيجة للصراع الوحشيعلى السُلطة في الأراضي التوجيهية.
1940	جناح نداء رياح فولاذي	Material	10	من مواد كوشالا داورا النادرة جدًا.تُحصّن طاقة الأراضي التوجيهيةالوحوش القاطنة هناك.
1941	جناح فولاذي مقوى	Material	10	من مواد كوشالا داورا الغاضب النادرةللغاية. عنصر وُجد نتيجة للصراع الوحشيعلى السُلطة في الأراضي التوجيهية.
1942	عُرف لازوردي	Material	10	من مواد لوناسترا النادرة جدًا.تُحصّن طاقة الأراضي التوجيهيةالوحوش القاطنة هناك.
1943	عُرف لازوردي مقوى	Material	10	من مواد لوناسترا الغاضب النادرة جدًا.عنصر وُجد نتيجة للصراع الوحشيعلى السُلطة في الأراضي التوجيهية.
1944	قرن شفق تاجي	Material	10	من مواد فيلكانا النادرة جدًا.تُحصّن طاقة الأراضي التوجيهيةالوحوش القاطنة هناك.
1945	قرن تاجي مقوى	Material	10	من مواد فيلكانا الغاضب النادرة جدًا.عنصر وُجد نتيجة للصراع الوحشيعلى السُلطة في الأراضي التوجيهية.
1946	ناب الغسق	Material	10	من مواد فال هازاك الستار الأسود النادرةجدًا. تُحصّن طاقة الأراضي التوجيهيةالوحوش القاطنة هناك.
1947	ناب غسق مقوّى	Material	10	من مواد فال هازاك الستار الأسود الغاضبالنادرة. عنصر وُجد نتيجة للصراع الوحشيعلى السُلطة في الأراضي التوجيهية.
1948	جلد رقيق جذاب	Material	10	من مواد ناميال النادرة جدًا.تُحصّن طاقة الأراضي التوجيهيةالوحوش القاطنة هناك.
1949	جلد مُغشِي مقوّى	Material	10	من مواد ناميال الغاضب النادرة جدًا.عنصر وُجد نتيجة للصراع الوحشيعلى السُلطة في الأراضي التوجيهية.
1950	قرن عظيم منقرض	Material	10	من مواد نيرغي المخرّب النادرة جدًا.تُحصّن طاقة الأراضي التوجيهيةالوحوش القاطنة هناك.
1951	قرن ساحق مقوى	Material	10	من مواد نيرغي المخرّب الغاضب النادرةللغاية. عنصر وُجد نتيجة للصراع الوحشيعلى السُلطة في الأراضي التوجيهية.
1952	قشرة ضوء القمر	Material	10	من مواد راثيان ذهبية النادرة جدًا.تُحصّن طاقة الأراضي التوجيهيةالوحوش القاطنة هناك.
1953	قشرة ذهبية مقواة	Material	10	من مواد راثيان ذهبية الغاضبة النادرةللغاية. عنصر وُجد نتيجة للصراع الوحشيعلى السُلطة في الأراضي التوجيهية.
1954	قشرة حارقة	Material	10	من مواد راذالوس فضي النادرة جدًا.تُحصّن طاقة الأراضي التوجيهيةالوحوش القاطنة هناك.
1955	قشرة فضية مقواة	Material	10	من مواد راذالوس فضي الغاضب النادرةللغاية. عنصر وُجد نتيجة للصراع الوحشيعلى السُلطة في الأراضي التوجيهية.
1956	قبضة تنين دافقة	Material	10	من مواد زينغر جهنمي النادرة جدًا.تُحصّن طاقة الأراضي التوجيهيةالوحوش القاطنة هناك.
1957	قبضة تنين مقواة	Material	10	من مواد زينغر جهنمي الغاضب النادرةللغاية. عنصر وُجد نتيجة للصراع الوحشيعلى السُلطة في الأراضي التوجيهية.
1958	فراء لامع متعطش للدماء	Material	10	من مواد راجانغ النادرة جدًا.تُحصّن طاقة الأراضي التوجيهيةالوحوش القاطنة هناك.
1959	فراء لامع مقوٍ	Material	10	من مواد راجانغ الحانق النادرة جدًا.عنصر وُجد نتيجة للصراع الوحشيعلى السُلطة في الأراضي التوجيهية.
1960	Unavailable	Item	3	Unavailable
1961	Unavailable	Item	3	Unavailable
1962	Unavailable	Item	3	Unavailable
1963	Unavailable	Item	3	Unavailable
1964	منظار مميز	Item	0	التمكن من دقة تصويب أكثر بإضافةمنظار إلى بندقية القوس الثقيلة.
1965	بصمة أول بشري تنين سامية	Material	5	تذكرة ببصمة يد، استخدمها أوائلالبشر التنانين. يمكن استبدالهابعناصر مفيدة في بوتقة الدمج.
1966	تذكرة بخارية	Material	10	تذكرة يصدرها الرئيس التقني لمنيقدّمون يد العون للآلات البخارية.تُعرض على الحداد!
1967	فحم دراغونفاين عملاق	Material	6	فحم مميز يحتوي على طاقة الأرضداخله. كبير جدًا. إنه الوقود المثاليللمعيشة السهلة!
1968	حلية العنقاء 3	Jewel	10	إضافة تُحسن من مهارة الالتحام.
1969	حلية الحارس 2	Jewel	9	إضافة تُحسن من مهارة التصدي للهجمات.
1970	حلية التبريد 2	Jewel	8	إضافة تُحسن من مهارة تصدي الحرارة.
1971	حلية مقاومة النار+ 4	Jewel	8	إضافة تُحسن من مهارة مقاومة النار.
1972	حلية مقاومة الماء+ 4	Jewel	8	إضافة تُحسن من مهارة مقاومة الماء.
1973	حلية مقاومة الثلج+ 4	Jewel	8	إضافة تُحسن من مهارة مقاومة الثلج.
1974	حلية مقاومة الرعد+ 4	Jewel	8	إضافة تُحسن من مهارة مقاومة الرعد.
1975	حلية مقاومة التنين+ 4	Jewel	8	إضافة تُحسن من مهارة مقاومة التنين.
1976	حلية اللهيب+ 4	Jewel	10	إضافة تُحسن من مهارة هجوم النار.
1977	حلية التيار+ 4	Jewel	10	إضافة تُحسن من مهارة هجوم الماء.
1978	حلية الصقيع+ 4	Jewel	10	إضافة تُحسن من مهارة هجوم الثلج.
1979	حلية الصاعقة+ 4	Jewel	10	إضافة تُحسن من مهارة هجوم الرعد.
1980	حلية التنين+ 4	Jewel	10	إضافة تُحسن من مهارة هجوم التنين.
1981	حلية السم+ 4	Jewel	10	إضافة تُحسن من مهارة هجوم السم.
1982	حلية الشلل+ 4	Jewel	10	إضافة تُحسن من مهارة هجوم الشلل.
1983	حلية النوم+ 4	Jewel	10	إضافة تُحسن من مهارة هجوم النوم.
1984	حلية الانفجار+ 4	Jewel	10	إضافة تُحسن من مهارة هجوم الانفجار.
1985	حلية مقاومة النار الصلبة 4	Jewel	10	إضافة تُحسن من مهارة مقاومة النار.
1986	حلية مقاومة الماء الصلبة 4	Jewel	10	إضافة تُحسن من مهارة مقاومة الماء.
1987	حلية مقاومة الثلج الصلبة 4	Jewel	10	إضافة تُحسن من مهارة مقاومة الثلج.
1988	حلية مقاومة الرعد الصلبة 4	Jewel	10	إضافة تُحسن من مهارة مقاومة الرعد.
1989	حلية مقاومة التنين الصلبة 4	Jewel	10	إضافة تُحسن من مهارة مقاومة التنين.
1990	حلية الترياق+ 4	Jewel	8	إضافة تُحسن من مهارة مقاومة السم.
1991	حلية مضادة للشلل+ 4	Jewel	8	إضافة تُحسن من مهارة مقاومة الشلل.
1992	حلية الحيوية+ 4	Jewel	8	إضافة تُحسن من مهارة مقاومة النوم.
1993	حلية الثبات+ 4	Jewel	8	إضافة تُحسن من مهارة مقاومة الصعق.
1994	حلية مقاومة الانفجار+ 4	Jewel	8	إضافة تُحسن من مهارة مقاومة الانفجار.
1995	حلية التقطيب+ 4	Jewel	8	إضافة تُحسن من مهارة مقاومة النزيف.
1996	حلية القفل الدفاعي+ 4	Jewel	8	إضافة تُحسن من مهارة الجلد الحديدي.
1997	حلية الخانق+ 4	Jewel	8	إضافة تُحسن من مهارة مقاومة الروائح.
1998	حلية الشبع+ 4	Jewel	8	إضافة تُحسن من مهارة مقاومة الجوع.
1999	حلية التعافي+ 4	Jewel	8	إضافة تُحسن من مهارة سرعة التعافي.
2000	حلية طرف إصبع القدم+ 4	Jewel	8	إضافة تُحسن من مهارة التسلل.
2001	حلية المخيف+ 4	Jewel	8	إضافة تُحسن من مهارة المخيف.
2002	حلية السيد+ 4	Jewel	8	إضافة تُحسن من مهارة حشد الباليكو.
2003	حلية طرف إصبع القدم الصلبة 4	Jewel	8	إضافة تُحسن من مهارة التسلل.
2004	حلية المخيف الصلبة 4	Jewel	8	إضافة تُحسن من مهارة المخيف.
2005	حلية السيد الصلبة 4	Jewel	8	إضافة تُحسن من مهارة حشد الباليكو.
2006	حلية الضربة الحقيقية+ 4	Jewel	11	إضافة تُحسن من مهارة تعزيز الذخيرةالخاصة.
2007	حلية المدفعية الثقيلة+ 4	Jewel	8	إضافة تُحسن من مهارة المدفعيةالثقيلة.
2008	حلية علم النبات+ 4	Jewel	8	إضافة تُحسن من مهارة عالمة النبات.
2009	حلية الجيولوجيا+ 4	Jewel	8	إضافة تُحسن من مهارة الجيولوجي.
2010	حلية النجاة+ 4	Jewel	8	إضافة تُحسن من مهارة خبير النجاة.
2011	حلية سائر الوحل+ 4	Jewel	8	إضافة تُحسن من مهارة الحركةالمائية/القطبية.
2012	حلية العيّنة+ 4	Jewel	8	إضافة تُحسن من مهارة عالم الحشرات.
2013	حلية الجهور+ 4	Jewel	8	إضافة تُحسن من مهارة قرن الملحّن.
2014	حلية علم النبات الصلبة+ 4	Jewel	10	إضافة تُحسن من مهارة عالمة النبات.
2015	حلية الجيولوجيا الصلبة 4	Jewel	10	إضافة تُحسن من مهارة الجيولوجي.
2016	حلية النجاة الصلبة 4	Jewel	10	إضافة تُحسن من مهارة خبير النجاة.
2017	حلية العيّنة الصلبة 4	Jewel	10	إضافة تُحسن من مهارة عالم الحشرات.
2018	حلية الاستمرار+ 4	Jewel	8	إضافة تُحسن من مهارة تمديد العنصر.
2019	حلية الدفاع+ 4	Jewel	8	إضافة تُحسن من مهارة تعزيز الدفاع.
2020	حلية الاستمرار الصلبة 4	Jewel	10	إضافة تُحسن من مهارة تمديد العنصر.
2021	حلية الدفاع الصلبة 4	Jewel	9	إضافة تُحسن من مهارة تعزيز الدفاع.
2022	حلية المدفعية+ 4	Jewel	8	إضافة تُحسن من مهارة المدفعية.
2023	حلية سدادة الأذن+ 4	Jewel	11	إضافة تُحسن من مهارة سدادات الأذن.
2024	حلية مقاومة الرياح+ 4	Jewel	11	إضافة تُحسن من مهارة صد الرياح.
2025	حلية الهجوم+ 4	Jewel	11	إضافة تُحسن من مهارة تعزيز الهجوم.
2026	حلية الخبير+ 4	Jewel	11	إضافة تُحسن من مهارة عين الحسم.
2027	حلية الحرفية+ 4	Jewel	11	إضافة تُحسن من مهارة الحرفية.
2028	حلية الخنق+ 4	Jewel	10	إضافة تُحسن من مهارة القوة الكامنة.
2029	حلية المتحدي+ 4	Jewel	10	إضافة تُحسن من مهارة المشاغب.
2030	حلية الإمكانيات+ 4	Jewel	10	إضافة تُحسن من مهارة الأعمالالبطولية.
2031	حلية الصياح+ 4	Jewel	10	إضافة تُحسن من مهارة الاستياء.
2032	حلية بنية الجسم+ 4	Jewel	9	إضافة تُحسن من مهارة بنية الجسم.
2033	حلية التملص+ 4	Jewel	10	إضافة تُحسن من مهارة فترة التفادي.
2034	حلية الجدار الحديدي+ 4	Jewel	9	إضافة تُحسن من مهارة التصدي.
2035	حلية الصداقة+ 4	Jewel	9	إضافة تُحسن من مهارة المدى الكبير.
2036	حلية الاستنزاف/بنية الجسم 4	Jewel	9	إضافة تُحسن من مهارتي سرقة قوةالتحمل وبنية الجسم.
2037	حلية الجَلَد/بنية الجسم 4	Jewel	8	إضافة تُحسن من مهاراتي التحصّن وبنيةالجسم.
2038	حلية الكارثة/بنية الجسم 4	Jewel	8	إضافة تُحسن من مهاراتي الإعاشة وبنيةالجسم.
2039	حلية الجدار الحديدي/بنية الجسم 4	Jewel	9	إضافة تُحسن من مهاراتي التصدي وبنيةالجسم.
2040	حلية الصداقة/بنية الجسم 4	Jewel	9	إضافة تُحسن من مهاراتي المدى الكبيروبنية الجسم.
2041	حلية التخمة/بنية الجسم 4	Jewel	8	إضافة تُحسن من مهارتي الوجبةالمجانية وبنية الجسم.
2042	حلية قاذف الأحجار/بنية الجسم 4	Jewel	8	إضافة تُحسن من مهارتي سعة نبلةالمعصم وبنية الجسم.
2043	حلية المقاوِم/بنية الجسم 4	Jewel	9	إضافة تُحسن من مهاراتي مقاومة الوباءوبنية الجسم.
2044	حلية الطيران/بنية الجسم 4	Jewel	9	إضافة تُحسن من مهاراتي الهجماتالجوّية وبنية الجسم.
2045	حلية العدّاء/بنية الجسم 4	Jewel	9	إضافة تُحسن من مهارتي عدّاءالماراثون وبنية الجسم.
2046	حلية التجدد/بنية الجسم 4	Jewel	9	إضافة تُحسن من مهارتي اندفاع قوةالتحمل وبنية الجسم.
2047	حلية القفز/بنية الجسم 4	Jewel	9	إضافة تُحسن من مهارتي توسيع مدىالتفادي وبنية الجسم.
2048	حلية الغمد/بنية الجسم 4	Jewel	9	إضافة تُحسن من مهارتي الغمد السريعوبنية الجسم.
2049	حلية الشره/بنية الجسم 4	Jewel	9	إضافة تُحسن من مهارتي الأكل السريعوبنية الجسم.
2050	حلية الطاحونة/بنية الجسم 4	Jewel	9	إضافة تُحسن من مهارتي الشحذ السريعوبنية الجسم.
2051	حلية قاذف القنابل/بنية الجسم 4	Jewel	9	إضافة تُحسن من مهاراتي المدفعي وبنيةالجسم.
2052	حلية شكل الفطر/بنية الجسم 4	Jewel	9	إضافة تُحسن من مهاراتي آكل الفطروبنية الجسم.
2053	حلية المنزلق/بنية الجسم 4	Jewel	8	إضافة تُحسن من مهارتي انزلاق النسبةوبنية الجسم.
2054	حلية الحارس/بنية الجسم 4	Jewel	8	إضافة تُحسن من مهاراتي التصديللهجمات وبنية الجسم.
2055	حلية الاستنزاف/التملص 4	Jewel	9	إضافة تُحسن من مهارتي سرقة قوةالتحمل وفترة التفادي.
2056	حلية الجَلَد/التملص 4	Jewel	8	إضافة تُحسن من مهاراتي التحصّن وفترةالتفادي.
2057	حلية الكارثة/التملص 4	Jewel	8	إضافة تُحسن من مهاراتي الإعاشةوفترة التفادي.
2058	حلية الجدار الحديدي/التملص 4	Jewel	9	إضافة تُحسن من مهاراتي التصدي وفترةالتفادي.
2059	حلية الصداقة/التملص 4	Jewel	9	إضافة تُحسن من مهاراتي المدى الكبيروفترة التفادي.
2060	حلية التخمة/التملص 4	Jewel	8	إضافة تُحسن من مهاراتي الوجبةالمجانية وفترة التفادي.
2061	حلية قاذف الأحجار/التملص 4	Jewel	8	إضافة تُحسن من مهاراتي سعة نبلةالمعصم وفترة التفادي.
2062	حلية المقاوِم/التملص 4	Jewel	9	إضافة تُحسن من مهاراتي مقاومة الوباءوفترة التفادي.
2063	حلية الطيران/التملص 4	Jewel	9	إضافة تُحسن من مهاراتي الهجماتالجوية وفترة التفادي.
2064	حلية العدّاء/التملص 4	Jewel	9	إضافة تُحسن من مهاراتي عدّاءالماراثون وفترة التفادي.
2065	حلية التجدد/التملص 4	Jewel	9	إضافة تُحسن من مهارتي اندفاع قوةالتحمل وفترة التفادي.
2066	حلية القفز/التملص 4	Jewel	9	إضافة تُحسن من مهارتي توسيع مدىالتفادي وفترة التفادي.
2067	حلية الغمد/التملص 4	Jewel	9	إضافة تُحسن من مهاراتي الغمد السريعوفترة التفادي.
2068	حلية الشره/التملص 4	Jewel	9	إضافة تُحسن من مهاراتي الأكل السريعوفترة التفادي.
2069	حلية الطاحونة/التملص 4	Jewel	9	إضافة تُحسن من مهاراتي الشحذ السريعوفترة التفادي.
2070	حلية قاذف القنابل/التملص 4	Jewel	9	إضافة تُحسن من مهاراتي المدفعي وفترةالتفادي.
2071	حلية شكل الفطر/التملص 4	Jewel	9	إضافة تُحسن من مهاراتي آكل الفطروفترة التفادي.
2072	حلية المنزلق/التملص 4	Jewel	8	إضافة تُحسن من مهاراتي انزلاق النسبةوفترة التفادي.
2073	حلية الحارس/التملص 4	Jewel	8	إضافة تُحسن من مهاراتي التصديللهجمات وفترة التفادي.
2074	حلية الاستنزاف/الهجوم 4	Jewel	9	إضافة تُحسن من مهارتي سرقة قوةالتحمل وتعزيز الهجوم.
2075	حلية الجَلَد/الهجوم 4	Jewel	8	إضافة تُحسن من مهارتي التحصّن وتعزيزالهجوم.
2076	حلية الكارثة/الهجوم 4	Jewel	8	إضافة تُحسن من مهارتي الإعاشة وتعزيزالهجوم.
2077	حلية الجدار الحديدي/الهجوم 4	Jewel	9	إضافة تُحسن من مهارتي التصدي وتعزيزالهجوم.
2078	حلية الصداقة/الهجوم 4	Jewel	9	إضافة تُحسن من مهارتي المدى الكبيروتعزيز الهجوم.
2079	حلية التخمة/الهجوم 4	Jewel	8	إضافة تُحسن من مهارتي الوجبةالمجانية وتعزيز الهجوم.
2080	حلية قاذف الأحجار/الهجوم 4	Jewel	8	إضافة تُحسن من مهارتي سعة نبلةالمعصم وتعزيز الهجوم.
2081	حلية المقاوِم/الهجوم 4	Jewel	9	إضافة تُحسن من مهارتي مقاومة الوباءوتعزيز الهجوم.
2082	حلية الطيران/الهجوم 4	Jewel	9	إضافة تُحسن من مهارتي الهجماتالجوّية وتعزيز الهجوم.
2083	حلية العدّاء/الهجوم 4	Jewel	9	إضافة تُحسن من مهارتي عدّاءالماراثون وتعزيز الهجوم.
2084	حلية التجدد/الهجوم 4	Jewel	9	إضافة تُحسن من مهارتي اندفاع قوةالتحمل وتعزيز الهجوم.
2085	حلية القفز/الهجوم 4	Jewel	9	إضافة تُحسن من مهارتي توسيع مدىالتفادي وتعزيز الهجوم.
2086	حلية الغمد/الهجوم 4	Jewel	9	إضافة تُحسن من مهارتي الغمد السريعوتعزيز الهجوم.
2087	حلية الشره/الهجوم 4	Jewel	9	إضافة تُحسن من مهارتي الأكل السريعوتعزيز الهجوم.
2088	حلية الطاحونة/الهجوم 4	Jewel	9	إضافة تُحسن من مهارتي الشحذ السريعوتعزيز الهجوم.
2089	حلية قاذف القنابل/الهجوم 4	Jewel	9	إضافة تُحسن من مهارتي المدفعي وتعزيزالهجوم.
2090	حلية شكل الفطر/الهجوم 4	Jewel	9	إضافة تُحسن من مهارتي آكل الفطروتعزيز الهجوم.
2091	حلية المنزلق/الهجوم 4	Jewel	8	إضافة تُحسن من مهارتي انزلاق النسبةوتعزيز الهجوم.
2092	حلية الحارس/الهجوم 4	Jewel	8	إضافة تُحسن من مهارتي التصديللهجمات وتعزيز الهجوم.
2093	حلية الاستنزاف/الخبير 4	Jewel	9	إضافة تُحسن من مهارتي سرقة قوةالتحمل وعين الحسم.
2094	حلية الجَلَد/الخبير 4	Jewel	8	إضافة تُحسن من مهارتي التحصّن وعينالحسم.
2095	حلية الكارثة/الخبير 4	Jewel	8	إضافة تُحسن من مهارتي الإعاشة وعينالحسم.
2096	حلية الجدار الحديدي/الخبير 4	Jewel	9	إضافة تُحسن من مهارتي التصدي وعينالحسم.
