物品ID	物品名称	物品类型	稀有度	物品介绍
1350	冰呪龍的冠角	素材	10	冰呪龍的Master級素材。容易經由破壞頭部部位獲得。材質堅固，常用於武器上。
1351	冰呪龍的韌尾	素材	10	冰呪龍的Master級素材。容易經由切斷的尾巴獲得。材質強韌，常用於防具上。
1352	冰呪龍的剛爪	素材	10	冰呪龍的Master級素材。容易經由掉落物獲得。材質尖銳，常用於武器上。
1353	冰呪龍的零玉	素材	11	冰呪龍的Master級素材。用在武具上的話，據說會是能掌握天地的夢幻稀有品。
1354	炎王龍的重殼	素材	10	炎王龍的Master級素材。主要經由報酬獲得。材質堅硬，常用於防具上。
1355	炎王龍的大鬃毛	素材	10	炎王龍的Master級素材。容易經由破壞頭部部位獲得。火耐性佳。
1356	炎王龍的韌尾	素材	10	炎王龍的Master級素材。容易經由切斷的尾巴獲得。常用於防具上。
1357	炎王龍的剛角	素材	10	炎王龍的Master級素材。容易經由破壞頭部部位獲得。常用於武器上。
1358	獄炎的厚龍鱗	素材	10	炎王龍的Master級素材。主要經由剝取獲得。用途廣泛。
1359	炎龍的剛爪	素材	10	炎王龍的Master級素材。主要經由剝取獲得。材質尖銳，常用於武器上。
1360	炎龍的剛翼	素材	10	炎王龍的Master級素材。容易經由破壞兩翼部位獲得。常用於防具上。
1361	炎妃龍的重殼	素材	10	炎妃龍的Master級素材。主要經由報酬獲得。材質堅硬，常用於防具上。
1362	炎妃龍的大鬃毛	素材	10	炎妃龍的Master級素材。容易經由掉落物獲得。火耐性高，是貴重的素材。
1363	炎妃龍的韌尾	素材	10	炎妃龍的Master級素材。容易經由切斷的尾巴獲得。常用於防具上。
1364	炎妃龍的剛角	素材	10	炎妃龍的Master級素材。容易經由破壞頭部部位獲得。常用於武器上。
1365	炎妃龍的厚鱗	素材	10	炎妃龍的Master級素材。主要經由剝取獲得。用途廣泛。
1366	炎妃龍的剛翼	素材	10	炎妃龍的Master級素材。容易經由破壞翅膀部位獲得。常用於防具上。
1367	鋼龍的重殼	素材	10	鋼龍的Master級素材。主要經由報酬獲得。材質堅硬，常用於防具上。
1368	鋼的厚龍鱗	素材	10	鋼龍的Master級素材。主要經由剝取獲得。泛用性高，用途廣泛。
1369	鋼龍的剛翼	素材	10	鋼龍的Master級素材。容易經由破壞兩翼部位獲得。材質輕巧，常用於防具上。
1370	鋼龍的剛角	素材	10	鋼龍的Master級素材。容易經由破壞頭部部位獲得。材質堅固，常用於武器上。
1371	鋼龍的韌尾	素材	10	鋼龍的Master級素材。容易經由切斷的尾巴獲得。材質強韌，常用於防具上。
1372	鋼龍的剛爪	素材	10	鋼龍的Master級素材。主要經由剝取獲得。武具中秘藏著強大的冰屬性。
1373	死屍的厚龍鱗	素材	10	霧瘴屍套龍的Master級素材。主要經由剝取獲得。用途廣泛。
1374	屍套龍的重殼	素材	10	霧瘴屍套龍的Master級素材。主要經由報酬獲得。材質堅硬，常用於防具上。
1375	死屍交織的被膜	素材	10	霧瘴屍套龍的Master級素材。容易經由掉落物獲得。擁有賦予龍屬性的性質。
1376	屍套龍的重尾	素材	10	霧瘴屍套龍的Master級素材。容易經由切斷的尾巴獲得。常用於防具上。
1377	食闇之牙	素材	10	霧瘴屍套龍的Master級素材。容易經由破壞頭部部位獲得。常用於武器上。
1378	屍套龍的剛爪	素材	10	霧瘴屍套龍的Master級素材。容易經由破壞兩隻前腳部位獲得。常用於武器上。
1379	屍套龍的剛翼	素材	10	霧瘴屍套龍的Master級素材。容易經由破壞身體部位獲得。常用於防具上。
1380	溟波龍的特上皮	素材	10	溟波龍的Master級素材。主要經由剝取獲得。泛用性高，用途廣泛。
1381	Unavailable	物品	3	Unavailable
1382	溟波龍的剛翼	素材	10	溟波龍的Master級素材。容易經由破壞翅膀部位獲得。材質柔軟，常用於防具上。
1383	溟波龍的幻曜鬚	素材	10	溟波龍的Master級素材。容易經由破壞頭部部位獲得。擁有賦予雷屬性的性質。
1384	溟波龍的韌尾	素材	10	溟波龍的Master級素材。容易經由切斷的尾巴獲得。材質強韌，常用於防具上。
1385	溟波龍的剛爪	素材	10	溟波龍的Master級素材。容易經由破壞兩邊前腳獲得。材質尖銳，常用於武器上。
1386	Unavailable	物品	3	Unavailable
1387	冥赤龍的厚鱗	素材	10	冥赤龍的Master級素材。主要經由剝取獲得。成長的過程中會浮現出紋樣。
1388	冥赤龍的重殼	素材	10	冥赤龍的Master級素材。主要經由報酬獲得。隨著成長會形成複雜的紋路。
1389	裂光的龍脈殼	素材	10	冥赤龍的Master級素材。隨著悠久時光蓄積的力量奔瀉而出，光芒閃耀奪目。
1390	冥赤龍的重尾	素材	10	冥赤龍的Master級素材。經由切斷的尾巴獲得。一甩就能引起驚人的暴風雨。
1391	冥赤龍的剛角	素材	10	冥赤龍的Master級素材。經由破壞角部位獲得。因為成長的力量太大，導致彎曲變形。
1392	冥赤龍的剛爪	素材	10	冥赤龍的Master級素材。經由破壞腳部位獲得。光是觸摸就能感受到地脈的奔流。
1393	冥赤龍的剛翼	素材	10	冥赤龍的Master級素材。經由破壞翅膀部位獲得。讓人感覺到屬於支配者的威壓。
1394	地脈源結晶體	素材	11	冥赤龍的Master級素材。藏有龐大地脈能量的力量核心，其潛藏的力量足以撼動天地。
1395	天地煌啼龍的慈鱗	素材	10	天地煌啼龍的Master級素材。主要經由剝取獲得。泛用性高，用途廣泛。
1396	天地煌啼龍的嚴岩殼	素材	10	天地煌啼龍的Master級素材。主要經由報酬獲得。材質堅硬，常用於防具上。
1397	Unavailable	物品	3	Unavailable
1398	天地煌啼龍的慈眼殼	素材	10	天地煌啼龍的Master級素材。容易經由破壞頭部部位獲得。常用於武器上。
1399	天地煌啼龍的散華石	素材	10	天地煌啼龍的Master級素材。容易經由掉落物獲得。常用於防具上。
1400	天地煌啼龍的慈爪	素材	10	天地煌啼龍的Master級素材。容易經由破壞翼腕部位獲得。常用於武器上。
1401	天地煌啼龍的顯玉	素材	11	天地煌啼龍的Master級素材。用在武具上的話，據說會是能掌握天地的夢幻稀有品。
1402	煌黑龍的天殼	素材	10	煌黑龍的Master級素材。主要經由報酬獲得。據說得到它的人會受到上天眷顧。
1403	煌黑龍的天鱗	素材	10	煌黑龍的Master級素材。主要經由剝取獲得。似乎含有全屬性的元素。
1404	煌黑龍的凶爪	素材	10	煌黑龍的Master級素材。散發著陰暗詭魅的氛圍，恐怕只能用窮凶惡極來形容。
1405	煌黑龍的邪翼	素材	10	煌黑龍的Master級素材。據說其具有撕裂時空、毀天滅地的威能。
1406	煌黑龍的妖尾	素材	10	煌黑龍的Master級素材。容易經由切斷的尾巴獲得。 得到的人都會懷疑自己是否身在夢中。
1407	統天角	素材	10	煌黑龍的Master級素材。頭部的角層疊生長所形成的最優質角素材。
1408	琉璃色的龍神玉	素材	11	煌黑龍的Master級素材。傳說一旦有人得到它，就會帶來世界末日。
1409	太古的寶珠	素材	8	秘藏著太古力量的寶珠。<STYL MOJI_YELLOW_DEFAULT>（鑑定道具）</STYL>
1410	刻印的寶珠	素材	9	秘藏著強大力量的寶珠。<STYL MOJI_YELLOW_DEFAULT>（鑑定道具）</STYL>
1411	封印的寶珠	素材	10	秘藏著壓倒性力量的寶珠。<STYL MOJI_YELLOW_DEFAULT>（鑑定道具）</STYL>
1412	凋零的龍鱗	换算道具	3	歲月摧殘下凋零殆盡的龍鱗。<STYL MOJI_YELLOW_DEFAULT>（結算道具）</STYL>
1413	閃爍的龍鱗	换算道具	3	經年累月下仍舊不失光輝的龍鱗。<STYL MOJI_YELLOW_DEFAULT>（結算道具）</STYL>
1414	古老龍秘寶	换算道具	8	古龍種喜好收集的寶石。越是陳舊越顯光輝。<STYL MOJI_YELLOW_DEFAULT>（結算道具）</STYL>
1415	不壞的黑曜甲	素材	10	猛爆碎龍的Master級素材。連超越極限的爆炸也能抵擋，是最安全的素材。
1416	Unavailable	物品	3	Unavailable
1417	？？？的厚鱗	素材	10	未知魔物的素材。可感受到強大的力量。
1418	？？？的岩殼	素材	10	未知魔物的素材。可感受到強大的力量。
1419	？？？的重殼	素材	10	未知魔物的素材。可感受到強大的力量。
1420	？？？的岩石	素材	10	未知魔物的素材。可感受到強大的力量。
1421	？？？的剛爪	素材	10	未知魔物的素材。可感受到強大的力量。
1422	？？？的大寶玉	素材	11	未知魔物的素材。可感受到強大的力量。
1423	絢輝龍的重金鱗	素材	10	絢輝龍的Master級素材。主要經由報酬獲得。有不少人為了能獲得一枚而豁出性命。
1424	絢輝龍的重金殼	素材	10	絢輝龍的Master級素材。主要經由報酬獲得。據說和黃金具有同等價值。
1425	絢輝龍的重金塊	素材	10	絢輝龍的Master級素材。容易經由掉落物獲得。綻放妖豔光芒，迷惑他人的黃金塊。
1426	絢輝龍的重金卷角	素材	10	絢輝龍的Master級素材。容易經由破壞頭部部位獲得。層層堆疊的金子散發出厚重的光輝。
1427	絢輝龍的重金尾殼	素材	10	絢輝龍的Master級素材。容易經由破壞尾巴部位獲得。融解的黃金發出豔麗的光彩。
1428	金色的龍神玉	素材	11	絢輝龍的Master級素材。傳說入手時，整個世界都會染成金色的玉石。
1429	Unavailable	物品	3	Unavailable
1430	Unavailable	物品	3	Unavailable
1431	天之龍人票據	素材	8	新大陸的古代龍人所使用的票據。可在神秘鍊金的設施中交換Master等級的素材。
1432	霸王之證	素材	8	只有越過重重苦難者才能獲得之證明。擁有此證者將被授予真正的名譽。
1433	調查團票Ｇ	素材	10	總司令給予在調查團作出傑出成果者的票券。交給加工屋就會…？
1434	猛牛龍硬幣	素材	8	贈與在Master Rank鬥技大會中征服了猛牛龍之人的硬幣。
1435	浮空龍硬幣	素材	8	贈與在Master Rank鬥技大會中征服了浮空龍之人的硬幣。
1436	迅龍硬幣	素材	8	贈與在Master Rank鬥技大會中征服了迅龍之人的硬幣。
1437	斬龍硬幣	素材	8	贈與在Master Rank鬥技大會中征服了斬龍之人的硬幣。
1438	慘爪龍硬幣	素材	8	贈與在Master Rank鬥技大會中征服了慘爪龍之人的硬幣。
1439	雷狼龍硬幣	素材	8	贈與在Master Rank鬥技大會中征服了雷狼龍之人的硬幣。
1440	黑帶硬幣	素材	8	散發虛無冷光的黑色硬幣。贈送給達成Master Rank的鬥技大會任務者。
1441	英雄王硬幣	素材	9	閃閃發亮的黃色硬幣。贈送給達成難易度較高的Master Rank鬥技大會任務者。
1442	轟龍硬幣	素材	10	贈與在Master Rank鬥技大會中征服了轟龍之人的硬幣。
1443	巨大的鱗片	素材	8	是利用盜掠衣裝獲得的素材。其巨大讓收藏家也難掩驚訝。<STYL MOJI_YELLOW_DEFAULT>（換金道具）</STYL>
1444	美好的鱗片	素材	9	是利用盜掠衣裝獲得的素材。收藏家垂涎欲滴的頂級品。<STYL MOJI_YELLOW_DEFAULT>（換金道具）</STYL>
1445	獸纏族票	素材	8	與在永霜凍土相遇的獸人種交流的象徵。交給加工屋後，會…？
1446	特產款冬花芽	换算道具	1	永霜凍土的特產品。是棲息於極寒之地的動物們寶貴的營養來源。<STYL MOJI_YELLOW_DEFAULT>（結算道具）</STYL>
1447	嚴選款冬花芽	换算道具	2	永霜凍土的稀有特產品。獲得的滋養足以溫暖身體深處。<STYL MOJI_YELLOW_DEFAULT>（結算道具）</STYL>
1448	萬年款冬花芽	换算道具	3	永霜凍土的貴重特產品。經過一番苦熬，終於發芽的一株奇蹟。<STYL MOJI_YELLOW_DEFAULT>（結算道具）</STYL>
1449	冰瑞花	换算道具	1	永霜凍土的特產品。透澈如冰的花朵。<STYL MOJI_YELLOW_DEFAULT>（結算道具）</STYL>
1450	雪月冰瑞花	换算道具	2	永霜凍土的稀有特產品。連月光也能穿透，閃耀於雪原中的花朵。<STYL MOJI_YELLOW_DEFAULT>（結算道具）</STYL>
1451	銀嶺冰瑞花	换算道具	3	永霜凍土的貴重特產品。據說在暴風雪過境後會綻放，閃耀著銀白色光芒的花朵。<STYL MOJI_YELLOW_DEFAULT>（結算道具）</STYL>
1452	白雪	换算道具	3	永霜凍土的特別特產品。於純白之雪守護中現身，惹人憐愛的款冬。<STYL MOJI_YELLOW_DEFAULT>（結算道具）</STYL>
1453	水晶花	换算道具	3	永霜凍土的特別特產品。比寶石還要美麗，比淡雪還要虛幻的夢幻之花。<STYL MOJI_YELLOW_DEFAULT>（結算道具）</STYL>
1454	補給專用生命大粉塵	物品	1	將可大幅回復體力的粉塵撒向四周。<STYL MOJI_YELLOW_DEFAULT>（補給品專用）</STYL>
1455	溫泉銀猴	换算道具	2	永霜凍土中常見的猿猴。為了禦寒而習得泡溫泉溫暖身體的方法。
1456	溫泉金猴	换算道具	3	永霜凍土中稀有的猿猴。雖被當作溫泉銀猴的一種，但體色變異的原因還在調查中。
1457	Unavailable	换算道具	3	Unavailable
1458	異形甲蟲	换算道具	2	在黑暗洞窟中發著微光的蟲子。喜歡吃冰柱水滴中的原蟲與藻類。
1459	望月水母	换算道具	2	白天在洞窟中飄盪，夜晚時為了尋求食物離開洞窟，因此獲此命名。
1460	胖衣企鵝	换算道具	2	外觀像是穿太多衣服而得名。個體為了避免被捕食，而採取群聚生活。
1461	道標壁虎	换算道具	3	會捕食聚集在高營養價值樹果的蟲子，朝三角型頭部所指示方向前進的話……
1462	小藍歌	换算道具	3	歌聲十分美麗的鳥類。令人聞之忘我，但此歌聲似乎是向雄性求愛的行為。
1463	神帶魚	换算道具	3	夜晚時為了進食而現身於水面，除此之外都會一直待在水底。讓魚鰭發光藉以捕食小蟲。
1464	玻璃異形魚	换算道具	2	棲息在永霜凍土，身體透明的魚類。據說透明的身體是為了避免被捕食。
1465	月羽天母	换算道具	3	目擊案例非常稀少的生物。似乎只有望月水母大量出現的夜晚裡，才能見到牠的身影。
1466	毛吉	换算道具	3	雖然臉看起來很睏又遲鈍的樣子，挖洞的能力卻非常高。
1467	青苔毛吉	换算道具	3	全身被綠色包覆的毛吉同類。身上披覆的是水球苔的一種。
1468	掘土毛吉	换算道具	3	一種被盔甲般的甲殼所保護的毛吉。是已確認的同類中，挖洞最厲害的毛吉。
1469	茸茸毛吉	换算道具	3	毛茸茸的體毛最具特色。前腳爪較為圓潤這點，也是其他種類所沒有的特徵。
1470	刺針毛吉	换算道具	3	具有適應在瘴氣中生活的眼睛。相較於其他同類，特徵是有著更為銳利的爪子。
1471	火爆毛吉	换算道具	3	特徵是讓人聯想到炙熱火焰的赤紅毛皮。為了挖掘堅硬岩石，爪子相較其他同類更為強力。
1472	白絲毛吉	换算道具	3	冰雪般的白色體毛，觸感有如絲綢。加上為了防寒而累積的脂肪，抱起來的感覺絕佳。
1473	上等玻璃異形魚	换算道具	3	特大尺寸的玻璃異形魚。因為透明的身體而沒察覺，居然如此巨大……
1474	Unavailable	物品	3	Unavailable
1475	Unavailable	物品	3	Unavailable
1476	Unavailable	物品	3	Unavailable
1477	Unavailable	物品	3	Unavailable
1478	龍脈炭碎片	素材	3	蓄積著地脈能量的特別石炭。即使只是一個碎片，也能成為相當足夠的燃料。
1479	龍脈炭	素材	4	蓄積著地脈能量的特別石炭。作為新據點的燃料而受到重視。
1480	大龍脈炭	素材	5	蓄積著地脈能量的特別石炭。可取得暫時讓生活無虞的能量。
1481	布製的窗簾【小】	房间装饰	3	雅緻的布製窗簾。
1482	毛皮的窗簾【小】	房间装饰	3	充滿野性的毛皮窗簾。
1483	典雅的窗簾【小】	房间装饰	3	精緻典雅的窗簾。
1484	可愛的窗簾【小】	房间装饰	3	明亮可愛的窗簾。
1485	布製的窗簾【大】	房间装饰	3	雅緻的布製窗簾。
1486	毛皮的窗簾【大】	房间装饰	3	充滿野性的毛皮窗簾。
1487	典雅的窗簾【大】	房间装饰	3	精緻典雅的窗簾。
1488	可愛的窗簾【大】	房间装饰	3	明亮可愛的窗簾。
1489	懷舊的沙發	房间装饰	3	懷舊的一般沙發。
1490	Unavailable	物品	3	Unavailable
1491	高級沙發	房间装饰	3	亮皮高級沙發。
1492	典雅的沙發	房间装饰	3	手感舒適的典雅沙發。
1493	可愛的沙發	房间装饰	3	可愛蓬厚的沙發。
1494	鄉村風格的床鋪	房间装饰	3	充滿鄉村風格的穩固床鋪。
1495	懷舊的床鋪	房间装饰	3	懷舊的一般床鋪。
1496	高級床鋪	房间装饰	3	極盡奢華的高級床鋪。
1497	可愛的床鋪	房间装饰	3	可愛舒適的床鋪。
1498	懷舊的桌子	房间装饰	3	懷舊的一般桌子。
1499	高級桌子	房间装饰	3	厚重的高級桌子。
1500	典雅的桌子	房间装饰	3	洗鍊典雅的桌子。
1501	可愛的桌子	房间装饰	3	清純可愛的桌子。
1502	野生風格的椅子	房间装饰	3	充滿野生風格的粗俗椅子。
1503	懷舊的椅子	房间装饰	3	懷舊簡樸的椅子。
1504	高級椅子	房间装饰	3	年代久遠的高級椅子。
1505	典雅的椅子	房间装饰	3	低調典雅的椅子。
1506	可愛的椅子	房间装饰	3	魅力四射的可愛椅子。
1507	肉多多料理	房间装饰	3	需要力量時攝取的餐點。
1508	派對組合餐	房间装饰	3	大家一起同樂享用的餐點。
1509	熱帶午餐	房间装饰	3	可以享受南國風情的餐點。
1510	豐盛的燉菜料理	房间装饰	3	適合冷天吃的料理。
1511	獵人早午餐	房间装饰	3	適合晚起時吃的料理。
1512	懷舊的矮櫃	房间装饰	3	懷舊質樸的矮櫃。
1513	高級矮櫃	房间装饰	3	令人安心的高級矮櫃。
1514	可愛的矮櫃	房间装饰	3	甜美可愛的矮櫃。
1515	永霜凍土的植物１	房间装饰	3	生長在永霜凍土的植物。
1516	永霜凍土的植物２	房间装饰	3	生長在永霜凍土的植物。
1517	永霜凍土的植物４	房间装饰	3	生長在永霜凍土的植物。
1518	永霜凍土的植物３	房间装饰	3	生長在永霜凍土的植物。
1519	古代樹森林的植物１	房间装饰	3	生長在古代樹森林的植物。
1520	大蟻塚荒地的植物３	房间装饰	3	生長在大蟻塚荒地的植物。
1521	古代樹森林的植物４	房间装饰	3	生長在古代樹森林的植物。
1522	古代樹森林的植物５	房间装饰	3	生長在古代樹森林的植物。
1523	古代樹森林的植物３	房间装饰	3	生長在古代樹森林的植物。
1524	大蟻塚荒地的植物２	房间装饰	3	生長在大蟻塚荒地的植物。
1525	大蟻塚荒地的植物４	房间装饰	3	生長在大蟻塚荒地的植物。
1526	大蟻塚荒地的植物１	房间装饰	3	生長在大蟻塚荒地的植物。
1527	古代樹森林的植物２	房间装饰	3	生長在古代樹森林與大蟻塚荒地的植物。
1528	瘴氣之谷的植物１	房间装饰	3	生長在瘴氣之谷的植物。
1529	瘴氣之谷的植物２	房间装饰	3	生長在瘴氣之谷的植物。
1530	質樸的壺子	房间装饰	3	無多餘裝飾的質樸壺子。
1531	德特爾玩偶	房间装饰	3	尖耳朵的德特爾玩偶。
1532	奇面族玩偶	房间装饰	3	臉部赤紅的奇面族玩偶。
1533	獸纏族玩偶	房间装饰	3	有大型犄角的獸纏族玩偶。
1534	艾路玩偶	房间装饰	3	質樸可愛的隨從艾路玩偶。
1535	德特爾玩偶【黑】	房间装饰	3	尖耳朵的德特爾玩偶。
1536	德特爾玩偶【紺】	房间装饰	3	尖耳朵的德特爾玩偶。
1537	德特爾玩偶【藍】	房间装饰	3	尖耳朵的德特爾玩偶。
1538	噗吱豬玩偶【條紋】	房间装饰	3	有條紋圖案的噗吱豬玩偶。
1539	噗吱豬玩偶【國王】	房间装饰	3	國王造型的噗吱豬玩偶。
1540	Unavailable	物品	3	Unavailable
1541	Unavailable	物品	3	Unavailable
1542	Unavailable	物品	3	Unavailable
1543	高級澆水器	房间装饰	3	金屬製的高級澆水器。
1544	高級壺子	房间装饰	3	價值昂貴的高級壺子。
1545	質樸壺具組	房间装饰	3	內含各種質樸的壺子。
1546	麻袋	房间装饰	3	好用的麻質袋子。
1547	酒瓶	房间装饰	3	內已裝酒可隨意飲用的瓶子。
1548	大小酒瓶組	房间装饰	3	內已裝酒的瓶子組合
1549	調合器具	房间装饰	3	調合時不可或缺的器具組。
1550	和服布料	房间装饰	3	染製的美麗和服布料。
1551	角的擺飾	房间装饰	3	某種角的裝飾品。
1552	化石擺飾	房间装饰	3	某種化石的裝飾品。
1553	質樸的土鍋	房间装饰	3	印有艾路圖案的質樸土鍋。
1554	鍋具組	房间装饰	3	各種鍋具的組合。
1555	盤繪組【小】	房间装饰	3	圖案豔麗的盤繪組。
1556	盤繪組【大】	房间装饰	3	圖案豔麗的盤繪組。
1557	裝有礦石的籃子	房间装饰	3	裝滿大量礦石的籃子。
1558	酒樽	房间装饰	3	存放著可供盡情飲用的酒。
1559	急救箱	房间装饰	3	備妥較安心的急救箱。
1560	簡約的花瓶【小】	房间装饰	3	高品質的簡約風花瓶。
1561	盆栽	房间装饰	3	低調的花卉盆栽。
1562	探究的書籍	房间装饰	3	經過妥善整理的書籍。
1563	賢明的書籍	房间装饰	3	慢慢堆積存放的書籍。
1564	簡約的花瓶【大】	房间装饰	3	高品質的簡約風花瓶。
1565	仙人掌盆栽	房间装饰	3	耐旱的仙人掌盆栽。
1566	繽紛的盆栽	房间装饰	3	色彩繽紛的花卉盆栽。
1567	裝滿菇類的籃子	房间装饰	3	裝有各種菇類的籃子。
1568	水果拚盤	房间装饰	3	各式水果的綜合拚盤。
1569	蔬菜拼盤	房间装饰	3	新鮮蔬菜的總匯拼盤
1570	奇面族的面具【威】	房间装饰	3	仿造奇面族所使用之面具製成的產品。
1571	奇面族的面具【嘆】	房间装饰	3	仿造奇面族所使用之面具製成的產品。
1572	奇面族的面具【驚】	房间装饰	3	仿造奇面族所使用之面具製成的產品。
1573	琥珀	房间装饰	3	呈現夕陽顏色的琥珀。
1574	藍色的曠石	房间装饰	3	呈現海水顏色的礦石。
1575	赤色的礦石	房间装饰	3	呈現烈焰顏色的礦石。
1576	貝殼	房间装饰	3	令人聯想到沙灘的多彩貝殼。
1577	狩獵貢獻之證【幫手】	房间装饰	3	獻給在任務中具有高貢獻度之獵人的家具。
1578	狩獵貢獻之證【盡力】	房间装饰	3	獻給在任務中具有極高貢獻度之獵人的家具。
1579	狩獵貢獻之證【獻身】	房间装饰	3	獻給在任務中具有廣大貢獻度之獵人的家具。
1580	狩獵貢獻之證【武勳】	房间装饰	3	獻給在任務中具有極廣大貢獻度之獵人的家具。
1581	小金魚平衡吊飾	房间装饰	3	宛如小金魚正在悠游的吊飾。
1582	竹筴魚吊飾	房间装饰	3	宛如竹筴魚正在悠游的吊飾。
1583	旗魚平衡吊飾	房间装饰	3	宛如旗魚正在悠游的吊飾。
1584	回憶吊飾	房间装饰	3	有可愛玩偶垂墜的吊飾。
1585	國王吊飾	房间装饰	3	有可愛玩偶垂墜的吊飾。
1586	圓點吊飾	房间装饰	3	有可愛圓球串連的吊飾。
1587	木桶吊飾	房间装饰	3	質樸的木桶吊飾。
1588	魚吊飾套組	房间装饰	3	各種魚類吊飾的組合。
1589	魚吊飾【赤】	房间装饰	3	看似很美味的紅色魚吊飾。
1590	旗魚吊飾	房间装饰	3	外觀生動的旗魚吊飾。
1591	典雅的旗幟吊飾	房间装饰	3	點綴典雅裝飾的旗幟吊飾。
1592	畫作【迅龍】	房间装饰	3	描繪迅龍的大型圖畫作品。
1593	畫作【研究基地】	房间装饰	3	描繪研究基地的小型圖畫作品。
1594	畫作【接待員】	房间装饰	3	描繪接待員的小型圖畫作品。
1595	典雅的彩繪盤子	房间装饰	3	美麗典雅的彩繪盤子。
1596	畫作【奇面族①】	房间装饰	3	獸人族所描繪的圖畫作品。製作人不明。
1597	畫作【獸纏族①】	房间装饰	3	描繪獸人族的圖畫作品。製作人不明。
1598	畫作【山貓族①】	房间装饰	3	描繪獸人族的圖畫作品。製作人不明。
1599	畫作【噗吱豬】	房间装饰	3	描繪噗吱豬乖乖坐著的可愛圖畫作品。
1600	畫作【艾路】	房间装饰	3	描繪隨從艾路的圖畫作品。散發獨特的氛圍。
1601	Unavailable	物品	3	Unavailable
1602	Unavailable	物品	3	Unavailable
1603	Unavailable	物品	3	Unavailable
1604	Unavailable	物品	3	Unavailable
1605	懷舊的長桌	房间装饰	3	懷舊的簡樸長桌。
1606	高級長桌	房间装饰	3	線條優美的高級長桌。
1607	可愛的長桌	房间装饰	3	優雅可愛的長桌。
1608	懷舊的櫃架	房间装饰	3	懷舊簡樸的櫃架。
1609	充滿知性的櫃子	房间装饰	3	排列擺放著書籍的櫃子。
1610	放滿物品的櫃子	房间装饰	3	擺滿各種書籍、小東西、雜物的櫃子
1611	高級櫃子	房间装饰	3	裝飾精緻的高級櫃子。
1612	典雅的櫃子	房间装饰	3	優雅而典雅的櫃子。
1613	可愛的櫃子	房间装饰	3	簡約可愛的櫃子。
1614	點唱機	房间装饰	3	Unavailable
1615	懷舊的燈具	房间装饰	3	木製的懷舊燈具。
1616	耐用的燈具	房间装饰	3	金屬製的耐用燈具。
1617	高級燈具	房间装饰	3	閃耀著金黃色的高級燈具。
1618	可愛的燈具	房间装饰	3	如花朵般的可愛燈具。
1619	質樸燈具	房间装饰	3	木製質樸的燈具。
1620	Unavailable	物品	3	Unavailable
1621	Unavailable	物品	3	Unavailable
