物品ID	物品名称	物品类型	稀有度	物品介绍
658	肉塊	换算道具	3	慘爪龍製成的肉塊。有著吸引肉食生物靠近的特殊腐臭味。<STYL MOJI_YELLOW_DEFAULT>（結算道具）</STYL>
659	繞行兔	换算道具	1	是習慣往小路逃跑的生物。若追著牠跑，說不定可發現意想不到的道路。
660	嚮導兔	换算道具	3	是平常不易見到的貴重生物。據說會在氣候良好時出現，並指引迷失道路的人。
661	叢林始祖鳥	换算道具	1	棲息在樹木茂密之地的生物。已發現了與其骨頭和羽毛部份特徵相似的化石。
662	始祖鳥的使者	换算道具	3	是平常不易見到的貴重生物。即使與古老時代的化石互相比對，也可發現至今從未發現過的特徵。
663	鈷閃蝶	换算道具	1	擁有閃爍著鈷藍色光輝的翅膀，是隻非常美麗的蝴蝶。
664	幽閃蝶	换算道具	3	有著虹色翅膀的夢幻蝴蝶。發現的案例極少，但報告的共通點皆是在晴天時發現。
665	淚之龜殼攀鱸	换算道具	1	身上殘留著濃厚的原始兩生類特徵的生物。在下雨時，會發出具有特色的叫聲。
666	森林蜥蜴	换算道具	1	棲息在樹上的壁虎。為了捕食聚集在亮光處的蟲類，而待在光苔附近。
667	蟻窩蜥蜴	换算道具	1	棲息在蟻窩附近的壁虎。在大型蟻窩附近，似乎可發現大量的壁虎。
668	黑暗蜥蜴	换算道具	2	喜好棲息在洞窟等陰暗地方的壁虎。因身體屬於警告色，所以避免遭到捕食。
669	月光蜥蜴	换算道具	3	尾巴發著亮光的稀有壁虎。利用以光苔成份發光的尾巴，吸引並狩獵獵物。
670	霞霧女郎	换算道具	1	棲息在古代樹森林等地的蜘蛛。會張起有如人體大小般的巢穴，並捕食黏附在網上的蟲類。
671	斯卡班傑拉	换算道具	2	棲息在地上並以腐肉為主食的蜘蛛。會成群啃食生物的屍體。經常棲息在骨頭附近。
672	憎恨鳥	换算道具	1	會啄食其他生物捕食到的屍骸的鳥。經常飛行於大型魔物上空。
673	桃源鄉	换算道具	1	會採食果實與種子的草食性鳥。因已習慣人類，發現也會棲息在調查據點周邊。
674	預兆蜻蜓	换算道具	1	尾巴會發光的生物。平時是發著白光，一旦察覺危險就會變化成紅光。
675	吉兆蜻蜓	换算道具	3	是極難遇到的稀有蟲。多於氣候惡劣時發現案例，因此推測只會在雨天時羽化。
676	鱗片蝙蝠	换算道具	1	最終進化成超小型的飛龍。為了適應洞窟生活，因此進化成與蝙蝠相似的樣貌。
677	糞金龜	换算道具	1	會滾動魔物糞便的昆蟲。所滾動的糞便大小硬度適中，正好可用於裝填投射器。
678	爆彈甲蟲	换算道具	2	以滾動來搬運岩石的昆蟲。若採集了滾動的岩石，也可作為投射器爆發彈使用。
679	粉色異形魚	换算道具	1	自太古時期便未改變樣貌一直生存下來的魚。為不被其他生物捕食，身上長著棘狀的背鰭。
680	上等粉色異形魚	换算道具	3	特大尺寸的粉色異形魚。到底要生長多久的時間，才能有這大小呢……
681	破裂龍魚	换算道具	1	有著火藥味道的魚類。用此魚的鱗片與火藥草調合，可精製出大量的火藥粉。
682	爆裂龍魚	换算道具	1	有著火藥味道的魚類。用此魚的鱗片與火藥草調合，可精製出大量的優質火藥粉。
683	上等破裂龍魚	换算道具	3	特大尺寸的破裂龍魚。不只是尺寸，連危險度也跟著提高。需小心處置。
684	上等爆裂龍魚	换算道具	3	特大尺寸的爆裂龍魚。不只是尺寸，連危險度也跟著提高。需小心處置。
685	雅緻珊瑚鳥	换算道具	2	是雌性珊瑚鳥個體的通稱。因以珊瑚為糧食的影響，身體變化為粉紅色。
686	伶俐珊瑚鳥	换算道具	3	是雄性珊瑚鳥個體的通稱。只會在繁殖時期現身，因此非常罕見。
687	行燈魚	换算道具	2	頭部有著發光突起的魚。推測是以光來吸引並捕食飛天烏帽。
688	柔毛秧雞	换算道具	3	是發現案例極少的夢幻之鳥。有著極致鬆軟的羽毛，背上可發現有共生關係的生物棲息著。
689	粗毛秧雞	换算道具	3	是發現案例極少的夢幻之鳥。有著異常粗硬的羽毛，背上可發現有共生關係的生物棲息著。
690	蛇麻古比魚	换算道具	1	可在水上敏捷跳躍移動的魚。滑翔時會展開胸鰭，以延長滯空時間與飛翔距離。
691	化石湯釜	换算道具	3	是透過化石才得以知曉其存在，被認為早已滅絕的魚。這是名留青史的世紀大發現。
692	麻痺瓦斯蛙	换算道具	1	施加衝擊就會噴射麻痺瓦斯的青蛙。其效果強勁到連大型魔物都能麻痺。
693	睡眠瓦斯蛙	换算道具	2	施加衝擊就會噴射睡眠瓦斯的青蛙。其效果強勁到連大型魔物都能陷入睡眠。
694	爆炸瓦斯蛙	换算道具	2	施加衝擊就會噴出爆炸性液體的青蛙。會引發連大型魔物都膽怯的爆炸。
695	搖曳鰻	换算道具	2	棲息在陸珊瑚台地的生物。若是配合其視線位置，便能降低其警戒心並得以接近。
696	搖曳鰻女王	换算道具	3	只會現身於月夜中的稀有生物。會在月光下乘風搖曳，有著幻想般的身姿。
697	回復蜜蟲	换算道具	1	體內累積具有回復效果蜜汁的蟲。輕輕施加衝擊，蜜汁則會飛散到周圍。
698	大回復蜜蟲	换算道具	1	體內累積具有高濃度回復效果蜜汁的蟲。淋上此蜜汁後，可得到持續性的回復效果。
699	飛天烏帽	换算道具	2	棲息在陸珊瑚台地的生物。會乘著風移動，經常能在風大的地方見到其身影。
700	搬運蟻	换算道具	1	會搬運各種東西的螞蟻。似乎極少時候也能搬運大型魔物的素材……
701	大獨角仙	换算道具	1	有著雄偉大角的大甲蟲。據推測在古代樹森林中有７個棲息點。
702	金色獨角仙	换算道具	1	閃爍金色光輝的黃金甲蟲。為夜行性生物，因此只會在夜間現身。正可謂幸運的昆蟲。
703	虹色大獨角仙	换算道具	3	閃爍虹色光芒的彩虹甲蟲。僅會在日出、日落的時間現身。正可謂夢幻的昆蟲。
704	皇帝蚱蜢	换算道具	1	擁有與皇帝之名相襯體型的蚱蜢。會敏捷地跳躍並迂迴逃走，故很難捕獲。
705	暴君蚱蜢	换算道具	3	突變後凶暴化的蚱蜢。原本推測為草食生物，但似乎連腐肉都能做為糧食。
706	閃光翅蟲	换算道具	1	施加衝擊便會發出閃光的蟲。集結的群體愈多，發出的光愈強，連大型魔物都會感到刺眼。
707	遠古鬼蝠魟	换算道具	2	乘著風，飄在天空中的生物。不擅抵抗衝擊，可利用東西給予撞擊，使其落下。
708	鐵鱟	换算道具	1	主要棲息在泥巴地形的生物。有搬運堅硬物體的習性，有可能會掉落尖銳石。
709	軍團鱟	换算道具	2	棲息在瘴氣之谷的生物。會集結成大群體，成群圍住屍骸並啃食屍肉。
710	綠寶石鱟	换算道具	3	會在氣候惡劣時現身，有著祖母綠色澤的美麗鱟。據說比寶石還難以發現。
711	堅硬竹筴魚	换算道具	1	背鰭堅硬到可用來研磨武器的魚類。
712	大堅硬竹筴魚	换算道具	3	特大尺寸的堅硬竹筴魚。背鰭有著勝過頂級品砥石的性能。
713	貪吃鮪魚	换算道具	1	什麼都吃的魚類。吃過的東西有可能會殘留在胃中。
714	貪吃鮪魚王	换算道具	3	特大尺寸的貪吃鮪魚。吃盡所有東西，不斷成長為碩大體型的貪吃王者。
715	大王旗魚	换算道具	3	上顎長得有如劍般銳利的魚類。棲息在溫暖的海域中，不會出現在海水冰冷的夜晚。
716	帝王旗魚	换算道具	3	特大尺寸的大王旗魚。有著令看到牠的對象感受壓迫的巨大身形，給人簡直是不同物種的印象。
717	黃金魚	换算道具	2	有如黃金般光輝的珍魚。鱗片與黃金有同等的價值。
718	白金魚	换算道具	2	有如白金般光輝的珍魚。那耀眼的鱗片與白金有同等的價值。
719	大黃金魚	换算道具	3	特大尺寸的黃金魚。不只是體型龐大，連色澤與光輝都達到了藝術品的境界。
720	大白金魚	换算道具	3	特大尺寸的白金魚。不只是體型龐大，連色澤與光輝都達到了藝術品的境界。
721	小金魚	换算道具	1	有如黃金般閃爍的小型珍魚。其美麗的鱗片與同份量的黃金有同等的價值。
722	小金魚王	换算道具	3	特大尺寸的小金魚。不只是體型龐大，連色澤與光輝都達到了藝術品的境界。
723	刺身魚	换算道具	1	在獵人間有著高人氣的食用魚。鱗片也富有營養價值，還有回復體力的效果。
724	大刺身魚	换算道具	3	特大尺寸的刺身魚。在偉大的自然中孕育而成，正可謂自然的恩惠。
725	火藥金魚	换算道具	2	有著火藥味道的魚類。含有特殊成分的鱗片，可當作爆藥使用。
726	大火藥金魚	换算道具	3	特大尺寸的火藥金魚。不只是尺寸，連危險度也跟著提高。需小心處置。
727	耐毒珠【１】	装饰品	4	能夠提升毒耐性技能的裝飾品。
728	耐麻珠【１】	装饰品	4	能夠提升麻痺耐性技能的裝飾品。
729	耐眠珠【１】	装饰品	4	能夠提升睡眠耐性技能的裝飾品。
730	耐絕珠【１】	装饰品	5	能夠提升昏厥耐性技能的裝飾品。
731	耐爆珠【１】	装饰品	4	能夠提升爆破異常狀態的耐性技能的裝飾品。
732	耐裂珠【１】	装饰品	4	能夠提升裂傷耐性技能的裝飾品。
733	耐防珠【１】	装饰品	4	能夠提升防禦力DOWN耐性技能的裝飾品。
734	防音珠【３】	装饰品	5	能夠提升耳塞技能的裝飾品。
735	防風珠【２】	装饰品	5	能夠提升風壓耐性的裝飾品。
736	耐震珠【２】	装饰品	5	能夠提升耐震技能的裝飾品。
737	Unavailable	装饰品	4	Unavailable
738	Unavailable	装饰品	4	Unavailable
739	攻擊珠【１】	装饰品	6	能夠提升攻擊技能的裝飾品。
740	防禦珠【１】	装饰品	5	能夠提升防禦技能的裝飾品。
741	體力珠【１】	装饰品	5	能夠提升體力增強技能的裝飾品。
742	早復珠【１】	装饰品	5	能夠提升回復速度技能的裝飾品。
743	耐火珠【１】	装饰品	4	能夠提升火耐性技能的裝飾品。
744	耐水珠【１】	装饰品	4	能夠提升水耐性技能的裝飾品。
745	耐冰珠【１】	装饰品	4	能夠提升冰耐性技能的裝飾品。
746	耐雷珠【１】	装饰品	4	能夠提升雷耐性技能的裝飾品。
747	耐龍珠【１】	装饰品	4	能夠提升龍耐性技能的裝飾品。
748	耐屬珠【１】	装饰品	5	能夠提升屬性異常狀態的耐性技能的裝飾品。
749	火炎珠【１】	装饰品	5	能夠提升火屬性攻擊強化技能的裝飾品。
750	流水珠【１】	装饰品	5	能夠提升水屬性攻擊強化技能的裝飾品。
751	冰結珠【１】	装饰品	5	能夠提升冰屬性攻擊強化技能的裝飾品。
752	雷光珠【１】	装饰品	5	能夠提升雷屬性攻擊強化技能的裝飾品。
753	破龍珠【１】	装饰品	5	能夠提升龍屬性攻擊強化技能的裝飾品。
754	毒珠【１】	装饰品	5	能夠提升毒屬性強化技能的裝飾品。
755	麻痺珠【１】	装饰品	6	能夠提升麻痺屬性強化技能的裝飾品。
756	睡眠珠【１】	装饰品	6	能夠提升睡眠屬性強化技能的裝飾品。
757	爆破珠【１】	装饰品	6	能夠提升爆破屬性強化技能的裝飾品。
758	毒瓶珠【３】	装饰品	5	能夠提升毒瓶追加技能的裝飾品。
759	痺瓶珠【３】	装饰品	6	能夠提升麻痺瓶追加技能的裝飾品。
760	眠瓶珠【３】	装饰品	6	能夠提升睡眠瓶追加技能的裝飾品。
761	爆瓶珠【３】	装饰品	6	能夠提升爆破瓶追加技能的裝飾品。
762	Unavailable	装饰品	7	Unavailable
763	解放珠【３】	装饰品	7	能夠提升屬性解放／裝填擴充技能的裝飾品。
764	達人珠【１】	装饰品	5	能夠提升看破技能的裝飾品。
765	超心珠【２】	装饰品	7	能夠提升超會心技能的裝飾品。
766	痛擊珠【２】	装饰品	5	能夠提升弱點特效技能的裝飾品。
767	縮短珠【２】	装饰品	7	能夠提升集中技能的裝飾品。
768	匠珠【３】	装饰品	7	能夠提升匠技能的裝飾品。
769	拔刀珠【２】	装饰品	7	能夠提升拔刀術【技】技能的裝飾品。
770	重擊珠【２】	装饰品	5	能夠提升破壞王技能的裝飾品。
771	ＫＯ珠【２】	装饰品	5	能夠提升KO術技能的裝飾品。
772	奪氣珠【１】	装饰品	5	能夠提升奪取耐力技能的裝飾品。
773	Unavailable	装饰品	5	Unavailable
774	飛燕珠【２】	装饰品	4	能夠提升飛燕技能的裝飾品。
775	全開珠【２】	装饰品	6	能夠提升力量解放技能的裝飾品。
776	挑戰珠【２】	装饰品	6	能夠提升挑戰者技能的裝飾品。
777	無傷珠【２】	装饰品	6	能夠提升無傷技能的裝飾品。
778	底力珠【２】	装饰品	6	能夠提升火場怪力技能的裝飾品。
779	逆境珠【１】	装饰品	4	能夠提升不屈技能的裝飾品。
780	逆上珠【２】	装饰品	6	能夠提升怨恨技能的裝飾品。
781	鼓笛珠【１】	装饰品	5	能夠提升吹笛名人技能的裝飾品。
782	增彈珠【２】	装饰品	6	能夠提升砲彈裝填數ＵＰ技能的裝飾品。
783	特射珠【１】	装饰品	6	能夠提升特殊射擊強化技能的裝飾品。
784	砲術珠【１】	装饰品	7	能夠提升砲術技能的裝飾品。
785	砲手珠【１】	装饰品	4	能夠提升砲擊手技能的裝飾品。
786	強走珠【２】	装饰品	7	能夠提升跑者技能的裝飾品。
787	體術珠【２】	装饰品	5	能夠提升體術技能的裝飾品。
788	Unavailable	装饰品	4	Unavailable
789	早氣珠【２】	装饰品	6	能夠提升急速回復耐力技能的裝飾品。
790	無食珠【１】	装饰品	4	能夠提升飢餓耐性技能的裝飾品。
791	迴避珠【２】	装饰品	5	能夠提升迴避性能技能的裝飾品。
792	跳躍珠【２】	装饰品	5	能夠提升迴避距離ＵＰ技能的裝飾品。
793	鐵壁珠【１】	装饰品	6	能夠提升防禦性能技能的裝飾品。
794	速納珠【１】	装饰品	5	能夠提升收刀術技能的裝飾品。
795	友愛珠【１】	装饰品	5	能夠提升廣域化技能的裝飾品。
796	持續珠【１】	装饰品	5	能夠提升道具使用強化技能的裝飾品。
797	節食珠【１】	装饰品	4	能夠提升滿足感技能的裝飾品。
798	快吃珠【１】	装饰品	5	能夠提升快吃技能的裝飾品。
799	研磨珠【１】	装饰品	5	能夠提升砥石使用高速化技能的裝飾品。
800	爆師珠【１】	装饰品	5	能夠提升炸彈客技能的裝飾品。
801	茸好珠【１】	装饰品	7	能夠提升最愛菇類技能的裝飾品。
802	Unavailable	装饰品	4	Unavailable
803	Unavailable	装饰品	4	Unavailable
804	Unavailable	装饰品	4	Unavailable
805	Unavailable	装饰品	4	Unavailable
806	Unavailable	装饰品	4	Unavailable
807	Unavailable	装饰品	4	Unavailable
808	加護珠【１】	装饰品	4	能夠提升精靈加護技能的裝飾品。
809	指示珠【１】	装饰品	4	能夠提升指示隨從技能的裝飾品。
810	植學珠【１】	装饰品	4	能夠提升植生學技能的裝飾品。
811	地學珠【１】	装饰品	4	能夠提升地質學技能的裝飾品。
812	渾身珠【２】	装饰品	6	能夠提升精神抖擻技能的裝飾品。
813	投石珠【１】	装饰品	5	能夠提升投射器裝填數UP技能的裝飾品。
814	潛伏珠【１】	装饰品	4	能夠提升潛伏技能的裝飾品。
815	耐衝珠【３】	装饰品	5	能夠提升減輕膽怯技能的裝飾品。
816	Unavailable	装饰品	4	Unavailable
817	Unavailable	装饰品	4	Unavailable
818	Unavailable	装饰品	4	Unavailable
819	煙復珠【１】	装饰品	4	能夠提升棉花孢子草的知識技能的裝飾品。
820	沼渡珠【１】	装饰品	4	能夠提升適應水場技能的裝飾品。
821	Unavailable	装饰品	4	Unavailable
822	Unavailable	装饰品	4	Unavailable
823	Unavailable	装饰品	4	Unavailable
824	標本珠【１】	装饰品	4	能夠提升昆蟲標本達人技能的裝飾品。
825	耐瘴珠【１】	装饰品	4	能夠提升瘴氣耐性技能的裝飾品。
826	嗅覺珠【１】	装饰品	4	能夠提升追蹤達人技能的裝飾品。
827	Unavailable	装饰品	5	Unavailable
828	威嚇珠【１】	装饰品	4	能夠提升威嚇技能的裝飾品。
829	Unavailable	装饰品	4	Unavailable
830	Unavailable	装饰品	4	Unavailable
831	Unavailable	装饰品	4	Unavailable
832	滑走珠【２】	装饰品	5	能夠提升滑走強化技能的裝飾品。
833	治癒珠【１】	装饰品	5	能夠提升體力回復量ＵＰ技能的裝飾品。
834	強彈珠【３】	装饰品	6	能夠提升通常彈‧通常箭強化技能的裝飾品。
835	貫通珠【３】	装饰品	7	能夠提升貫通彈‧龍之箭強化技能的裝飾品。
836	散彈珠【３】	装饰品	7	能夠提升散彈‧剛射強化技能的裝飾品。
837	昂揚珠【２】	装饰品	6	能夠提升強化持續技能的裝飾品。
838	絕路珠【１】	装饰品	4	能夠提升死裡逃生技能的裝飾品。
839	龍封珠【３】	装饰品	6	能夠提升龍封力強化技能的裝飾品。
840	Unavailable	装饰品	4	Unavailable
841	Unavailable	装饰品	4	Unavailable
842	整備珠【１】	装饰品	4	能夠提升整備技能的裝飾品。
843	蜜蟲傳遞口哨	物品	3	對隨從艾路下達指示，讓他使用隨從道具。
844	蜜蟲設置口哨	物品	3	對隨從艾路下達指示，讓他使用隨從道具。
845	閃光蟲籠口哨	物品	3	對隨從艾路下達指示，讓他使用隨從道具。
846	麻痺蟲籠口哨	物品	3	對隨從艾路下達指示，讓他使用隨從道具。
847	大盾挑釁口哨	物品	3	對隨從艾路下達指示，讓他使用隨從道具。
848	大盾強鎚口哨	物品	3	對隨從艾路下達指示，讓他使用隨從道具。
849	激勵法國號口哨	物品	3	對隨從艾路下達指示，讓他使用隨從道具。
850	激勵邦哥鼓口哨	物品	3	對隨從艾路下達指示，讓他使用隨從道具。
851	掠奪刀突擊口哨	物品	3	對隨從艾路下達指示，讓他使用隨從道具。
852	掉落投擲口哨	物品	3	對隨從艾路下達指示，讓他使用隨從道具。
853	壺爆彈投擲口哨	物品	3	對隨從艾路下達指示，讓他使用隨從道具。
854	火炎車口哨	物品	3	對隨從艾路下達指示，讓他使用隨從道具。
855	Unavailable	物品	0	Unavailable
856	Unavailable	物品	0	Unavailable
857	Unavailable	物品	0	Unavailable
858	Unavailable	物品	0	Unavailable
859	石塊	物品	0	裝填到投射器後發射。像是命中遠處的植物或爆彈等等，用途多多。
860	飛礫果實	物品	0	裝填到投射器後發射。像是命中遠處的植物或爆彈等等，用途多多。
861	光苔	物品	0	裝填到投射器後發射。會在命中地點發光照亮四周，亦可令飛龍種滿眼金星。
862	飛散核桃	物品	0	裝填到投射器後發射。所發出的聲音和衝擊會使魔物畏懼膽怯。
863	投射器松明彈	物品	0	裝填在投射器裡發射。可使命中的地方起火，驅逐討厭火的生物，吸引喜歡火的生物靠近。
864	投射器爆發彈	物品	0	裝填到投射器後發射。命中目標後就會爆炸，造成重大傷害。
865	投射器黏著彈	物品	0	裝填到投射器後發射。會黏在命中位置，攻擊該命中位置就會引發衝擊。
866	投射器貫通彈	物品	0	裝填到投射器後發射。可貫穿命中位置，造成傷害。
867	投射器滅龍彈	物品	0	裝填到投射器後發射。造成龍屬性傷害。
868	爆裂結晶	物品	0	裝填到投射器後發射。所發出的聲音和衝擊會使魔物畏懼膽怯。
869	投射器水流彈	物品	0	裝填到投射器後發射。擁有備水屬性性質，具有剝除魔物身上泥土的效果。
870	冰冷菇	物品	2	作為冷飲的核心素材的香菇。
871	隨從票	素材	3	在新大陸與相遇的獸人種交流的象徵。交給加工屋後，會……？
872	祖母綠殼	素材	3	綠寶石鱟的殼。有著不遜於寶石的美麗光輝。<STYL MOJI_YELLOW_DEFAULT>（換金道具）</STYL>
873	奇面族寫生	素材	3	在新大陸相遇的奇面族的寫生畫。交給加工屋後，會……？
874	強弓珠【２】	装饰品	7	能夠提升解放弓的蓄力階段技能的裝飾品。
875	心眼珠【２】	装饰品	7	能夠提升心眼／彈道強化技能的裝飾品。
876	強壁珠【２】	装饰品	6	能夠提升防禦強化技能的裝飾品。
877	剛刃珠【２】	装饰品	6	能夠提升剛刃研磨技能的裝飾品。
878	無擊珠【２】	装饰品	5	能夠提升無屬性強化技能的裝飾品。
879	恐暴龍的黑鱗	素材	5	恐暴龍的進階素材。主要經由剝取獲得。泛用性高、用途廣泛。
880	恐暴龍的黑皮	素材	5	恐暴龍的進階素材。主要經由報酬獲得。材質柔軟，常用於防具上。
881	恐暴龍的大牙	素材	5	恐暴龍的進階素材。容易經由破壞頭部部位獲得。材質堅固，常用於武器上。
882	恐暴龍的鉤爪	素材	5	恐暴龍的進階素材。主要經由剝取獲得。與龍屬性的相容性佳。
883	恐暴龍的頭殼	素材	5	恐暴龍的進階素材。容易經由破壞頭部位獲得。材質特殊，只能用於限定的裝備。
884	恐暴龍的尾巴	素材	5	恐暴龍的進階素材。容易經由切斷的尾巴獲得。材質強韌，常用於防具上。
885	恐暴龍的唾液	素材	5	恐暴龍的進階素材。容易經由掉落物獲得。材質特殊，使用上需具備技術。
886	恐暴龍的寶玉	素材	6	恐暴龍的進階素材。據說是在體內生成的稀有玉石。可飛躍性地提高武器性能。
887	絢輝龍的金鱗	素材	6	絢輝龍的進階素材。主要經由報酬獲得。有不少人為了能獲得一枚而豁出性命。
888	絢輝龍的金殼	素材	6	絢輝龍的進階素材。主要經由報酬獲得。據說和黃金具有同等價值。
889	絢輝龍的金塊	素材	6	絢輝龍的進階素材。容易經由掉落物獲得。綻放妖豔光芒，迷惑他人的黃金塊。
890	絢輝龍的金卷角	素材	6	絢輝龍的進階素材。容易經由破壞頭部部位獲得。層層堆疊的金子散發出厚重的光輝。
891	絢輝龍的金尾殼	素材	6	絢輝龍的進階素材。容易經由破壞尾巴部位獲得。融解的黃金發出豔麗的光彩。
892	絢輝龍的金煌玉	素材	7	絢輝龍的進階素材。據說是在體內生成的夢幻寶玉。能帶來難以估計的力量。
893	黃金石碎片	素材	3	純度高的黃金石碎片。雖然極為少量，但價格卻很高。<STYL MOJI_YELLOW_DEFAULT>（換金道具）</STYL>
894	黃金石塊	素材	3	形成塊狀的貴重黃金石。那綻放的光芒能擄獲任何人的心。<STYL MOJI_YELLOW_DEFAULT>（換金道具）</STYL>
895	炎妃龍的上鱗	素材	6	炎妃龍的進階素材。主要經由剝取獲得。泛用性高、用途廣泛。
896	炎妃龍之翼	素材	6	炎妃龍的進階素材。容易經由破壞翅膀部位獲得。材質柔軟，常用於防具上。
897	炎妃龍的寶玉	素材	7	炎妃龍的進階素材。據說是在體內生成的夢幻寶玉。藏有難以估計的力量。
898	炎妃龍的堅殼	素材	6	炎妃龍的進階素材。主要經由報酬獲得。材質堅硬，常用於防具上。
899	炎妃龍的鬃毛	素材	6	炎妃龍的進階素材。容易經由掉落物獲得。火耐性高，是貴重的素材。
900	炎妃龍的尾巴	素材	6	炎妃龍的進階素材。容易經由切斷的尾巴獲得。材質強韌，常用於防具上。
901	炎妃龍的尖角	素材	6	炎妃龍的進階素材。容易經由破壞頭部部位獲得。材質堅固，常用於武器上。
902	魔獸的鬃毛	素材	6	貝希摩斯的進階素材。具有強大魔力的鬃毛，據說可從天上召喚隕石。
903	魔獸的堅骨	素材	6	貝希摩斯的進階素材。結實的骨頭能夠產生驚人的怪力，身經百戰的英雄也無法匹敵。
904	魔獸的大角	素材	7	貝希摩斯的進階素材。散發出不祥鈍色光芒的巨大頭角，曾經輕易撞飛過數名光之戰士。
905	魔獸的裂爪	素材	7	貝希摩斯的進階素材。經此凶刃發出的物理攻擊，對弱者來說足以致命。
906	魔獸的尾巴	素材	7	貝希摩斯的進階素材。結實的尾巴覆滿了健壯肌肉，毫不容情地將弱者橫掃在地。
907	以太之光的碎片	素材	6	閃閃發亮的水晶碎片。蘊含著一種名為以太的異界能量。
908	開花票	素材	3	參加星辰祭【開花之宴】就能獲得的票券。可以用來交換特別的裝備或煙火。
909	納涼票	素材	3	參加星辰祭【納涼之宴】就能獲得的票券。可以用來交換特別的裝備或煙火。
910	豐收票	素材	3	參加星辰祭【豐收之宴】就能獲得的票券。可以用來交換特別的裝備或煙火。
911	閃耀票	素材	3	參加星辰祭【閃耀之宴】就能獲得的票券。可以用來交換特別的裝備或煙火。
912	感謝票	素材	3	參加星辰祭【感謝之宴】就能獲得的票券。可以用來交換特別的裝備或煙火。
913	昆蟲圖鑑【春】	素材	3	記載大角鳳蝶不為人知的生態的圖鑑。交給加工屋後，他們會製作別有風味的防具。
914	昆蟲圖鑑【夏】	素材	3	記載著大角鳳蝶的新生態的圖鑑。交給加工屋後，他們會製作別有風味的防具。
