物品ID	物品名称	物品类型	稀有度	物品介绍
1903	歷戰的冰皮	素材	9	歷戰風漂龍的Master級素材。在聚魔之地爭奪霸權的強者所持，被強化過的素材。
1904	結凍的冰結皮	素材	9	霜翼風漂龍Master級素材。棲息在聚魔之地的個體，使其特質更加強化的素材。
1905	歷戰的冰結皮	素材	9	歷戰霜翼風漂龍的Master級素材。在聚魔之地爭奪霸權的強者所持，被強化過的素材。
1906	絕命慘爪	素材	9	慘爪龍Master級素材。棲息在聚魔之地的個體，使其特質更加強化的素材。
1907	歷戰的慘爪	素材	9	歷戰慘爪龍的Master級素材。在聚魔之地爭奪霸權的強者所持，被強化過的素材。
1908	破魂兇爪	素材	9	兇爪龍Master級素材。棲息在聚魔之地的個體，使其特質更加強化的素材。
1909	歷戰的兇爪	素材	9	歷戰兇爪龍的Master級素材。在聚魔之地爭奪霸權的強者所持，被強化過的素材。
1910	王者的龍鱗	素材	9	火龍Master級素材。棲息在聚魔之地的個體，使其特質更加強化的素材。
1911	歷戰的龍鱗【赤】	素材	9	歷戰火龍的Master級素材。在聚魔之地爭奪霸權的強者所持，被強化過的素材。
1912	蒼天的龍鱗	素材	9	蒼火龍Master級素材。棲息在聚魔之地的個體，使其特質更加強化的素材。
1913	歷戰的龍鱗【蒼】	素材	9	歷戰蒼火龍的Master級素材。在聚魔之地爭奪霸權的強者所持，被強化過的素材。
1914	勇壯的彎曲角	素材	9	角龍Master級素材。棲息在聚魔之地的個體，使其特質更加強化的素材。
1915	歷戰的彎曲角	素材	9	歷戰角龍的Master級素材。在聚魔之地爭奪霸權的強者所持，被強化過的素材。
1916	暴君的黑卷角	素材	9	黑角龍Master級素材。棲息在聚魔之地的個體，使其特質更加強化的素材。
1917	歷戰的黑卷角	素材	9	歷戰黑角龍的Master級素材。在聚魔之地爭奪霸權的強者所持，被強化過的素材。
1918	暗殺者的刃翼	素材	9	迅龍Master級素材。棲息在聚魔之地的個體，使其特質更加強化的素材。
1919	歷戰的刃翼	素材	9	歷戰迅龍的Master級素材。在聚魔之地爭奪霸權的強者所持，被強化過的素材。
1920	灼炎的斷劍尾	素材	9	斬龍Master級素材。棲息在聚魔之地的個體，使其特質更加強化的素材。
1921	歷戰的斷劍尾	素材	9	歷戰斬龍的Master級素材。在聚魔之地爭奪霸權的強者所持，被強化過的素材。
1922	明銳的斬鐵尾	素材	9	硫斬龍Master級素材。棲息在聚魔之地的個體，使其特質更加強化的素材。
1923	歷戰的斬鐵尾	素材	9	歷戰硫斬龍的Master級素材。在聚魔之地爭奪霸權的強者所持，被強化過的素材。
1924	亮澤的黑曜甲	素材	9	碎龍的Master級素材。棲息在聚魔之地的個體，使其特質更加強化的素材。
1925	歷戰的黑曜甲	素材	9	歷戰碎龍的Master級素材。在聚魔之地爭奪霸權的強者所持有，被強化過的素材。
1926	強者的龍顎	素材	9	轟龍Master級素材。棲息在聚魔之地的個體，使其特質更加強化的素材。
1927	歷戰的龍顎	素材	9	歷戰轟龍的Master級素材。在聚魔之地爭奪霸權的強者所持，被強化過的素材。
1928	戰慄的黑龍顎	素材	9	黑轟龍Master級素材。棲息在聚魔之地的個體，使其特質更加強化的素材。
1929	歷戰的黑龍顎	素材	9	歷戰黑轟龍的Master級素材。在聚魔之地爭奪霸權的強者所持，被強化過的素材。
1930	滿溢雷電殼	素材	9	雷狼龍Master級素材。棲息在聚魔之地的個體，使其特質更加強化的素材。
1931	歷戰的雷電殼	素材	9	歷戰雷狼龍的Master級素材。在聚魔之地爭奪霸權的強者所持，被強化過的素材。
1932	紅蓮的爆鱗	素材	10	紅蓮爆鱗龍的Master級素材。棲息在聚魔之地的個體，使其特質更加強化的素材。
1933	歷戰的爆鱗	素材	10	歷戰紅蓮爆鱗龍的Master級素材。在聚魔之地爭奪霸權的強者所持有，被強化過的素材。
1934	染血漆黑皮	素材	10	惶怒恐暴龍Master級素材。棲息在聚魔之地的個體，使其特質更加強化的素材。
1935	歷戰的漆黑皮	素材	10	歷戰惶怒恐暴龍的Master級素材。在聚魔之地爭奪霸權的強者所持，被強化過的素材。
1936	莊嚴的蒼角	素材	10	麒麟Master級素材。棲息在聚魔之地的個體，使其特質更加強化的素材。
1937	歷戰的蒼角	素材	10	歷戰麒麟的Master級素材。在聚魔之地爭奪霸權的強者所持，被強化過的素材。
1938	獄炎的鬃毛	素材	10	炎王龍Master級素材。棲息在聚魔之地的個體，使其特質更加強化的素材。
1939	歷戰的紅鬃毛	素材	10	歷戰炎王龍的Master級素材。在聚魔之地爭奪霸權的強者所持，被強化過的素材。
1940	呼風喚雨的鋼翼	素材	10	鋼龍Master級素材。棲息在聚魔之地的個體，使其特質更加強化的素材。
1941	歷戰的鋼翼	素材	10	歷戰鋼龍的Master級素材。在聚魔之地爭奪霸權的強者所持，被強化過的素材。
1942	蒼炎的鬃毛	素材	10	炎妃龍Master級素材。棲息在聚魔之地的個體，使其特質更加強化的素材。
1943	歷戰的蒼鬃毛	素材	10	歷戰炎妃龍的Master級素材。在聚魔之地爭奪霸權的強者所持，被強化過的素材。
1944	極光的冠角	素材	10	冰呪龍Master級素材。棲息在聚魔之地的個體，使其特質更加強化的素材。
1945	歷戰的冠角	素材	10	歷戰冰呪龍的Master級素材。在聚魔之地爭奪霸權的強者所持，被強化過的素材。
1946	宵闇的昏牙	素材	10	霧瘴屍套龍Master級素材。棲息在聚魔之地的個體，使其特質更加強化的素材。
1947	歷戰的昏牙	素材	10	歷戰霧瘴屍套龍的Master級素材。在聚魔之地爭奪霸權的強者所持，被強化過的素材。
1948	幻惑的特上皮	素材	10	溟波龍Master級素材。棲息在聚魔之地的個體，使其特質更加強化的素材。
1949	歷戰的幻惑皮	素材	10	歷戰溟波龍的Master級素材。在聚魔之地爭奪霸權的強者所持，被強化過的素材。
1950	生者必滅的大剛角	素材	10	殲世滅盡龍Master級素材。棲息在聚魔之地的個體，使其特質更加強化的素材。
1951	歷戰的殲滅角	素材	10	歷戰殲世滅盡龍的Master級素材。在聚魔之地爭奪霸權的強者所持，被強化過的素材。
1952	月光的龍鱗	素材	10	金火龍Master級素材。棲息在聚魔之地的個體，使其特質更加強化的素材。
1953	歷戰的龍鱗【金】	素材	10	歷戰金火龍的Master級素材。在聚魔之地爭奪霸權的強者所持有，被強化過的素材。
1954	烈日的龍鱗	素材	10	銀火龍Master級素材。棲息在聚魔之地的個體，使其特質更加強化的素材。
1955	歷戰的龍鱗【銀】	素材	10	歷戰銀火龍的Master級素材。在聚魔之地爭奪霸權的強者所持有，被強化過的素材。
1956	涌溢的滅龍殼	素材	10	獄狼龍Master級素材。棲息在聚魔之地的個體，使其特質更加強化的素材。
1957	歷戰的滅龍殼	素材	10	歷戰獄狼龍的Master級素材。在聚魔之地爭奪霸權的強者所持，被強化過的素材。
1958	充滿鬥氣的煌毛	素材	10	金獅子的Master級素材。棲息在聚魔之地的個體，使其特質更加強化的素材。
1959	歷戰的煌毛	素材	10	歷戰金獅子的Master級素材。在聚魔之地爭奪霸權的強者所持有，被強化過的素材。
1960	Unavailable	物品	3	Unavailable
1961	Unavailable	物品	3	Unavailable
1962	Unavailable	物品	3	Unavailable
1963	Unavailable	物品	3	Unavailable
1964	裝備超級會心鏡	物品	0	切換已安裝超級會心鏡之重弩槍的瞄準方法。
1965	古代龍人的大票據	素材	5	新大陸的古代龍人所使用的票據。可在神秘鍊金的設施中，交換便利的道具。
1966	蒸氣票	素材	10	對蒸氣機關管理所有所貢獻者，技術班隊長給予的票。交給加工屋就會...？！
1967	特大龍脈炭	素材	6	內存有地脈能源的特別石炭。巨大之外，品質也很良好，是最上等的燃料。能讓人一輩子不愁吃穿…？
1968	轉福珠【３】	装饰品	10	能夠提升轉禍為福技能的裝飾品。
1969	守勢珠【２】	装饰品	9	能夠提升攻擊守勢技能的裝飾品。
1970	耐暑珠【２】	装饰品	8	能夠提升熱傷害無效技能的裝飾品。
1971	耐火珠Ⅱ【４】	装饰品	8	能夠提升火耐性技能的裝飾品。
1972	耐水珠Ⅱ【４】	装饰品	8	能夠提升水耐性技能的裝飾品。
1973	耐冰珠Ⅱ【４】	装饰品	8	能夠提升冰耐性技能的裝飾品。
1974	耐雷珠Ⅱ【４】	装饰品	8	能夠提升雷耐性技能的裝飾品。
1975	耐龍珠Ⅱ【４】	装饰品	8	能夠提升龍耐性技能的裝飾品。
1976	火炎珠Ⅱ【４】	装饰品	10	能夠提升火屬性攻擊強化技能的裝飾品。
1977	流水珠Ⅱ【４】	装饰品	10	能夠提升水屬性攻擊強化技能的裝飾品。
1978	冰結珠Ⅱ【４】	装饰品	10	能夠提升冰屬性攻擊強化技能的裝飾品。
1979	雷光珠Ⅱ【４】	装饰品	10	能夠提升雷屬性攻擊強化技能的裝飾品。
1980	破龍珠Ⅱ【４】	装饰品	10	能夠提升龍屬性攻擊強化技能的裝飾品。
1981	毒珠Ⅱ【４】	装饰品	10	能夠提升毒屬性攻擊強化技能的裝飾品。
1982	麻痺珠Ⅱ【４】	装饰品	10	能夠提升麻痺屬性強化技能的裝飾品。
1983	睡眠珠Ⅱ【４】	装饰品	10	能夠提升睡眠屬性強化技能的裝飾品。
1984	爆破珠Ⅱ【４】	装饰品	10	能夠提升爆破屬性強化技能的裝飾品。
1985	耐火珠Ⅲ【４】	装饰品	10	能夠提升火耐性技能的裝飾品。
1986	耐水珠Ⅲ【４】	装饰品	10	能夠提升水耐性技能的裝飾品。
1987	耐冰珠Ⅲ【４】	装饰品	10	能夠提升冰耐性技能的裝飾品。
1988	耐雷珠Ⅲ【４】	装饰品	10	能夠提升雷耐性技能的裝飾品。
1989	耐龍珠Ⅲ【４】	装饰品	10	能夠提升龍耐性技能的裝飾品。
1990	耐毒珠Ⅱ【４】	装饰品	8	能夠提升毒耐性技能的裝飾品。
1991	耐麻珠Ⅱ【４】	装饰品	8	能夠提升麻痺耐性技能的裝飾品。
1992	耐眠珠Ⅱ【４】	装饰品	8	能夠提升睡眠耐性技能的裝飾品。
1993	耐絕珠Ⅱ【４】	装饰品	8	能夠提升昏厥耐性技能的裝飾品。
1994	耐爆珠Ⅱ【４】	装饰品	8	能夠提升爆破異常耐性技能的裝飾品。
1995	耐裂珠Ⅱ【４】	装饰品	8	能夠提升裂傷耐性技能的裝飾品。
1996	耐防珠Ⅱ【４】	装饰品	8	能夠提升防禦力DOWN耐性技能的裝飾品。
1997	耐瘴珠Ⅱ【４】	装饰品	8	能夠提升瘴氣耐性技能的裝飾品。
1998	無食珠Ⅱ【４】	装饰品	8	能夠提升飢餓耐性技能的裝飾品。
1999	早復珠Ⅱ【４】	装饰品	8	能夠提升回復速度技能的裝飾品。
2000	潛伏珠Ⅱ【４】	装饰品	8	能夠提升潛伏技能的裝飾品。
2001	威嚇珠Ⅱ【４】	装饰品	8	能夠提升威嚇技能的裝飾品。
2002	指示珠Ⅱ【４】	装饰品	8	能夠提升指示隨從技能的裝飾品。
2003	潛伏珠Ⅲ【４】	装饰品	8	能夠提升潛伏技能的裝飾品。
2004	威嚇珠Ⅲ【４】	装饰品	8	能夠提升威嚇技能的裝飾品。
2005	指示珠Ⅲ【４】	装饰品	8	能夠提升指示隨從技能的裝飾品。
2006	特射珠Ⅱ【４】	装饰品	11	能夠提升特殊射擊強化技能的裝飾品。
2007	砲手珠Ⅱ【４】	装饰品	8	能夠提升砲擊手技能的裝飾品。
2008	植學珠Ⅱ【４】	装饰品	8	能夠提升植生學技能的裝飾品。
2009	地學珠Ⅱ【４】	装饰品	8	能夠提升地質學技能的裝飾品。
2010	環境珠Ⅱ【４】	装饰品	8	能夠提升環境利用知識技能的裝飾品。
2011	沼渡珠Ⅱ【４】	装饰品	8	能夠提升適應水場‧深雪技能的裝飾品。
2012	標本珠Ⅱ【４】	装饰品	8	能夠提升昆蟲標本達人技能的裝飾品。
2013	鼓笛珠Ⅱ【４】	装饰品	8	能夠提升吹笛名人技能的裝飾品。
2014	植學珠Ⅳ【４】	装饰品	10	能夠提升植生學技能的裝飾品。
2015	地學珠Ⅲ【４】	装饰品	10	能夠提升地質學技能的裝飾品。
2016	環境珠Ⅲ【４】	装饰品	10	能夠提升環境利用知識技能的裝飾品。
2017	標本珠Ⅲ【４】	装饰品	10	能夠提升昆蟲標本達人技能的裝飾品。
2018	持續珠Ⅱ【４】	装饰品	8	能夠提升道具使用強化技能的裝飾品。
2019	防禦珠Ⅱ【４】	装饰品	8	能夠提升防禦技能的裝飾品。
2020	持續珠Ⅲ【４】	装饰品	10	能夠提升道具使用強化技能的裝飾品。
2021	防禦珠Ⅲ【４】	装饰品	9	能夠提升防禦技能的裝飾品。
2022	砲術珠Ⅱ【４】	装饰品	8	能夠提升砲術技能的裝飾品。
2023	防音珠Ⅱ【４】	装饰品	11	能夠提升耳塞技能的裝飾品。
2024	防風珠Ⅱ【４】	装饰品	11	能夠提升風壓耐性技能的裝飾品。
2025	攻擊珠Ⅱ【４】	装饰品	11	能夠提升攻擊技能的裝飾品。
2026	達人珠Ⅱ【４】	装饰品	11	能夠提升看破技能的裝飾品。
2027	匠珠Ⅱ【４】	装饰品	11	能夠提升匠技能的裝飾品。
2028	全開珠Ⅱ【４】	装饰品	10	能夠提升力量解放技能的裝飾品。
2029	挑戰珠Ⅱ【４】	装饰品	10	能夠提升挑戰者技能的裝飾品。
2030	底力珠Ⅱ【４】	装饰品	10	能夠提升火場怪力技能的裝飾品。
2031	逆上珠Ⅱ【４】	装饰品	10	能夠提升怨恨技能的裝飾品。
2032	體術珠Ⅱ【４】	装饰品	9	能夠提升體術技能的裝飾品。
2033	迴避珠Ⅱ【４】	装饰品	10	能夠提升迴避性能技能的裝飾品。
2034	鐵壁珠Ⅱ【４】	装饰品	9	能夠提升防禦性能技能的裝飾品。
2035	友愛珠Ⅱ【４】	装饰品	9	能夠提升廣域化技能的裝飾品。
2036	奪氣‧體術珠【４】	装饰品	9	能夠提升奪取耐力技能和體術技能的裝飾品。
2037	逆境‧體術珠【４】	装饰品	8	能夠提升不屈技能和體術技能的裝飾品。
2038	絕路‧體術珠【４】	装饰品	8	能夠提升死裡逃生技能和體術技能的裝飾品。
2039	鐵壁‧體術珠【４】	装饰品	9	能夠提升防禦性能技能和體術技能的裝飾品。
2040	友愛‧體術珠【４】	装饰品	9	能夠提升廣域化技能和體術技能的裝飾品。
2041	節食‧體術珠【４】	装饰品	8	能夠提升滿足感技能和體術技能的裝飾品。
2042	投石‧體術珠【４】	装饰品	8	能夠提升投射器裝填數ＵＰ技能和體術技能的裝飾品。
2043	耐屬‧體術珠【４】	装饰品	9	能夠提升屬性異常狀態的耐性技能和體術技能的裝飾品。
2044	飛燕‧體術珠【４】	装饰品	9	能夠提升飛燕技能和體術技能的裝飾品。
2045	強走‧體術珠【４】	装饰品	9	能夠提升跑者技能和體術技能的裝飾品。
2046	早氣‧體術珠【４】	装饰品	9	能夠提升急速回復耐力技能和體術技能的裝飾品。
2047	跳躍‧體術珠【４】	装饰品	9	能夠提升迴避距離ＵＰ技能和體術技能的裝飾品。
2048	速納‧體術珠【４】	装饰品	9	能夠提升納刀術技能和體術技能的裝飾品。
2049	快吃‧體術珠【４】	装饰品	9	能夠提升快吃技能和體術技能的裝飾品。
2050	研磨‧體術珠【４】	装饰品	9	能夠提升砥石使用高速化技能和體術技能的裝飾品。
2051	爆師‧體術珠【４】	装饰品	9	能夠提升炸彈客技能和體術技能的裝飾品。
2052	茸好‧體術珠【４】	装饰品	9	能夠提升最愛菇類技能和體術技能的裝飾品。
2053	滑走‧體術珠【４】	装饰品	8	能夠提升滑走強化技能和體術技能的裝飾品。
2054	守勢‧體術珠【４】	装饰品	8	能夠提升攻擊守勢技能和體術技能的裝飾品。
2055	奪氣‧迴避珠【４】	装饰品	9	能夠提升奪取耐力技能和迴避性能技能的裝飾品。
2056	逆境‧迴避珠【４】	装饰品	8	能夠提升不屈技能和迴避性能技能的裝飾品。
2057	絕路‧迴避珠【４】	装饰品	8	能夠提升死裡逃生技能和迴避性能技能的裝飾品。
2058	鐵壁‧迴避珠【４】	装饰品	9	能夠提升防禦性能技能和迴避性能技能的裝飾品。
2059	友愛‧迴避珠【４】	装饰品	9	能夠提升廣域化技能和迴避性能技能的裝飾品。
2060	節食‧迴避珠【４】	装饰品	8	能夠提升滿足感技能和迴避性能技能的裝飾品。
2061	投石‧迴避珠【４】	装饰品	8	能夠提升投射器裝填數ＵＰ技能和迴避性能技能的裝飾品。
2062	耐屬‧迴避珠【４】	装饰品	9	能夠提升屬性異常狀態的耐性技能和迴避性能技能的裝飾品。
2063	飛燕‧迴避珠【４】	装饰品	9	能夠提升飛燕技能和迴避性能技能的裝飾品。
2064	強走‧迴避珠【４】	装饰品	9	能夠提升跑者技能和迴避性能技能的裝飾品。
2065	早氣‧迴避珠【４】	装饰品	9	能夠提升急速回復耐力技能和迴避性能技能的裝飾品。
2066	跳躍‧迴避珠【４】	装饰品	9	能夠提升迴避距離ＵＰ技能和迴避性能技能的裝飾品。
2067	速納‧迴避珠【４】	装饰品	9	能夠提升納刀術技能和迴避性能技能的裝飾品。
2068	快吃‧迴避珠【４】	装饰品	9	能夠提升快吃技能和迴避性能技能的裝飾品。
2069	研磨‧迴避珠【４】	装饰品	9	能夠提升砥石使用高速化技能和迴避性能技能的裝飾品。
2070	爆師‧迴避珠【４】	装饰品	9	能夠提升炸彈客技能和迴避性能技能的裝飾品。
2071	茸好‧迴避珠【４】	装饰品	9	能夠提升最愛菇類技能和迴避性能技能的裝飾品。
2072	滑走‧迴避珠【４】	装饰品	8	能夠提升滑走強化技能和迴避性能技能的裝飾品。
2073	守勢‧迴避珠【４】	装饰品	8	能夠提升攻擊守勢技能和迴避性能技能的裝飾品。
2074	奪氣‧攻擊珠【４】	装饰品	9	能夠提升奪取耐力技能和攻擊技能的裝飾品。
2075	逆境‧攻擊珠【４】	装饰品	8	能夠提升不屈技能和攻擊技能的裝飾品。
2076	絕路‧攻擊珠【４】	装饰品	8	能夠提升死裡逃生技能和攻擊技能的裝飾品。
2077	鐵壁‧攻擊珠【４】	装饰品	9	能夠提升防禦性能技能和攻擊技能的裝飾品。
2078	友愛‧攻擊珠【４】	装饰品	9	能夠提升廣域化技能和攻擊技能的裝飾品。
2079	節食‧攻擊珠【４】	装饰品	8	能夠提升滿足感技能和攻擊技能的裝飾品。
2080	投石‧攻擊珠【４】	装饰品	8	能夠提升投射器裝填數ＵＰ技能和攻擊技能的裝飾品。
2081	耐屬‧攻擊珠【４】	装饰品	9	能夠提升屬性異常狀態的耐性技能和攻擊技能的裝飾品。
2082	飛燕‧攻擊珠【４】	装饰品	9	能夠提升飛燕技能和攻擊技能的裝飾品。
2083	強走‧攻擊珠【４】	装饰品	9	能夠提升跑者技能和攻擊技能的裝飾品。
2084	早氣‧攻擊珠【４】	装饰品	9	能夠提升急速回復耐力技能和攻擊技能的裝飾品。
2085	跳躍‧攻擊珠【４】	装饰品	9	能夠提升迴避距離ＵＰ技能和攻擊技能的裝飾品。
2086	速納‧攻擊珠【４】	装饰品	9	能夠提升納刀術技能和攻擊技能的裝飾品。
2087	快吃‧攻擊珠【４】	装饰品	9	能夠提升快吃技能和攻擊技能的裝飾品。
2088	研磨‧攻擊珠【４】	装饰品	9	能夠提升砥石使用高速化技能和攻擊技能的裝飾品。
2089	爆師‧攻擊珠【４】	装饰品	9	能夠提升炸彈客技能和攻擊技能的裝飾品。
2090	茸好‧攻擊珠【４】	装饰品	9	能夠提升最愛菇類技能和攻擊技能的裝飾品。
2091	滑走‧攻擊珠【４】	装饰品	8	能夠提升滑走強化技能和攻擊技能的裝飾品。
2092	守勢‧攻擊珠【４】	装饰品	8	能夠提升攻擊守勢技能和攻擊技能的裝飾品。
2093	奪氣‧達人珠【４】	装饰品	9	能夠提升奪取耐力技能和看破技能的裝飾品。
2094	逆境‧達人珠【４】	装饰品	8	能夠提升不屈技能和看破技能的裝飾品。
2095	絕路‧達人珠【４】	装饰品	8	能夠提升死裡逃生技能和看破技能的裝飾品。
2096	鐵壁‧達人珠【４】	装饰品	9	能夠提升防禦性能技能和看破技能的裝飾品。
2097	友愛‧達人珠【４】	装饰品	9	能夠提升廣域化技能和看破技能的裝飾品。
2098	節食‧達人珠【４】	装饰品	8	能夠提升滿足感技能和看破技能的裝飾品。
2099	投石‧達人珠【４】	装饰品	8	能夠提升投射器裝填數ＵＰ技能和看破技能的裝飾品。
2100	耐屬‧達人珠【４】	装饰品	9	能夠提升屬性異常狀態的耐性技能和看破技能的裝飾品。
2101	飛燕‧達人珠【４】	装饰品	9	能夠提升飛燕技能和看破技能的裝飾品。
2102	強走‧達人珠【４】	装饰品	9	能夠提升跑者技能和看破技能的裝飾品。
2103	早氣‧達人珠【４】	装饰品	9	能夠提升急速回復耐力技能和看破技能的裝飾品。
2104	跳躍‧達人珠【４】	装饰品	9	能夠提升迴避距離ＵＰ技能和看破技能的裝飾品。
2105	速納‧達人珠【４】	装饰品	9	能夠提升納刀術技能和看破技能的裝飾品。
2106	快吃‧達人珠【４】	装饰品	9	能夠提升快吃技能和看破技能的裝飾品。
2107	研磨‧達人珠【４】	装饰品	9	能夠提升砥石使用高速化技能和看破技能的裝飾品。
2108	爆師‧達人珠【４】	装饰品	9	能夠提升炸彈客技能和看破技能的裝飾品。
2109	茸好‧達人珠【４】	装饰品	9	能夠提升最愛菇類技能和看破技能的裝飾品。
2110	滑走‧達人珠【４】	装饰品	8	能夠提升滑走強化技能和看破技能的裝飾品。
2111	守勢‧達人珠【４】	装饰品	8	能夠提升攻擊守勢技能和看破技能的裝飾品。
2112	奪氣‧解放珠【４】	装饰品	10	能夠提升奪取耐力技能和屬性解放／裝填擴充技能的裝飾品。
2113	逆境‧解放珠【４】	装饰品	9	能夠提升不屈技能和屬性解放／裝填擴充技能的裝飾品。
2114	絕路‧解放珠【４】	装饰品	9	能夠提升死裡逃生技能和屬性解放／裝填擴充技能的裝飾品。
2115	鐵壁‧解放珠【４】	装饰品	10	能夠提升防禦性能技能和屬性解放／裝填擴充技能的裝飾品。
2116	友愛‧解放珠【４】	装饰品	10	能夠提升廣域化技能和屬性解放／裝填擴充技能的裝飾品。
2117	節食‧解放珠【４】	装饰品	9	能夠提升滿足感技能和屬性解放／裝填擴充技能的裝飾品。
2118	投石‧解放珠【４】	装饰品	9	能夠提升投射器裝填數ＵＰ技能和屬性解放／裝填擴充技能的裝飾品。
2119	耐屬‧解放珠【４】	装饰品	10	能夠提升屬性異常狀態的耐性技能和屬性解放／裝填擴充技能的裝飾品。
2120	飛燕‧解放珠【４】	装饰品	10	能夠提升飛燕技能和屬性解放／裝填擴充技能的裝飾品。
2121	強走‧解放珠【４】	装饰品	10	能夠提升跑者技能和屬性解放／裝填擴充技能的裝飾品。
2122	早氣‧解放珠【４】	装饰品	10	能夠提升急速回復耐力技能和屬性解放／裝填擴充技能的裝飾品。
2123	跳躍‧解放珠【４】	装饰品	10	能夠提升迴避距離ＵＰ技能和屬性解放／裝填擴充技能的裝飾品。
2124	速納‧解放珠【４】	装饰品	10	能夠提升納刀術技能和屬性解放／裝填擴充技能的裝飾品。
2125	快吃‧解放珠【４】	装饰品	10	能夠提升快吃技能和屬性解放／裝填擴充技能的裝飾品。
2126	研磨‧解放珠【４】	装饰品	10	能夠提升砥石使用高速化技能和屬性解放／裝填擴充技能的裝飾品。
2127	爆師‧解放珠【４】	装饰品	10	能夠提升炸彈客技能和屬性解放／裝填擴充技能的裝飾品。
2128	茸好‧解放珠【４】	装饰品	10	能夠提升最愛菇類技能和屬性解放／裝填擴充技能的裝飾品。
2129	滑走‧解放珠【４】	装饰品	9	能夠提升滑走強化技能和屬性解放／裝填擴充技能的裝飾品。
2130	守勢‧解放珠【４】	装饰品	9	能夠提升攻擊守勢技能和屬性解放／裝填擴充技能的裝飾品。
2131	奪氣‧匠珠【４】	装饰品	10	能夠提升奪取耐力技能和匠技能的裝飾品。
2132	逆境‧匠珠【４】	装饰品	9	能夠提升不屈技能和匠技能的裝飾品。
2133	絕路‧匠珠【４】	装饰品	9	能夠提升死裡逃生技能和匠技能的裝飾品。
2134	鐵壁‧匠珠【４】	装饰品	10	能夠提升防禦性能技能和匠技能的裝飾品。
2135	友愛‧匠珠【４】	装饰品	10	能夠提升廣域化技能和匠技能的裝飾品。
2136	節食‧匠珠【４】	装饰品	9	能夠提升滿足感技能和匠技能的裝飾品。
2137	投石‧匠珠【４】	装饰品	9	能夠提升投射器裝填數ＵＰ技能和匠技能的裝飾品。
2138	耐屬‧匠珠【４】	装饰品	10	能夠提升屬性異常狀態的耐性技能和匠技能的裝飾品。
2139	飛燕‧匠珠【４】	装饰品	10	能夠提升飛燕技能和匠技能的裝飾品。
2140	強走‧匠珠【４】	装饰品	10	能夠提升跑者技能和匠技能的裝飾品。
